Time,Url,Question,Answer,點閱數,資料更新,資料檢視,資料維護
2023-12-17 12:45:23,https://www.dep.gov.taipei/News_Content.aspx?n=ACEFA960B5A4ACD7&sms=87415A8B9CE81B16&s=5C30737B8CEEDCC7,國內是否有臭蟲案件統計資料？, 臭蟲屬滋擾性害蟲，臭蟲叮咬奇癢無比，無證據會傳播人類疾病，透過清理檢查環境，可達防治效果，因此並無相關統計資料，至於是否因臭蟲叮咬就醫診治紀錄，建議向衛生單位洽詢。 ,37.0,112-12-04 17:25,112-12-04 17:25,臺北市政府環境保護局水質病媒管制科
2023-12-17 12:45:25,https://www.dep.gov.taipei/News_Content.aspx?n=ACEFA960B5A4ACD7&sms=87415A8B9CE81B16&s=24080D2338DC0A49,國外報導臭蟲肆虐且對藥劑產生抗藥性，是否屬實？, 1.媒體報導歐美國家的臭蟲對除蟲菊精類藥劑產生抗藥性，經洽詢本署環境用藥管理專家諮詢會委員臺灣大學徐爾烈名譽教授，臭蟲係易隨旅運行李等攜帶移動之滋擾性昆蟲，國外帶入國內臭蟲是否有抗藥性尚待證實。2.國內核准登記用於防治臭蟲之一般環境用藥係經藥效試驗有效產品，包含除蟲菊精類（第滅寧、治滅寧、必列寧、百滅寧、畢芬寧…等）成分藥劑外，尚有含新菸鹼類（益達胺）成分藥劑，民眾可依需求選用。 ,35.0,112-12-04 17:23,112-12-04 17:23,臺北市政府環境保護局水質病媒管制科
2023-12-17 12:45:27,https://www.dep.gov.taipei/News_Content.aspx?n=ACEFA960B5A4ACD7&sms=87415A8B9CE81B16&s=4173B0EF8A368DED,居家發現臭蟲，如何處理？, 家中發現臭蟲，可以下列方式處理：曝曬：草蓆或箱子發現臭蟲，可裝入塑膠袋中並綁緊進行曝曬，袋中溫度超過65℃可防治臭蟲。清洗：懷疑有臭蟲的衣物，則可集中裝入塑膠袋中綁緊，避免臭蟲逃逸，然後拿到洗衣機清洗。熱蒸：可使用熱蒸汽熨斗進行蒸汽防治。勤捉：善用吸塵器勤捉，有效防治臭蟲。5.選用合法環境用藥：如果民眾要使用化學防治，可購買環境部核准登記用於防治臭蟲之一般環境用藥，目前核准臭蟲的環境用藥許可證共有6張、2張特殊環境用藥許可證，相關資訊可至化學署環境用藥許可證及病媒防治業網路查詢系統查詢(網址https://mdc.moenv.gov.tw/PublicInfo)，防蟲也要注意自身安全，當臭蟲存在範圍較廣、情形嚴重時，可請合格的病媒防治除蟲公司代為處理。 ,47.0,112-12-04 17:24,112-12-04 17:24,臺北市政府環境保護局水質病媒管制科
2023-12-17 12:45:28,https://www.dep.gov.taipei/News_Content.aspx?n=ACEFA960B5A4ACD7&sms=87415A8B9CE81B16&s=C7230D04B86C799D,如何避免將臭蟲帶回家？, 1.國外旅遊回來(1)在國外旅行時，應檢查居住地的床舖、被褥是否有臭蟲或臭蟲排遺（血液斑）。(2)國外旅行回來後，立即清洗衣服和檢查行李，避免攜帶臭蟲回家。2.居家環境檢查及管理(1)環境檢查a.床罩、床單、枕頭套、地毯、床墊下、床架下、壁紙的接縫處、床沿等處，看看是否發現有臭蟲或臭蟲排遺（血液斑）。b.二手傢俱搬回家前，檢查有沒有臭蟲的蹤跡。(2)環境管理a.床罩、床單、枕頭套應經常清洗。b.地毯應時常以吸塵器清理。c.壁紙接縫處應黏著好。d.牆壁隙縫應填補。e.減少雜物堆積。 ,22.0,112-12-04 17:20,112-12-04 17:20,臺北市政府環境保護局水質病媒管制科
2023-12-17 12:45:28,https://www.dep.gov.taipei/News_Content.aspx?n=ACEFA960B5A4ACD7&sms=87415A8B9CE81B16&s=0D160EDD3E4B1870,臭蟲從哪裏來？躲藏在哪裏？, 由於國際旅遊往返頻繁，民眾自國外回來後，如果不注意，就可能自國外將臭蟲帶回家。臭蟲常藏身在牆壁、地板的裂痕或裂縫中，也可能藏在床墊下或是老舊家具中。臭蟲通常在黎明前吸血，每次吸血約5~10分鐘，白天躲藏在掩蔽處慢慢消化吸食的血液。臭蟲叮咬奇癢無比，且會持續1-2週，被咬後如為一般紅腫，可用外用止癢藥，但如果情況嚴重者，則應就醫診治。 ,37.0,112-12-04 16:45,112-12-04 16:45,臺北市政府環境保護局水質病媒管制科
2023-12-17 12:45:30,https://www.dep.gov.taipei/News_Content.aspx?n=ACEFA960B5A4ACD7&sms=87415A8B9CE81B16&s=4437B02415917E97,臭蟲是什麼？, 臭蟲又稱床蝨(bedbug) ，與人類生活相關的臭蟲有二種，一為溫帶臭蟲(Cimex lectularius)，另一為熱帶臭蟲(C. hemipterus)。臭蟲的生命週期，一般可存活一年，依食物充足否及溫度不同，雌性臭蟲可產卵200至400顆。 ,38.0,112-12-04 16:51,112-12-04 16:51,臺北市政府環境保護局水質病媒管制科
2023-12-17 12:45:32,https://www.dep.gov.taipei/News_Content.aspx?n=ACEFA960B5A4ACD7&sms=87415A8B9CE81B16&s=3AD811CAE820CA23,可以現金繳納木柵垃圾焚化廠垃圾代焚化處理費嗎?, 代清除機構受託清除廢棄物經本局同意進廠者，應依本局調度進廠，並採每半個月以金融機構匯款方式繳納本廠垃圾代焚化處理費。不定時產出廢棄物(臺北市境內產出為限)，經本廠同意自行清運進廠者，則請以悠遊卡支付，進廠前請將悠遊卡加值至足額，若需以現金付費者，本廠僅於週三開放臨櫃現金支付，請申請於該時段進廠。若您尚有繳費上問題請撥服務專線(02)2230-0800分機321由專人為您解說。 ,113.0,112-10-26 13:16,112-11-17 15:02,臺北市政府環境保護局木柵垃圾焚化廠
2023-12-17 12:45:35,https://www.dep.gov.taipei/News_Content.aspx?n=ACEFA960B5A4ACD7&sms=87415A8B9CE81B16&s=41CF9278DCE0DDB8,申請臺北市112年度住宅社區創能儲能及節能補助E方案(補助低收入戶汰換電冰箱)，須準備哪些文件？, 住宅社區創能儲能及節能補助E方案，請準備下列文件： 申請表。申請者身分證明文件：國民身分證或中華民國居留證正反面影本。低收入戶證明文件影本。補助黏貼地址證明文件：最近半年內其中一期臺灣電力股份有限公司「非營業」類用戶電費單影本（須包含：電號、用電地址、用電類型）。載明產品型號之購買證明文件(統一發票收執聯或收據)影本（購買證明文件未載明產品型號時，應加附產品保證書或出貨單等相關單據）。產品1級能效證明影本。廢四機回收聯單正本或影本（請向販售業者索取）。申請人金融機構存摺影本(戶名應與申請人一致，含戶名及帳號)。注意事項：1. 購置的發票或收據日期須在112年9月18日(含)以後。2. 申請者可以於「臺北市政府智慧節電網」（網址:http://energy.gov.taipei）最新消息下載申請書（方案E）。3.申辦方式有臨櫃、郵寄等2種-郵寄申請：請寄至地址【110204臺北市信義區市府路1號7樓北區，環保局氣候變遷管理科】。臨櫃申請：請於上班日上午9時至中午12時、下午2時至5時止，親送至【市府路1號1樓東區環保局專櫃收件】。 ,199.0,112-10-24 10:58,112-11-21 14:22,臺北市政府環境保護局
2023-12-17 12:45:37,https://www.dep.gov.taipei/News_Content.aspx?n=ACEFA960B5A4ACD7&sms=87415A8B9CE81B16&s=92091817536462C1,申請臺北市112年度住宅社區創能儲能及節能補助D方案(補助住宅安裝玻璃隔熱膜)，須準備哪些文件？, 住宅社區創能儲能及節能補助D方案，請準備下列文件：申請表。申請者身分證明文件：國民身分證或中華民國居留證正反面影本。補助黏貼地址證明文件：最近半年內其中一期臺灣電力股份有限公司「非營業」類用戶電費單影本（須包含：電號、用電地址、用電類型）。載明產品型號之購買證明文件（統一發票收執聯或收據等，日期應於當年度公告受理日期以後），購買證明文件未載明產品型號時，應加附產品保證書或出貨單等相關單據。檢附施工黏貼前、後照片。申請玻璃隔熱膜補助條件文件（請於購買施作前先行確認黏貼之玻璃隔熱膜條件是否符合本計畫要求）。申請人金融機構存摺影本（須有帳號及戶名）佐證資料影本。注意事項：購置的發票或收據日期須在112年9月18日(含)以後。如已確定欲購置品牌型號，購置前，檢測報告部分如不確定，可先來電詢問該型號製造廠商是否已有提供符合本計畫之檢測報告予本局，以避免貼錯致無法申請補助。申請者請於「臺北市政府智慧節電網」（網址:http://energy.gov.taipei）最新消息下載申請書（方案D）。申辦方式有臨櫃、郵寄等2種-郵寄申請：請寄至地址【110204臺北市信義區市府路1號7樓北區，環保局氣候變遷管理科】。臨櫃申請：請於上班日上午9時至中午12時、下午2時至5時止，親送至【市府路1號1樓東區環保局專櫃收件】。 ,226.0,112-10-24 11:02,112-11-21 14:22,臺北市政府環境保護局
2023-12-17 12:45:37,https://www.dep.gov.taipei/News_Content.aspx?n=ACEFA960B5A4ACD7&sms=87415A8B9CE81B16&s=32A05FEA8517A51A,有關廢土如何丟棄?, 有關家戶廢棄或盆栽土壤，請與資源回收物分開裝妥攜出後，交付線上資源回收車清潔人員處理。 ,598.0,112-11-15 18:10,112-11-15 18:10,臺北市政府環境保護局資源循環管理科
2023-12-17 12:45:39,https://www.dep.gov.taipei/News_Content.aspx?n=ACEFA960B5A4ACD7&sms=87415A8B9CE81B16&s=9C78F20F04071EA1,現場違規行為民眾於收受舉發通知書後，若未收到裁處書或裁處書未領遭郵局退回時，應如何處理？,     一般現場違規之舉發案件，經舉發單位資料查對整理後，舉發通知書始送交裁處單位進行裁處作業，裁處案件經建檔製作裁處書及列印後，裁處書以大宗郵件交郵局以雙掛號郵寄，若郵寄時遭退回或未完成合法送達，將以戶籍地址再次寄送裁處書。    若民眾於2至5個月仍未收到裁處書，可直接電洽大隊詢問 (電話：02-25923600轉277)。 ,199.0,112-11-14 11:20,112-11-14 11:20,臺北市政府環境保護局環保稽查大隊
2023-12-17 12:45:39,https://www.dep.gov.taipei/News_Content.aspx?n=ACEFA960B5A4ACD7&sms=87415A8B9CE81B16&s=6054691617332AA6,瓶罐回收時之液體或氣體之處理方式, 一、持有盛裝氣體之高壓瓶罐處理（如髮膠、造型噴霧、芳香劑、瓦斯罐、殺蟲器等）：因含有易燃氣體或有機溶劑，遇高溫或壓縮易引爆，回收前應至空曠處將內容物排出或排出至可吸附材質。瓦斯桶則請民眾循逆向回收管道回收，交付原購買店家進行回收再利用。二、持有盛裝液體之瓶罐處理（如寶特瓶、鐵鋁罐、玻璃瓶罐、塑膠容器瓶罐等）：請於回收前先倒空容器內之殘餘物並清洗、壓扁（玻璃容器清洗即可）後送交本市資源回收車回收。三、裝有環境衛生用藥成分瓶罐之處理：請盡量使用完畢，並建議以清水反覆沖洗三次，勿殘餘環境衛生用藥等有害物質於容器內，可於每周一、二、四、五、六將使用完畢並沖洗後之廢容器交付本市資源回收車回收（須與其他回收物分開裝袋）。 ,831.0,112-11-15 18:11,112-11-15 18:11,臺北市政府環境保護局資源循環管理科
2023-12-17 12:45:42,https://www.dep.gov.taipei/News_Content.aspx?n=ACEFA960B5A4ACD7&sms=87415A8B9CE81B16&s=6DD4E37CBA47D4CE,如何申請垃圾代焚化處理?申請核准後配合事項為何?, 1.代焚化處理申請：  (1) 透過「市民服務大平臺」網址：搜尋「代處理一般事業廢棄物及一般廢棄物申請(內湖垃圾焚化廠)」，選擇網路申辦...等等方式。  (2)本廠官網：首頁左方點選申請案件，於「代處理一般事業廢棄物及一般廢棄物申請(內湖垃圾焚化廠)」(自動連結至市民服務大平臺 )，選擇網路申辦...等等方式。 2.代焚化核准後配合事項：經審查符合進廠管理辦法規定之可燃廢棄物，即以簡訊或Email通知進廠時間，再由申請人自運廢棄物進廠，由本廠代焚化處理。3.若您對申請或配合進廠等尚有疑問時，請撥服務專線02-27961833轉213由承辦人為您解說。 ,298.0,112-11-15 16:37,112-11-15 16:37,臺北市政府環境保護局內湖垃圾焚化廠
2023-12-17 12:45:44,https://www.dep.gov.taipei/News_Content.aspx?n=ACEFA960B5A4ACD7&sms=87415A8B9CE81B16&s=F6E2D972348C0C2C,請問市區內各類場所、工程及設施噪音管制標準多少?, 噪音管制法第9條，噪音管制區內之場所、工程及設施，所發出之聲音不得超出噪音管制標準。(管制標準值詳如附件) ,346.0,112-11-16 11:01,112-11-16 11:01,臺北市政府環境保護局空污噪音防制科
2023-12-17 12:45:44,https://www.dep.gov.taipei/News_Content.aspx?n=ACEFA960B5A4ACD7&sms=87415A8B9CE81B16&s=78D31586179144E0,110-112年臺北市電動機車補助(振興加碼再延長) Q&A," Q1:「振興加碼」方案內容為何?A1：為減輕民眾購車負擔並加大後疫情時代振興力道，本府112年持續推動「電動機車補助計畫　振興加碼專案」，臺北市民在112年1月1日起至112年12月31日止，凡新購或汰舊換新購重型電動機車，輕型、小型輕型電動機車者，額外加碼補助8,000元，有意願換購或新購電動機車之民眾，請儘速提出申請。Q 2:加上「振興加碼」加碼補助8,000元後，臺北市民申請汰舊換購或新購電動機車最高可獲多少補助?A2：1. 為減輕民眾購車負擔並加大後疫情時代振興力道，持續推出「振興加碼」方案，針對淘汰1至4期老舊機車換購電動機車、或新購電動機車，臺北市民購買電動機車日期(即發票開立日期)只要在今(112)年1月1日起至12月31日止，除可獲得政府既有的電動機車換(新)購補助外，可額外再獲得新臺幣8,000元的「振興加碼」加碼補助金，112年汰購重型電動機車最高補助可獲得2萬8,800元（含環境部淘汰老舊機車補助每輛2千元、減碳獎勵金1千5百元、減空污獎勵金1千元與回收獎勵金300元，及經濟部產業發展署購買重型電動機車補助每輛7千元）。2. 以Gogoro3市售69,980元試算，一般民眾扣除112年汰購最高補助後，車價約41,180元。【詳細內容請參考下方附件】 Q3：「振興加碼」的補助對象為何?電動機車購買地點一定要在臺北市嗎?A3：1. 符合110-112年度機車汰舊換新補助計畫補助對象資格，及新買電動機車購車發票在112年1月1日至112年12月31日期間，且在購買日期之隔年1月10日前提出申請者，即屬於「振興加碼」加碼補助對象。2. 「振興加碼」方案未要求電動機車購買地點一定要在臺北市。Q4：中低以及低收入戶是否有加碼補助? 已領中低及低收加碼補助還可再領振興加碼補助嗎?A4：1. 有。臺北市中低以及低收入戶除一般補助外，再加碼補助1萬元/輛，1人申請1次為限。2. 可。只要符合「振興加碼」補助對象，已領中低及低收加碼補助還可再領振興加碼補助，兩者不牴觸。Q5：一般市民申請電動機車補助資格限制為何?A5：1.汰購電動機車：年滿18歲以上並設籍於本市需達1年(含)以上之市民，年齡及設籍認定以購車發票日期為準，且淘汰之老舊機車(出廠日期於96年6月30日前)須於109年12月31日(含)前車籍登記於本市。2.新購電動機車：年滿18歲以上並設籍於本市需達1年(含)以上之市民，年齡及設籍認定以購車發票日期為準。【詳細內容請參考下方附件】Q6：補助對象及條件應注意事項？A6：1. 每輛老舊機車換購或新購電動機車僅能獲得1次補助款，每人限補助購買1輛電動機車。2. 公務機關、公營事業、公立學校、接受政府機關委託案，且契約強制規定需使用電動機車執行相關業務者、機車整車或零組件生產或銷售商，以及將新購機車用於租賃、共享者，所購買之車輛則不列入補助對象。3. 惟在前述單位服務任職之員工，仍得以個人名義申請補助，另公務人員使用國民旅遊卡購買電動機車，並依本辦法規定申請補助者，應切結未重複申請休假補助。4. 符合「110-112年電動機車補助計畫」者且發票購買日期介於112年1月1日起至112年12月31日(含)間，可享振興加碼補助。5. 申請人於本計畫施行前已依環境部「淘汰二行程機車、新購電動二輪車補助辦法」及「機車汰舊換新補助辦法」申請電動二輪車或七期燃油機車補助者，不予補助(含振興加碼)。Q7：如何申請？A7：補助採線上申請，申請網址為：http://www.envimac.com.tw/MotorSubsidy/Q8：電動機車補助車款有哪些?A8：由經濟部認可之國內合格電動機車製造商所生產並取得合格產品認可之重型、輕型及小型輕型等級電動機車。Q9：申請補助期限為何?一、「淘汰老舊機車換購電動機車」 於110年1月1日至112年12月31日間，當年度報廢車輛應將相關補助申請文件於隔年度1月10日前上傳至本局線上申請系統辦理，另於112年1月1日至112年12月31日期間汰舊換新購置重型電動機車輕型、小型輕型電動機車者，可享振興加碼補助，需於113年1月10日前完成線上申請，逾期即不予受理。二、「新購電動機車」於110年1月1日至112年12月31日間，應將相關補助申請文件於購車發票日期隔年度1月10日前上傳至本局線上申請系統辦理，另於112年1月1日至112年12月31日期間新購置重型電動機車輕型、小型輕型電動機車者，可享振興加碼補助，需於113年1月10日前完成線上申請，逾期即不予受理。 ",3321.0,112-11-15 15:15,112-11-15 15:15,臺北市政府環境保護局空污噪音防制科
2023-12-17 12:45:46,https://www.dep.gov.taipei/News_Content.aspx?n=ACEFA960B5A4ACD7&sms=87415A8B9CE81B16&s=050B462E88BC6511,112年7月1日起臺北市機車排氣定期檢驗全面電子化通知Q&A, Q1：定檢通知全面電子化從什麼時候開始實施？定檢通知全面電子化後，每年還會收到定檢通知明信片嗎？A1：因應2050年淨零排放及落實省紙減碳政策，自112年7月1日起，本市機車排氣定檢通知全面電子化，並停止寄發紙本明信片通知。若想持續收到定檢通知，除可利用本市LINE@「定檢好康愛報報」(ID搜尋：@tpemoto)註冊定檢鬧鐘外，亦可透過環境部「機車E定通」申請E-mail通知，或下載環境部「環境即時通」APP設定推播訊息通知，每年於應定檢期間即可收到機車排氣定期檢驗電子通知。此外，若擔心年長者較不擅長使用電子化資訊，本局亦有提供本市機車定檢站定檢提醒貼紙，民眾定檢時可向定檢站索取，張貼於置物箱或車體上或其他適合位置，隨時提醒每年定檢時間。 Q2：如何申請「機車排氣定期檢驗電子化通知」？A2：【詳細內容請參考下方附件：臺北市環保局機車排氣定檢通知電子化懶人包】         1.本市LINE@「定檢好康愛報報」：加入LINE@帳號「定檢好康愛報報」後開啟下方選單，點選「註冊開啟定檢鬧鐘」，填寫車輛基本資料即註冊完成。【詳細內容請參考下方附件：LINE接收定檢通知登錄流程】2.環境部「機車E定通」E-mail：進入環境部「機車排氣定期檢驗資訊管理系統」，點選「機車E定通」，勾選同意條款後，再依序填入車號、車主姓名及E-mail，登錄完成後系統會自動發送確認信，填入驗證碼即完成。【詳細內容請參考下方附件：環境部「機車E定通」申請流程】3.環境部「環境即時通」APP：下載並打開 APP後，點選下方點按「地圖顯示」，左下角選擇「機車排氣定檢站」，再點擊右下角開啟小鈴鐺設定車牌號碼。【詳細內容請參考下方附件：「環境即時通」APP定檢通知設定流程】 Q3：假設我有多台機車，能否都收到定檢電子化通知呢？A3：可以！車主可於LINE@「定檢好康愛報報」註冊多台車號，只要是出廠滿5年且設籍臺北市之機車，完成LINE@註冊後於應定檢期間即可收到定檢電子通知；車籍在其他縣市者，可選擇環境部「機車E定通」或下載環境部「環境即時通」APP，亦能設定多台車號。 Q4：我的機車車籍在臺北市，但目前在其他縣市使用，是否也會收到Line的定檢通知？A4：可以！只要是機車設籍臺北市的車主，完成Line@註冊後，於應定檢期間即可收到「機車排氣定檢電子通知」。 Q5：完成註冊後，為什麼沒有收到定檢通知？ A5：1.本市LINE@「定檢好康愛報報」：本市LINE@「定檢好康愛報報」的定檢通知服務目前僅限設籍臺北市之機車，車主於LINE@「定檢好康愛報報」註冊時須參考格式範例填寫正確「車輛基本資料」，若非設籍臺北市之機車，或因基本資料填寫不完整導致無法查詢車牌號碼，車主將無法收到定檢通知；車主若發現填寫資料有誤，可以再次進入註冊頁面更正內容後重新送出，即可按時收到定檢通知。若針對「定檢好康愛報報」有任何操作上的問題，可於上班時間電洽(02)2720-8889轉7246，會有專人提供說明。2.環境部「機車E定通」E-mail：環境部「機車E定通」登錄時會檢核車號與車主姓名須與行照資料一致，若操作系統時出現錯誤訊息，可電洽環境部服務電話:(02)2339-3250轉211。 ,450.0,112-11-15 17:15,112-11-15 17:15,臺北市政府環境保護局空污噪音防制科
2023-12-17 12:45:47,https://www.dep.gov.taipei/News_Content.aspx?n=ACEFA960B5A4ACD7&sms=87415A8B9CE81B16&s=AE8B9F97C187E693,申請住宅汰換節能家電補助，須準備哪些文件？, (住宅汰換節能家電補助自111年11月26日起停止受理)申請住宅汰換節能家電補助，請準備下列文件：申請者身分證明文件：國民身分證或中華民國居留證正反面影本（可自行註明「限111年度住宅家電補助使用」或由本局代為註記）。補助品項安裝地址證明文件：最近半年內其中一期臺灣電力股份有限公司表燈非營業用戶電費單影本（含電號）。 載明產品型號之購買證明文件（統一發票收執聯或收據等，日期應於當年度公告日期以後），購買證明文件未載明產品型號時，應加附(於其他項目上傳)產品保證書或出貨單等相關單據。汰舊換新佐證文件：廢四機回收聯單第一、第二或第三聯之正本或影本(申請者應委託販賣業者依循行政院環境保護署廢四機逆向回收機制)。申請人之銀行或郵局等金融機構存摺封面（須有帳號及戶名）影本或網銀帳戶（須有帳號及戶名）佐證資料影本。注意事項：申辦方式有臨櫃、網路及郵寄等3種，臨櫃申辦地點於 每一行政區各有一處(如附表)。郵寄申辦者請於「臺北市政府智慧節電網」(網址:http://energy.gov.taipei)最新消息下載申請書 。購買的發票或收據日期須在111年7月18日(含)以後。      如有相關問題可撥打專線服務電話(市話請撥0800- 661-668，手機請撥02-8978-8816)。 ,871.0,112-04-21 14:31,112-11-21 14:22,臺北市政府環境保護局氣候變遷管理科
2023-12-17 12:45:49,https://www.dep.gov.taipei/News_Content.aspx?n=ACEFA960B5A4ACD7&sms=87415A8B9CE81B16&s=2F8C7845074BC81A,申請住宅汰換節能家電補助，如何申請?, (住宅汰換節能家電補助自111年11月26日起停止受理)本市111年度「住宅汰換節能家電補助」申請資訊如下：1.申請期間自111年7月18日至111年11月30日或經費用罄為止。2.申辦方式有臨櫃、網路及郵寄等3種，臨櫃申辦地點於每一行政區各有1處（參照附表）。3.申請文件為申請表、身分證正反面影本、發票(須載明新機型號，新機須為一級能效)影本、半年內任一期電費單影本、廢四機聯單、申請人金融機構存摺封面影本等文件，相關申請表單及資訊可至臺北市政府智慧節電網之最新消息下載。4.如有相關問題可撥打專線服務電話（市話請撥 0800-661-668，手機請撥 02-8978-8816）。 ,421.0,112-05-17 14:52,112-11-21 14:22,臺北市政府環境保護局氣候變遷管理科
2023-12-17 12:45:49,https://www.dep.gov.taipei/News_Content.aspx?n=ACEFA960B5A4ACD7&sms=87415A8B9CE81B16&s=8D027A04257A11D0,家裡有舊衣要如何回收及可與不可回收項目有哪些？（民眾版）, （一）經本府核可設置之回收箱會完整標示核准單位、核准字號、設置單位、 連絡電話等，民眾可至臺北市政府環境保護局網站查詢核准設置地點或至台北通APP開啟手機定位進入周邊服務探索舊衣回收箱設施地點。（二）經過清潔整理堪使用的舊衣，如外衣、外褲、裙子、洋裝、背心、外套、西裝、女性乾淨內衣具彈性等，均可回收。不可回收的項目為棉被、枕頭、床單、床罩、帽子、內衣褲、 鞋襪、窗簾、桌（浴、毛）巾、圍裙、地毯、踏墊、毛線、 皮帶、腰帶、皮包、手套、坐墊、絨毛玩具、布偶、布袋、 布條等其他紡織品。 ,3168.0,112-12-14 11:36,112-12-14 11:36,臺北市政府環境保護局環境清潔管理科
