Time,Url,Question,Answer,點閱數,資料更新,資料檢視,資料維護
2023-12-17 12:47:51,https://www.dep.gov.taipei/News_Content.aspx?n=ACEFA960B5A4ACD7&sms=87415A8B9CE81B16&s=462B76683C8B17A5,未用完之專用垃圾袋是否可自行販售？, 依「臺北市一般廢棄物清除處理費徵收自治條例」第8條及第9條，未經環保局同意，私自販售、網路拍賣專用垃圾袋者，處新臺幣3萬元以上10萬元以下罰鍰。 ,1611.0,112-11-15 14:07,112-11-15 14:07,臺北市政府環境保護局資源循環管理科
2023-12-17 12:47:51,https://www.dep.gov.taipei/News_Content.aspx?n=ACEFA960B5A4ACD7&sms=87415A8B9CE81B16&s=57A3A5D290AC1CFC,於各代售點購買專用垃圾袋除以現金支付外，是否得以儲值卡或信用卡等其它支付工具支付?, 專用垃圾袋為垃圾清除處理費計費之工具，屬超商之「代收代付」項目，購買專用垃圾袋除現金支付以外，目前連鎖超商業者已能使用悠遊卡或其他電子支付方式購買專用垃圾袋。 ,20751.0,112-11-15 13:36,112-11-15 13:36,臺北市政府環境保護局資源循環管理科
2023-12-17 12:47:53,https://www.dep.gov.taipei/News_Content.aspx?n=ACEFA960B5A4ACD7&sms=87415A8B9CE81B16&s=C1E77DF17AE0CCF2,環保兩用袋是否有販售資格限制？, 凡在本市有實體門市且與環保局簽訂專用垃圾袋代售契約之業者即可販售環保兩用袋。 ,1855.0,112-11-15 13:59,112-11-15 13:59,臺北市政府環境保護局資源循環管理科
2023-12-17 12:47:53,https://www.dep.gov.taipei/News_Content.aspx?n=ACEFA960B5A4ACD7&sms=87415A8B9CE81B16&s=E38F3CB387CBCE76,請問專用垃圾袋售價及每包個數？, 一、目前本市販售之專用袋共有七種型號，102年2月28日前每公升售價為0.45元，102年3月1日起，每公升售價調降為每公升0.36元。二、每包個數及調降前、後之售價如下：3公升袋：每包20個，新售價21元(原售價27元)。5公升袋：每包20個，新售價36元(原售價45元)。14公升袋：每包20個，新售價100元(原售價126元)。25公升袋：每包20個，新售價180元(原售價225元)。33公升袋：每包20個，新售價237元(原售價297元)。76公升袋：每包10個，新售價273元(原售價342元)。120公升袋：每包5個，新售價216元(原售價270元)。三、另於107年1月1日推出3款環保兩用袋，型號分別為小、中及大型袋，售價分別為1元、2元及5元。 ,614120.0,112-11-15 13:39,112-11-15 13:39,臺北市政府環境保護局資源循環管理科
2023-12-17 12:47:55,https://www.dep.gov.taipei/News_Content.aspx?n=ACEFA960B5A4ACD7&sms=87415A8B9CE81B16&s=0C2F7886D704B140,民眾於代售點「購買」之專用垃圾袋後，若有退換貨需要，如何處理?, 一、專用垃圾袋如因品質瑕疵或型號購買錯誤(上述均指內袋個數完整者) ，請持原購買憑證或收據辦理換貨，價格以更換當時之售價計算。二、民眾因搬離至雙北市以外，如有使用不到且「包裝完整未開封」的專用垃圾袋，煩請出示原購買憑證及遷移證明，皆可辦理退貨。三、本局辦理專袋之退貨係委由專用垃圾袋配送商辦理，因非原專袋之代售商，故將扣除手續費再予核算退費金額。四、只要符合上述退、換貨機制，都可以電洽環保局資源循環管理科，聯絡電話：1999轉4548、7301，或於上班時間內，上午8時至下午6時，撥打專用垃圾袋免付費服務專線（TEL：0800-064-088、0800-064-938），由本局專用垃圾袋配送商提供「退、換袋」服務。 ,4389.0,112-11-15 14:06,112-11-15 14:06,臺北市政府環境保護局資源循環管理科
2023-12-17 12:47:57,https://www.dep.gov.taipei/News_Content.aspx?n=ACEFA960B5A4ACD7&sms=87415A8B9CE81B16&s=398738427FD969AA,營建開發案工程，多大規模以上，要申報營建工地逕流廢水污染削減計畫？, 答：依據行政院環境保護署106年12月27日公告「水污染防治法事業分類及定義」之業別42營建工地符合以下規模者應應依「水污染防治措施及檢測申報管理辦法」第10條規定，營建工地應於施工前檢具逕流廢水污染削減計畫報本局核准。一、從事依環境影響評估法規定應實施環境影響評估之開發行為。二、屬空氣污染防制法第一級營建工程之建築工程、道路、隧道工程、管線工程、橋梁工程、區域開發工程之事業。  ,37918.0,112-12-05 15:21,112-12-05 15:21,臺北市政府環境保護局水質病媒管制科
2023-12-17 12:47:57,https://www.dep.gov.taipei/https://www.dep-recycle.gov.taipei/News.aspx?n=82F9F58F3CF385CE&sms=C6AD0B57BFF13389,「環保小撇步」從哪裡可以下載？,[],,112-12-05 15:21,112-12-05 15:21,臺北市政府環境保護局水質病媒管制科
2023-12-17 12:48:00,https://www.dep.gov.taipei/News_Content.aspx?n=ACEFA960B5A4ACD7&sms=87415A8B9CE81B16&s=5E7582F378B440EA,以前購買未貼防偽標籤的專用垃圾袋還能繼續使用嗎？, 一、 臺北市自89年7月1日起實施垃圾費隨袋徵收政策，當時製作之專用垃圾袋均未有防偽功能設計，為了防制偽袋，遂於91年開始在專用垃圾袋上加貼防偽標籤。二、 本市自109年3月1日起停用舊型未黏貼凹版紙質或雷射型式的防偽標籤專用垃圾袋，如有疑問請洽分機1754、7298、7301、4548。 ,21208.0,112-11-15 13:41,112-11-15 13:41,臺北市政府環境保護局資源循環管理科
2023-12-17 12:48:02,https://www.dep.gov.taipei/News_Content.aspx?n=ACEFA960B5A4ACD7&sms=87415A8B9CE81B16&s=39F0A94A4D233757,當在本市私領域(如社區內、民眾家中、庭院內、陽台上、遮雨棚上…等私有土地內)發現死亡犬貓遺體，本市處理方式為何?, 民眾先現場初步觀察該犬貓外觀，告知該犬貓外觀和生命狀態(犬或貓、是否受傷、已死亡或尚存活)，如犬貓尚存活，會通知動保處錄案，並到現場判斷處理，如已死亡，請民眾付費委託專業的寵物殯葬業或動物之家協助處理犬貓遺體，或請民眾使用專袋盛裝後交由本局夜線清潔車輛清運。 ,3175.0,112-11-16 09:16,112-11-16 09:16,臺北市政府環境保護局環境清潔管理科
2023-12-17 12:48:04,https://www.dep.gov.taipei/News_Content.aspx?n=ACEFA960B5A4ACD7&sms=87415A8B9CE81B16&s=3E3C9372E6650345,本市民眾或家中成員有符合「獨居」、「行動不便」、「65歲以上長者」的條件，且有排出垃圾需求者，該如何聯絡環保局協助收運?, 民眾可撥打1999市民當家熱線，由話務人員告知本局各行政區清潔隊電話或直接與本局各區清潔隊聯絡(電話詳如附件)，各區清潔隊後續將主動聯繫並派員評估規劃協助事宜。」 ,683.0,112-11-16 09:18,112-11-16 09:18,臺北市政府環境保護局環境清潔管理科
2023-12-17 12:48:06,https://www.dep.gov.taipei/News_Content.aspx?n=ACEFA960B5A4ACD7&sms=87415A8B9CE81B16&s=2433187B2FE6A059,雙北交界附近，本市線上清運點及限時收受點上遇有新北市民眾跨境丟垃圾該如何處理？, 因政策為專用垃圾袋互用，非垃圾互收，另依據雙北環保局各自公告，雙北市僅限垃圾專用袋互用，垃圾排出方式仍須依各該市環保局所公告之方式於各市規定時間及垃圾車到達停靠收集點後，直接投入垃圾車內，故如有新北市民眾跨境丟垃圾，則由現場清潔人員採勸導方式辦理。 ,1499.0,112-11-14 18:23,112-11-14 18:23,臺北市政府環境保護局環境清潔管理科
2023-12-17 12:48:09,https://www.dep.gov.taipei/News_Content.aspx?n=ACEFA960B5A4ACD7&sms=87415A8B9CE81B16&s=D4AEEC9CFBCC34A1,裝新北垃圾袋的垃圾被亂丟，其罰則應如何認定？," 比照使用臺北市專用垃圾袋盛裝垃圾後亂丟方式處理，相關罰則為使用專用垃圾袋但未依規定放置，或未使用專用垃圾袋但依規定放置，一年內第1次罰鍰3,600元；第2次以上罰鍰6,000 元。 ",1940.0,112-11-20 16:59,112-11-20 16:59,臺北市政府環境保護局環境清潔管理科
2023-12-17 12:48:09,https://www.dep.gov.taipei/News_Content.aspx?n=ACEFA960B5A4ACD7&sms=87415A8B9CE81B16&s=CD117F3FE820D1B2,新北市改制前的舊型袋能否收運？, 經詢新北市環保局表示，如屬舊型專用垃圾袋，經確認袋身有張貼防偽標籤即可收運。  ,1399.0,112-11-14 18:23,112-11-14 18:23,臺北市政府環境保護局環境清潔管理科
2023-12-17 12:48:11,https://www.dep.gov.taipei/News_Content.aspx?n=ACEFA960B5A4ACD7&sms=87415A8B9CE81B16&s=9F2F954D1162CC97,請問108年5月1日起實施之「雙北專用垃圾袋互收政策」，其互收範圍及方式為何？, 本市市民得使用新北市專用垃圾袋(含環保兩用袋及萬用袋)盛裝家戶之一般廢棄物後交由本市垃圾車清運。 ,1674.0,112-11-15 14:06,112-11-15 14:06,臺北市政府環境保護局資源循環管理科
2023-12-17 12:48:13,https://www.dep.gov.taipei/News_Content.aspx?n=ACEFA960B5A4ACD7&sms=87415A8B9CE81B16&s=49069EAC4A76AA38,為何要實施「雙北專用垃圾袋互收政策」？, 考量雙北共同生活圈，市民通勤頻率高，兩市專用垃圾袋互收，主要增進市民生活上之便利性，以達到物盡其用。 ,1304.0,112-11-15 14:04,112-11-15 14:04,臺北市政府環境保護局資源循環管理科
2023-12-17 12:48:16,https://www.dep.gov.taipei/News_Content.aspx?n=ACEFA960B5A4ACD7&sms=87415A8B9CE81B16&s=551C7A6DD339DE41,專用垃圾袋雷射防偽標籤如何辨識, 本市專用垃圾袋之雷射防偽標籤，簡易辨識方法如下：1、使用手機LED光源照射，左上角會出現「TPE」字樣。2、將標籤左右轉動，右下之「TPE」會呈現縮小及放大效果。3、各公升數字觸摸是平的，但目視360度能看到圖案有突出表面的視覺效果。 ,1037.0,112-11-15 14:04,112-11-15 14:04,臺北市政府環境保護局資源循環管理科
2023-12-17 12:48:18,https://www.dep.gov.taipei/News_Content.aspx?n=ACEFA960B5A4ACD7&sms=87415A8B9CE81B16&s=4EA1020CF564E482,民眾家中飼養寵物死亡是否能交環保局處理?, 民眾家中所飼養的犬貓等寵物死亡，可付費委託專業的寵物殯葬業或動保處動物之家協助處理寵物遺體。 ,843.0,112-11-16 09:19,112-11-16 09:19,臺北市政府環境保護局環境清潔管理科
2023-12-17 12:48:20,https://www.dep.gov.taipei/News_Content.aspx?n=ACEFA960B5A4ACD7&sms=87415A8B9CE81B16&s=67E2B04563950F83,除犬貓外，道路上其他動物遺體如死老鼠、死鳥禽的處理方式為何?, 目前針對道路上除貓狗外之其他動物遺體，可通知環保局派員清理。 ,3928.0,112-11-16 09:20,112-11-16 09:20,臺北市政府環境保護局環境清潔管理科
2023-12-17 12:48:22,https://www.dep.gov.taipei/News_Content.aspx?n=ACEFA960B5A4ACD7&sms=87415A8B9CE81B16&s=91C2F549987D7557,當在街道上發現死亡犬貓遺體，本市處理方式為何?, 民眾先現場初步觀察該犬貓狀況，告知該犬貓外觀和生命狀態(犬或貓、是否受傷、已死亡或尚存活)，如犬貓尚存活，會通知動保處處理，如已死亡，則會通知環保局處理。 ,519.0,112-11-16 09:20,112-11-16 09:20,臺北市政府環境保護局環境清潔管理科
2023-12-17 12:48:25,https://www.dep.gov.taipei/News_Content.aspx?n=ACEFA960B5A4ACD7&sms=87415A8B9CE81B16&s=4B8C43850D76BE32,因非洲豬瘟部分清運業者及養豬戶已自主不收廚餘，廚餘去化方式？可否交付清潔隊？未來如果禁止廚餘養豬後，廚餘要如何處理？(對象為事業及總廢棄日產量30公斤以上單位), 中央尚未宣布廚餘禁止養豬，目前仍請依原有規定分類回收，請送交合格清運業者或再利用機構收受，相關查詢可上環境部再利用機構查詢網站查詢(https://rms.epa.gov.tw/RMS/)；如果禁止廚餘養豬後，請送交堆肥場再利用，若無法找到堆肥場願意收受，則請徹底瀝乾水分後併入一般事業廢棄物交清除機構清運處理。相關疑義請洽環保局廢棄物處理管理科（電話02-27208889轉7284）。 ,1726.0,112-09-22 14:59,112-11-24 18:41,臺北市政府環境保護局廢棄物處理管理科
2023-12-17 12:48:27,https://www.dep.gov.taipei/News_Content.aspx?n=ACEFA960B5A4ACD7&sms=87415A8B9CE81B16&s=F12669657BBBB5B2,如果廚餘禁止養豬後，家戶廚餘還要不要分類？如何處理？(對象為家戶及總廢棄日產量30公斤以下單位), 中央尚未宣布廚餘禁止廚餘養豬，目前仍請依原有規定分類回收；如果禁止廚餘養豬後，本局將配合中央指導原則併入堆肥廚餘回收再利用，屆時分類養豬廚餘已無必要，故廚餘毋須再分二類，可合併交給清潔隊回收。相關疑義請洽環保局廢棄物處理管理科（電話02-27208889轉7284）。 ,1693.0,111-01-18 18:02,112-11-24 18:41,臺北市政府環境保護局廢棄物處理管理科
2023-12-17 12:48:29,https://www.dep.gov.taipei/News_Content.aspx?n=ACEFA960B5A4ACD7&sms=87415A8B9CE81B16&s=193A5471929F4FA4,pay.taipei繳罰款, 一、民眾接到裁處書後，可利用智慧型手機或電腦瀏覽器透過網際網路至臺北市政府智慧支付平台繳納罰款。二、目前配合的支付業者有街口支付、悠遊付、停車大聲公、台北富邦網路銀行、橘子支付、歐付寶、Pi拍錢包、簡單付(ezPay) 、嗶嗶繳、friDay理財+及車麻吉等11家提供服務，另智慧支付平台同時提供信用卡繳款服務，如無使用第三方支付亦可用信用卡繳款。三、如有任何繳款問題可洽大隊詢問 (電話：02-25923600轉277)。 ,1559.0,112-11-14 11:23,112-11-14 11:23,臺北市政府環境保護局環保稽查大隊
2023-12-17 12:48:31,https://www.dep.gov.taipei/News_Content.aspx?n=ACEFA960B5A4ACD7&sms=87415A8B9CE81B16&s=CD438067CF964187,〔廢棄物代處理申請〕如何申請一般廢棄物或非事業廢棄物代焚化處理？, 若民眾有需要申請廢棄物代焚化處理，可依以下兩種方式進行申請：1.連結臺北市政府市民服務大平臺，於申辦案件-依機關分類/環境保護局/北投垃圾焚化廠/代處理一般事業廢棄物及一般廢棄物焚化申請（北投垃圾焚化廠），選擇網路申辦或書表下載。2.由本廠首頁左方點選申請案件，於「一、處理一般事業廢棄物及一般廢棄物焚化申請， 選擇1.網路申請（連截至臺北市政府市民服務大平臺）」。若您尚有申請上疑問，請撥服務專線 02-28360050轉452、461為您解說。 ,2702.0,112-11-20 14:28,112-11-20 14:28,臺北市政府環境保護局北投垃圾焚化廠
2023-12-17 12:48:34,https://www.dep.gov.taipei/News_Content.aspx?n=ACEFA960B5A4ACD7&sms=87415A8B9CE81B16&s=24BB20D2FBE4E7DE,我的車不能報廢(過戶)，監理所表示是因為有環保罰鍰，為什麼？, 對於未繳清罰款者，本局採車輛禁止異動措施；若經本局催繳仍未繳清罰款則移送行政執行署申請強制執行，至於罰款金額不會因逾期繳納加重。若經移送至法務部行政執行署各分署強制執行之案件，將依執行情形酌收執行必要費用。  ,935.0,112-11-14 11:23,112-11-14 11:23,臺北市政府環境保護局環保稽查大隊
2023-12-17 12:48:36,https://www.dep.gov.taipei/News_Content.aspx?n=ACEFA960B5A4ACD7&sms=87415A8B9CE81B16&s=1A7CB4F3D1929101,遭強制執行要如何繳款？, 若經移送至法務部行政執行署各分署強制執行之案件，將依執行情形酌收執行必要費用。可持行政執行分署繳款單至四大超商門市（7-11、全家、萊爾富、OK）繳納；或利用郵政劃撥繳納（帳號：01057258，戶名：臺北市政府環境保護局環保稽查大隊，並於通訊欄備註裁處書號或移送案號、受處分人姓名、聯絡電話）。 ,3762.0,112-11-14 11:23,112-11-14 11:23,臺北市政府環境保護局環保稽查大隊
2023-12-17 12:48:38,https://www.dep.gov.taipei/News_Content.aspx?n=ACEFA960B5A4ACD7&sms=87415A8B9CE81B16&s=E6A05D2C42194573,車輛噪音檢驗站時間及地點？, 檢測站地點為內湖區港墘路 221 巷 2 號(出入口為舊宗路二段 213 巷內)，檢測時間為每周三、六上午 9 時 30 分至 11 時 30 分，下午 13 時 30 分至 16 時。如遇國定及連續假期則暫停檢驗。(112年暫停檢驗日期：1/21、1/25、1/28、2/25、4/1、4/29、6/24、9/30、10/7、12/30) ,9967.0,112-11-14 11:23,112-11-14 11:23,臺北市政府環境保護局環保稽查大隊
2023-12-17 12:48:40,https://www.dep.gov.taipei/News_Content.aspx?n=ACEFA960B5A4ACD7&sms=87415A8B9CE81B16&s=3274AD21A161FF1B,檢驗車輛噪音有甚麼要注意的嗎？, 請攜帶1.通知書、行照及2.駕照（身分證件）於期限內至指定地點接受檢測，以免受罰。另現場經量測噪音超過管制標準，即依法告發裁罰。 ,2078.0,112-11-14 11:24,112-11-14 11:24,臺北市政府環境保護局環保稽查大隊
2023-12-17 12:48:43,https://www.dep.gov.taipei/News_Content.aspx?n=ACEFA960B5A4ACD7&sms=87415A8B9CE81B16&s=63237D5BE51E28FB,有關機車排氣已定檢之車輛，為何路邊攔檢不合格還會被罰？, 一、路邊攔檢係本局依空氣污染防制法（下稱空污法）第45條執行不定期機車排氣檢驗，據以管制行駛中機車排氣狀況。二、若民眾已依空污法第44條完成機車排氣定檢，仍應注意車輛保養、使用操作狀況，如經路邊攔檢排氣檢驗不合格仍屬違反法令規定，本局將依空污法處罰，並通知限期改善，屆期仍未完成改善，則按次處罰。  ,2282.0,112-11-14 11:24,112-11-14 11:24,臺北市政府環境保護局環保稽查大隊
2023-12-17 12:48:45,https://www.dep.gov.taipei/News_Content.aspx?n=ACEFA960B5A4ACD7&sms=87415A8B9CE81B16&s=2BC7AF0F6717D883,如果公私場所之固定污染源遇到突發事故並發生大量排放空氣污染物時，該如何處理？, 1.請於發生事故1小時內撥打本市環境保護局勤務中心(02-27205452、02-27205455)，並告知是公私場所之固定污染源，以及告知是否為毒化物列管場所。2.依「臺北市政府環境保護局固定污染源設施故障通報單(1小時內)」提報相關資訊，並傳真至環保局勤務中心(02-27206131)。3.於故障發生後24小時內修復或停止操作，並於15日內向環保局依「臺北市政府環境保護局固定污染源設施故障書面報告」提出書面報告。 ,1122.0,112-11-15 10:56,112-11-15 10:56,臺北市政府環境保護局空污噪音防制科
2023-12-17 12:48:49,https://www.dep.gov.taipei/News_Content.aspx?n=ACEFA960B5A4ACD7&sms=87415A8B9CE81B16&s=A64B810D837C211C,〔一般〕如何申請「金銀紙錢集中焚燒」？, 為兼顧宗教信仰及環保，本廠配合市府施行「集中焚燒金銀紙錢」政策，請本市市民、寺廟、機關、社區等相關申請單位就近至各區公所民政課或各里辦公室領取通行證（或至民政局網站檔案下載區下載列印通行證），將通行證內容填妥用印後，持通行證並自行備妥車輛將金銀紙錢運送至內湖焚化廠或鄰近焚化廠進行暫置，送進本（北投）廠暫置之金銀紙錢達一定數量後，將安排轉運至內湖焚化廠以專爐專燒的方式集中焚燒。 ,3239.0,112-11-20 14:28,112-11-20 14:28,臺北市政府環境保護局北投垃圾焚化廠
2023-12-17 12:48:51,https://www.dep.gov.taipei/News_Content.aspx?n=ACEFA960B5A4ACD7&sms=87415A8B9CE81B16&s=2B518F29CF1AE281,〔一般〕如何申請北投焚化廠自製堆肥及自製液肥?, 設籍臺北市市民欲申請自製堆肥及自製液肥，請先以電話28360050轉分機461或468向本廠業務單位查詢庫存量是否足供提領，並登記來廠提領數量及確認提領日期及編號。 ,1214.0,112-11-20 14:29,112-11-20 14:29,臺北市政府環境保護局北投垃圾焚化廠
2023-12-17 12:48:54,https://www.dep.gov.taipei/News_Content.aspx?n=ACEFA960B5A4ACD7&sms=87415A8B9CE81B16&s=F509B9E81051B32B,提供市民之土壤改良劑是否為內湖垃圾焚化廠自行製作？是如何製作的？, 本廠所製作土壤改良劑，原料係為本局清潔隊所收運之生廚餘，經本廠廚餘前處理設施破碎及脫水後含水率約60%之固渣，於專區堆置進行翻堆、醱酵及腐熟後，生產為土壤改良劑。 ,1057.0,112-11-15 16:38,112-11-15 16:38,臺北市政府環境保護局內湖垃圾焚化廠
2023-12-17 12:48:56,https://www.dep.gov.taipei/News_Content.aspx?n=ACEFA960B5A4ACD7&sms=87415A8B9CE81B16&s=FD78D432DDDC3E4A,領用土壤改良劑資格為何？如何領用？有無提供容器？有無限量？, 1.領用資格：民眾、學校、里辦公室、民意代表服務處、農戶、環保義工大（中）隊及其他非營利機關團體等。2.領用程序：得以公文、書面或電話等方式，向本廠業務單位(電話27961833轉421或212)查詢庫存量是否足供提領，並登記申請人姓名（單位）、聯絡電話、地址（戶籍登記）、數量、類型、領用目的（用途）及申請日期；經本廠同意後，由申請人（單位）自行準備提袋或容器，先至本廠警衛室或第一組填寫領據及切結書後領取發放，領用時應出示身分證明文件。3.領用數量：  (1)民眾每人每次以50公斤為限。  (2)學校、里辦公室、民意代表服務處、農戶、環保義工大（中）隊及其他非營利機關團體等，需求單位每次以500公斤為限。4.專案申請：申請者須詳述使用地點、面積、用途及數量等，經本廠依需求及既有庫存檢討同意後，通知領取。 ,1193.0,112-11-15 16:38,112-11-15 16:38,臺北市政府環境保護局內湖垃圾焚化廠
2023-12-17 12:48:56,https://www.dep.gov.taipei/News_Content.aspx?n=ACEFA960B5A4ACD7&sms=87415A8B9CE81B16&s=6C6F1E95317AD8C6,若我的機車忘記年度排氣定期檢驗，是否會被開罰單?," 機車出廠滿5年應依行照原發照月份前、後1個月內實施定檢，逾期未定檢處新臺幣500元罰鍰。逾應檢驗日起6個月，經環保局通知仍未檢驗合格，再處新臺幣3,000元罰鍰 ，最重得註銷其牌照。 ",2698.0,112-11-15 17:09,112-11-15 17:09,臺北市政府環境保護局空污噪音防制科
2023-12-17 12:48:58,https://www.dep.gov.taipei/News_Content.aspx?n=ACEFA960B5A4ACD7&sms=87415A8B9CE81B16&s=17F4EDBAAFECE2CF,民眾參與廢棄物進廠檢查作業資格、限制及申請程序為何？, 1.凡年齡滿20歲以上，設籍臺北市內湖區之居民，欲參與陪同稽查作業之民眾，請先行向所屬里辦公處或社區環保團體登記，由里辦公室或社區環保團體彙整後，送本廠審核及安排廢棄物進廠稽查作業講習課程。2.完成稽查作業講習課程後，由本廠統一造冊登記並核發陪同檢查證，即可使用陪同檢查證參與本廠稽查作業。 ,892.0,112-11-15 16:38,112-11-15 16:38,臺北市政府環境保護局內湖垃圾焚化廠
2023-12-17 12:49:01,https://www.dep.gov.taipei/News_Content.aspx?n=ACEFA960B5A4ACD7&sms=87415A8B9CE81B16&s=1F53BD64D3DF0C1C,葫蘆洲運動公園有哪些設施項目？, 1.內湖垃圾焚化廠所屬葫蘆洲運動公園設施包括：溫水游泳池、網球場、健身（韻律）房、桌球（休閒）室、閱覽室及停車場等。2.其中健身（韻律）房設有專業型電腦跑步機、專業型划船訓練機、胸部推舉訓練機、坐姿蝴蝶訓練機、腹部前屈/背部伸張訓練機、腰部旋轉訓練機、飛輪有氧健身車、直立式腳踏車、靠背式腳踏車、全身肌群伸展機、交叉訓練機、啞鈴、舉重訓練器等設備。  ,1440.0,112-11-15 16:39,112-11-15 16:39,臺北市政府環境保護局內湖垃圾焚化廠
2023-12-17 12:49:03,https://www.dep.gov.taipei/News_Content.aspx?n=ACEFA960B5A4ACD7&sms=87415A8B9CE81B16&s=BA5A96B46D4A1EBF,民眾參與廢棄物進廠檢查作業注意事項為何？, 1.領有陪同檢查證之民眾，欲參與陪同稽查作業時，請先行憑身分證及陪同檢查證至本廠警衛室登記換證，由本廠安排陪同稽查事宜。2.為維護民眾安全及不影響垃圾傾卸平台作業，每日參與陪同稽查民眾，以不超過5名為原則。3.民眾需配合本廠稽查人員作業，不得任意靠近垃圾傾卸口，以防掉落貯坑，且不得親自動手檢查，如對某一特定垃圾包需要進一步檢查時，可要求本廠稽查人員進行該包垃圾袋破袋檢查。4.遇有突發意外狀況，需按本廠人員引導，進行避難疏散或救險事宜，以防災害發生。 ,966.0,112-11-15 16:39,112-11-15 16:39,臺北市政府環境保護局內湖垃圾焚化廠
2023-12-17 12:49:05,https://www.dep.gov.taipei/News_Content.aspx?n=ACEFA960B5A4ACD7&sms=87415A8B9CE81B16&s=05D14539FBA9FA36,煙道廢氣戴奧辛排放濃度檢測日期及檢測結果是否公開？, 1.依據廢棄物焚化爐戴奧辛管制及排放標準第8條第5項規定：焚化爐定期檢測前七日，應檢送檢測計畫書至當地主管機關，並於定期檢測前，將預定檢測日期及檢測內容公開於焚化廠資訊網站或在當地適當地點公告，並通知環保團體及當地居民代表參與監督。2.本廠依法規規定於檢測採樣前7日，發函當地主管機關及相關環保團體，並於本廠位於石潭公園顯示看板公開檢測日期。3.檢測結果則公開於本廠官網供各界查閱。 ,903.0,112-11-15 16:39,112-11-15 16:39,臺北市政府環境保護局內湖垃圾焚化廠
