Time,Url,Question,Answer,點閱數,資料更新,資料檢視,資料維護
2023-12-17 12:54:02,https://www.dep.gov.taipei/News_Content.aspx?n=ACEFA960B5A4ACD7&sms=87415A8B9CE81B16&s=8FD4DD93A294185E,如果拿非當天分類規定的資源回收物去丟，會被拒絕嗎？, 經查環保局現行資源回收分類項目區分為平面類(指乾淨舊衣類、廢紙類、乾淨塑膠袋類、舊書)，於每週一、五回收，及立體類(指乾淨保麗龍類、一般類資源物)，於每週二、四、六回收，惟如果民眾無法配合環保局分天分類政策，仍請民眾將回收物分類好後，一併交由線上人員回收處理，為便利市民將資源物排出，不論是何日，環保局要求區清潔隊不得拒收市民朋友排出之資源回收物。  ,19496.0,112-11-16 10:37,112-11-16 10:37,臺北市政府環境保護局環境清潔管理科
2023-12-17 12:54:05,https://www.dep.gov.taipei/News_Content.aspx?n=ACEFA960B5A4ACD7&sms=87415A8B9CE81B16&s=80A3437ACB8B9950,環保局之市民臨時工及編制內職工申請陳先生愛心獎學金的資格為何？, 該筆款項係為私人之愛心捐贈，經捐䁬人通知可提申請後，請各內外勤單位轉知所屬同仁申請。 申請資格為環保局之市民臨時工及編制內職工持有當年度有效之「低收入戶卡」或「因公傷亡證明」或「身心障礙手冊」重度(含重度)以上，方可申請。    ,9663.0,111-08-26 08:14,112-11-23 16:09,臺北市政府環境保護局人事室
2023-12-17 12:54:07,https://www.dep.gov.taipei/News_Content.aspx?n=ACEFA960B5A4ACD7&sms=87415A8B9CE81B16&s=3E762B9EB0DEFD74,如何申請電磁波檢測？, 1.若您的住所位在臺北市且未涉及房屋買賣，環保局可提供電磁波強度初步檢測（需提供姓名、詳細地址、聯絡電話與電磁波產生設施），相關細節請洽環保局空污噪音防制科，電話：1999(外縣市02-27208889)轉7245。2.本局提供之初步檢測服務係針對供不特定人士使用而產生電磁波之設施(例如基地臺、變電箱等)，倘您因私人購(設)置設施(例如機房、馬達、微波爐…等)而有電磁波疑慮，可洽民間專業檢測機構辦理。  ,16482.0,112-11-15 14:33,112-11-15 14:33,臺北市政府環境保護局空污噪音防制科
2023-12-17 12:54:09,https://www.dep.gov.taipei/News_Content.aspx?n=ACEFA960B5A4ACD7&sms=87415A8B9CE81B16&s=323742E07BC4BAB1,請問有關高壓電塔電磁波之相關資訊，應向那個單位諮詢？, 臺灣電力公司將高壓電塔電磁波之相關資訊建置在該公司網路系統開放民眾查詢（網址為http://www.taipower.com.tw/）。有關高壓電塔電磁波檢測服務，請洽詢：（1）臺電公司所屬臺北供電區營業處，電話(02)2934-4125分機298、299（免付費檢測）。（2）工業技術研究院量測技術發展中心，電話(03)573-3737（須付費檢測）。 ,18794.0,112-11-15 14:33,112-11-15 14:33,臺北市政府環境保護局空污噪音防制科
2023-12-17 12:54:11,https://www.dep.gov.taipei/News_Content.aspx?n=ACEFA960B5A4ACD7&sms=87415A8B9CE81B16&s=80BCA379CDB2FF73,商家或機關、學校、部隊及法人等產生之巨大垃圾如何收運？, 依環保局清運家戶巨大垃圾執行要點規定，住家兼營商（事）業行為者與機構、學校、部隊及法人等均不屬環保局服務範圍，其如有巨大垃圾排出，應由其所有人委託合格之代清除處理機構清運，可洽廢棄物處理公會詢問代清除處理機構業者相關訊息，電話為2828-5177。 ,4998.0,112-11-16 10:39,112-11-16 10:39,臺北市政府環境保護局環境清潔管理科
2023-12-17 12:54:14,https://www.dep.gov.taipei/News_Content.aspx?n=ACEFA960B5A4ACD7&sms=87415A8B9CE81B16&s=D9778AFF91356C01,本人開設之餐廳，近日被鄰居陳情油煙污染，環保局稽查大隊派人稽查要求進行改善，請問如果有相關防制技術問題該向誰諮詢？, 如果您有油煙防制技術諮詢需求，可撥打環保局餐飲業油煙改善輔導專線：02-27849018，詢問或免費索取油煙改善輔導手冊。  ,14278.0,112-11-16 11:03,112-11-16 11:03,臺北市政府環境保護局空污噪音防制科
2023-12-17 12:54:16,https://www.dep.gov.taipei/News_Content.aspx?n=ACEFA960B5A4ACD7&sms=87415A8B9CE81B16&s=C69054D58502E300,依環保署108年3月25日公告修正「空氣污染行為」，「從事烹飪將烹飪廢氣逕行排放至溝渠中，致產生油煙或異味污染物」為空氣污染行為，是否為不可將餐飲烹飪廢氣排放至水溝, 公告中已說明因前揭排放行為致產生油煙或惡臭者，方為空氣污染行為，民眾若有發現類似油煙或惡臭之污染情形，環保局將派員前往現場稽查，亦可洽市民當家熱線1999辦理。  ,7359.0,112-11-16 11:04,112-11-16 11:04,臺北市政府環境保護局空污噪音防制科
2023-12-17 12:54:18,https://www.dep.gov.taipei/News_Content.aspx?n=ACEFA960B5A4ACD7&sms=87415A8B9CE81B16&s=4CB89E4F1F128FFA,如何預估可能要繳交多少營建工程空污費？, 營建工程空污費預估問題，請至「臺北營建工程空污費網路申報系統」或「臺北市政府－市民服務大平臺」之新增首期開工申報案件內填報工程相關資訊進行空污費試算。如有營建工程空污費計算相關問題，可電洽本局空污費諮詢專線：1999 分機 7252 或 外縣市(02)27208889 轉7252。 ,9682.0,112-11-28 16:56,112-11-28 16:56,臺北市政府環境保護局空污噪音防制科
2023-12-17 12:54:20,https://www.dep.gov.taipei/News_Content.aspx?n=ACEFA960B5A4ACD7&sms=87415A8B9CE81B16&s=B99E497E90530CCB,請問如何查詢自家房屋申請輻射偵檢之相關資訊？, 1.若您有輻射屋相關之疑問，行政院原子能委員會提供輻射屋免費諮詢專線：0800-076-678，或撥(02)8231-7919轉分機2210。2.若您的住所位在臺北市且未涉及房屋買賣，環保局可提供輻射屋初步檢測服務（申請人需提供姓名、地址與聯絡電話），相關細節請洽環保局空污噪音防制科，電話：1999(外縣市02-27208889)轉7245。  ,7440.0,112-11-15 14:34,112-11-15 14:34,臺北市政府環境保護局空污噪音防制科
2023-12-17 12:54:23,https://www.dep.gov.taipei/News_Content.aspx?n=ACEFA960B5A4ACD7&sms=87415A8B9CE81B16&s=BB9A325067A37995,噪音管制法音量標準為何?, 一、噪音管制法之音量標準，係依分區、分時段及行業別而有所不同，若民眾對於該分區等標準有建議，可逕洽環保局空污噪音防制科，可作為下次修法之參考。二、各行業之設立規定，均由其目的事業主管管制，環保局僅針對該行業所產生噪音是否符合管制標準進行稽查。 ,13760.0,112-11-14 11:26,112-11-14 11:26,臺北市政府環境保護局環保稽查大隊
2023-12-17 12:54:25,https://www.dep.gov.taipei/News_Content.aspx?n=ACEFA960B5A4ACD7&sms=87415A8B9CE81B16&s=15F5C87D80AFE107,民眾查詢處理結果，環保局分工情形為何?, 一、環保局1999派工項目計有6種，其中場所與設施噪音舉發及污染舉發(內容為空氣污染、水污染時)為本局環保稽查大隊各中隊執行，其餘各項目由本局各區清潔隊處理。二、如要查詢派工案件之處理結果，民眾可以撥打1999，藉由派工案件編號，詢問派工案件之執行進度。 ,8667.0,112-11-14 11:27,112-11-14 11:27,臺北市政府環境保護局環保稽查大隊
2023-12-17 12:54:25,https://www.dep.gov.taipei/News_Content.aspx?n=ACEFA960B5A4ACD7&sms=87415A8B9CE81B16&s=458D935F23F87CE1,噪音管制區內營建工程施作限制為何?, 一、營建工程施作，依本局公告營建工程於本市第1至第3類噪音管制區平日晚上10時至翌日上午8時，及假日中午12時至下午2時、晚上6時至翌日上午8時，不得使用動力機械從事施工致妨礙安寧之行為，但屬下列情形者，不在此限︰(一)有危及公共安全、污染環境及影響民生用水、用電、用氣或通訊之搶救、搶修工程。(二)基樁（不含撞擊式打樁工程）、連續壁、地下結構物工程（含開挖作業）安全措施組立、巨積混凝土灌築及大型橋樑吊裝之屬連續性必要工程，並經目的事業主管機關核准施工者。(三)於白天實施特殊管制地區（如博愛特區、特勤道路等），並經目的事業主管機關核准施工者。(四)政府辦理國際性或全國性重要活動之營建工程，並經本府專案核准施工者。二、施工期間，產生之噪音需符合營建工程噪音管制標準，若被環保局環保稽查大隊量測噪音超過管制標準，即依法開出限期改善通知單，要求施工單位改善，改善期滿若經量測噪音仍無法符合管制標準時就會罰款，且處罰至改善為止。 ,15267.0,112-11-14 11:26,112-11-14 11:26,臺北市政府環境保護局環保稽查大隊
2023-12-17 12:54:27,https://www.dep.gov.taipei/News_Content.aspx?n=ACEFA960B5A4ACD7&sms=87415A8B9CE81B16&s=121019DC0A787AF7,民眾自己的建物遭塗鴉如何處理？, 對於民間建築物遭塗鴉之區域，應逕行清除維護，若有協助需求，得請環保局協助，環保局評估現場狀況可行後，將在建築物所有人同意下給予協助清除。環保局會先取得建築物所有權人之同意書，於取得同意書後一週內或約定時間〈1999通報或民眾自行聯繫轄區清潔隊〉內完成。  ,3228.0,112-11-20 17:01,112-11-20 17:01,臺北市政府環境保護局環境清潔管理科
2023-12-17 12:54:28,https://www.dep.gov.taipei/News_Content.aspx?n=ACEFA960B5A4ACD7&sms=87415A8B9CE81B16&s=A56A9AE1CA205D53,反應塗鴉問題," 對於隨意在街頭橋墩、通風口、機房及堤防牆面等噴漆塗鴉的行為，環保局將依違反廢棄物清理法第27條第2款「污染地面、池塘、水溝、牆壁、樑柱、電桿、樹木、道路、橋樑或其他土地定著物」之規定，本於權責加強稽查；如經查獲除要求行為人予以清除外，另將依前法第50條處最高新臺幣6,000元罰鍰，所以請您若發現塗鴉地點或發現任意塗鴉行為人時，以電話向環保局各區清潔隊或市府24小時服務專線1999反映。   ",6193.0,112-11-20 17:01,112-11-20 17:01,臺北市政府環境保護局環境清潔管理科
2023-12-17 12:54:28,https://www.dep.gov.taipei/News_Content.aspx?n=ACEFA960B5A4ACD7&sms=87415A8B9CE81B16&s=BD4A3A6A430D3264,市民如有私人物件掉落路邊水溝，可向哪個單位求助？, 如於區清潔隊白天上班時段〈06：00-16：30〉可以通報區隊適時派員開啟溝蓋協助尋找；於下班時段通報者，本局亦會請直屬清潔隊協助處理。水溝掉落物撿拾屬於即時性服務，主要為避免遇大雨排水沖散或事發日久遭他人誤拾情形，致市民私人物件遺失或有財物損失之虞，故不提供預約擇日前往。 ,18253.0,112-11-14 18:26,112-11-14 18:26,臺北市政府環境保護局環境清潔管理科
2023-12-17 12:54:28,https://www.dep.gov.taipei/News_Content.aspx?n=ACEFA960B5A4ACD7&sms=87415A8B9CE81B16&s=81461E5A007E002D,道路清掃維護之權責, 有關本市道路清掃維護之權責，依據廢棄物清理法第11條規定，4公尺以內之公共巷、弄路面及水溝，由相對戶或相鄰戶分別各半清除，4公尺道路以上則由環保局清掃；與土地或建築物相連接之騎樓或人行道，則由該土地或建築物所有人、管理人或使用人負清掃維護之責，另因特殊用途，使用道路或公共用地者，由使用人清除。  ,19244.0,112-11-14 18:35,112-11-14 18:35,臺北市政府環境保護局環境清潔管理科
2023-12-17 12:54:30,https://www.dep.gov.taipei/News_Content.aspx?n=ACEFA960B5A4ACD7&sms=87415A8B9CE81B16&s=6B33B11E73B52862,請問松山機場周圍地區是否有設置噪音監測站監控飛機噪音狀況？測站位置在哪裡？, 有關監測松山機場飛航噪音狀況，臺北航空站依法設置連續自動監測設備，查本市運轉中之航空噪音監測站計有13處，其中3處位於松山機場內，其他10處位於機場之周圍地區，該等測站位置分別為三民國小、國防醫學中心、潭美國小、憲兵司令部、南湖國小、南港高中、三民國中、內湖港墘站、蘭州國中及內湖國中。  ,4124.0,112-11-16 10:08,112-11-16 10:08,臺北市政府環境保護局空污噪音防制科
2023-12-17 12:54:32,https://www.dep.gov.taipei/News_Content.aspx?n=ACEFA960B5A4ACD7&sms=87415A8B9CE81B16&s=01065A05C2F9CA1E,請問本市航空噪音防制區劃定情形？主管機關如何改善防制區範圍內之飛航噪音影響？, 目前航空噪音防制區範圍及分級（112.8.28修正公告），請至本市環保局「噪音管制區及航空噪音防制區查詢」網頁。經環保局公告為航空噪音防制區之地區，航空主管機關得協調有關機關擬定機場周圍地區土地使用對策，送請土地使用主管機關依法定程序配合檢討規劃，並依據國營航空站噪音補償金分配及使用辦法及臺北市臺北松山機場回饋金分配及使用辦法等相關規定，辦理航空噪音防制區之噪音改善及補助工作。 ,1723.0,112-11-16 10:08,112-11-16 10:08,臺北市政府環境保護局空污噪音防制科
2023-12-17 12:54:35,https://www.dep.gov.taipei/News_Content.aspx?n=ACEFA960B5A4ACD7&sms=87415A8B9CE81B16&s=0247B514BB03245C,如何變更環保局所寄發的罰單地址？, 依據行政程序法規定：送達，於應受送達人之住居所、事務所或營業所為之。由於裁處書是對人民權利義務有重大影響之文書，為確保裁處書合法送達，本局寄發裁處書，一律以受裁處人戶籍地址（登記地址）為送達地。惟若被告發人在遭舉發時，有向舉發人員說明通訊地址，並由舉發人員於舉發通知書上載明：「被通知人同意以通訊地址為寄送地址」，於初次寄送時始有可能寄至該通訊地址。  ,6496.0,112-11-14 11:27,112-11-14 11:27,臺北市政府環境保護局環保稽查大隊
2023-12-17 12:54:35,https://www.dep.gov.taipei/News_Content.aspx?n=ACEFA960B5A4ACD7&sms=87415A8B9CE81B16&s=B16B3287560553FF,流動廁所的規格或大小為何?," 環保局管有之流動廁所均為拖車式貨櫃型廁所，長8米-9米，寬2.5米，高4.2米，內有男廁：廁間1間、小便斗3個，女廁：廁間3間，約可使用2,000人次，停放地點需有4個停車格以上的空間，進出道路為12米以上道路，如租用者提供停放地點因空間或進出道路不足導致無法停放且無替代停放點時，環保局將逕行拖回同時不予退費。  ",12101.0,112-11-15 14:09,112-11-15 14:09,臺北市政府環境保護局資源循環管理科
2023-12-17 12:54:37,https://www.dep.gov.taipei/News_Content.aspx?n=ACEFA960B5A4ACD7&sms=87415A8B9CE81B16&s=5903B6DA98EA390A,本市設置廣告板欄如何申請？有何相關規定？, 人民可依「臺北市廣告物管理自治條例」於私有建築物外牆(圍牆)，可上網向環保局申請設置廣告板欄供自己或出租他人使用。相關申請程序及申請表單請至臺北市政府[市民服務大平台]網站點選「申辦案件」-依機關分類 > 「環境保護局」>  點選標題為「臺北市廣告板欄設置申請」            ,4273.0,112-11-16 16:52,112-11-16 16:52,臺北市政府環境保護局環境清潔管理科
2023-12-17 12:54:39,https://www.dep.gov.taipei/News_Content.aspx?n=ACEFA960B5A4ACD7&sms=87415A8B9CE81B16&s=8BAB4F46BED0C881,環保局對產生噪音之車輛要如何管制?," 一、由警察局、監理站、環保局所辦理之聯合稽查取締機車改裝排氣管專案，由環保局稽查人員對遭攔停之改裝車輛進行噪音檢測，經檢測超過標準即依法告發並限期改善。二、為有效制止機動車輛不當改裝致產生噪音、妨礙安寧，環境部已經發布「使用中機動車輛噪音妨害安寧檢舉辦法」，對於民眾檢舉產生噪音之機動車輛將採查證通知並限期到檢方式辦理，如經檢測超過管制標準或被檢舉人未依規定到檢，將處新臺幣1,800元至3,600元罰鍰，民眾如發現有噪音妨害安寧事實的車輛、可檢具時間、地點、車種、車號、佐證資料(如拍照)等，並上環保署噪音車輛檢舉網站登錄(含個人姓名資料等)。三、本局於106年5月4日公告本市各類噪音管制區全日，經查驗合格之車輛(經噪音檢測合格車輛排氣管資料上傳雲端資料庫)不得有使用其他未認證之排氣管致妨害他人生活環境安寧之行為，後續若經檢舉或攔查發現檢測合格車輛再次改裝排氣管，則依公告事項處3,000元至30,000元罰鍰，以有效遏止改裝排氣管妨礙安寧行為。 ",7339.0,112-11-28 17:24,112-11-28 17:24,臺北市政府環境保護局環保稽查大隊
2023-12-17 12:54:42,https://www.dep.gov.taipei/News_Content.aspx?n=ACEFA960B5A4ACD7&sms=87415A8B9CE81B16&s=A407F30DB5C15943,捷運站聲音很大，很吵，要怎麼處理改善?, 捷運站屬於營業場所，依照噪音管制法規定需符合營業場所噪音管制標準，若被環保局環保稽查大隊量測噪音超過管制標準，即依法開出限期改善通知單，請捷運公司改善，若改善期滿經量測仍無法符合管制標準，就會開罰，且繼續要求至改善為止。  ,3503.0,112-11-14 11:28,112-11-14 11:28,臺北市政府環境保護局環保稽查大隊
2023-12-17 12:54:44,https://www.dep.gov.taipei/News_Content.aspx?n=ACEFA960B5A4ACD7&sms=87415A8B9CE81B16&s=D9C33B770F248009,捷運工程施工，產生噪音要怎麼處理改善?, 捷運於施工期間，產生之噪音需符合營建工程噪音管制標準，若被環保局環保稽查大隊量測噪音超過管制標準，即依法開出限期改善通知單，要求施工單位改善，若改善期滿經量測仍無法符合管制標準，就會開罰，且繼續處罰至改善為止。  ,4684.0,112-11-14 11:28,112-11-14 11:28,臺北市政府環境保護局環保稽查大隊
2023-12-17 12:54:44,https://www.dep.gov.taipei/News_Content.aspx?n=ACEFA960B5A4ACD7&sms=87415A8B9CE81B16&s=A577BE80F348E7AA,燃放爆竹及施放煙火製造噪音，有沒有法令可以管制?," 臺北市政府公告規定一、於晚上10時至上午8時這段時間是不可以施放專業爆竹煙火及會發出笛音或爆音之一般煙火，惟於元旦、春節(農曆1月1日)、元宵節、端午節、中元節、中秋節、國慶日、除夕及政府辦理文化活動或國際交流，經本府專案核准之民俗節慶，不在此限制。二、於學校、衛生醫療機構（診所除外）及文教區其周圍50公尺範內全日均不可施放專業爆竹煙火及會發出笛音或爆音之一般煙火。三、任意燃放爆竹及施放煙火製造噪音，若違反公告規定，可處罰新台幣3,000元至30,000元罰鍰。  ",65465.0,112-11-14 11:28,112-11-14 11:28,臺北市政府環境保護局環保稽查大隊
2023-12-17 12:54:46,https://www.dep.gov.taipei/News_Content.aspx?n=ACEFA960B5A4ACD7&sms=87415A8B9CE81B16&s=B74F7B5EC063660C,環保局是否可開單處罰飛機噪音？, 環保局受理民眾陳情飛航噪音改善案件，將會同航空主管機關進行航空噪音臨時性監測工作，以瞭解實際影響程度，若影響情節重大，環保局將函請航空主管機關採取適當防制，以減低航空噪音影響。並將該監測結果納入本市航空噪音防制區範圍劃定重新檢討之參考。 ,6639.0,112-11-16 10:11,112-11-16 10:11,臺北市政府環境保護局空污噪音防制科
2023-12-17 12:54:49,https://www.dep.gov.taipei/News_Content.aspx?n=ACEFA960B5A4ACD7&sms=87415A8B9CE81B16&s=A57592DCDE37859A,請問航空噪音防制設施補償金補助應如何申請？可申請多少金額？, 位於本市航空噪音防制區內之住戶於收到環保局寄發之公文及空白申請書即可向環保局提出申請，申請流程請依申請書內之申請要點辦理。現階段補助金額以補助住戶申請之建物隔音門窗、通風消音箱等，及舊門窗拆除費，每戶補助金額最高上限為新台幣15萬元。 ,7695.0,112-11-16 10:09,112-11-16 10:09,臺北市政府環境保護局空污噪音防制科
2023-12-17 12:54:51,https://www.dep.gov.taipei/News_Content.aspx?n=ACEFA960B5A4ACD7&sms=87415A8B9CE81B16&s=09034F5414B8EBB3,請問受松山機場飛機起降噪音影響，可向哪個單位請求改善？, 民眾若受飛機起降噪音影響，可向環保局及民航局暨所屬臺北航空站陳情反映，相關問題請洽環保局空污噪音防制科，電話：1999(外縣市02-27208889)轉7241，或臺北航空站噪音管制小組，電話：87703599。 ,6146.0,112-11-16 10:12,112-11-16 10:12,臺北市政府環境保護局空污噪音防制科
2023-12-17 12:54:53,https://www.dep.gov.taipei/News_Content.aspx?n=ACEFA960B5A4ACD7&sms=87415A8B9CE81B16&s=5FB9C5A6B3338597,目前「噪音管制區」如何劃分？如何查詢？, 1.本市係依「噪音管制區劃定作業準則」，並依本市都市計畫所規劃之土地使用計畫、使用情形以及噪音現況將全市劃分為四類噪音管區。2.本市噪音管制區查詢網址：https://noisemap.gov.taipei/。 ,25058.0,112-11-16 11:05,112-11-16 11:05,臺北市政府環境保護局空污噪音防制科
2023-12-17 12:54:53,https://www.dep.gov.taipei/News_Content.aspx?n=ACEFA960B5A4ACD7&sms=87415A8B9CE81B16&s=C85BDF95FDF2F5C9,住家養狗叫聲，可以向哪一單位協助？," 1.犬隻吠叫製造之噪音係屬不具持續性或不易量測之聲音，依噪音管制法第6條：「製造不具持續性或不易量測而足以妨害他人生活安寧之聲音，由警察機關依有關法令處理之」。2.住家養狗噪音擾鄰係由警察機關依社會秩序維護法第72條第3款「製造噪音或深夜喧嘩，妨害公眾安寧者」之規定處新台幣6,000元以下罰鍰。3.另依動物保護法第5條第2項規定，飼主對於其管領之動物應提供妥善之照顧，如犬隻吠叫是因受虐而導致急迫吠叫情形，可以通報臺北市動物保護處（1959動物保護專線）調查處理。 ",141351.0,112-11-16 11:05,112-11-16 11:05,臺北市政府環境保護局空污噪音防制科
2023-12-17 12:54:54,https://www.dep.gov.taipei/News_Content.aspx?n=ACEFA960B5A4ACD7&sms=87415A8B9CE81B16&s=E9ADDFE33BF4D8C6,鄰居製造噪音影響生活安寧？, 1.對於住家產生的噪音，如冷卻水塔、發電機及抽水泵等噪音，可由本局依噪音管制法進行稽查取締外；其他如防盜器、兒童嬉笑聲、鄰居進出門走動聲及澆水滴落聲等不具持續性或不易量測的聲音，請向警察局反映，依社會秩序維護法第72條第3款，或向大樓管理委員反映，依公寓大廈管理條例第16條規定處理。2.另針對環保局公告管制項目如冷卻水塔、發電機及抽水泵等噪音，可逕撥臺北市民當家熱線：1999報案，環保局將派員前往現場稽查。  ,21001.0,112-11-16 11:05,112-11-16 11:05,臺北市政府環境保護局空污噪音防制科
2023-12-17 12:54:56,https://www.dep.gov.taipei/News_Content.aspx?n=ACEFA960B5A4ACD7&sms=87415A8B9CE81B16&s=BE7A20B12857B756,鄰居半夜唱卡拉OK、大清早裝潢施工產生噪音，是否有法可管?," 1.本市公告「臺北市禁止從事妨礙安寧行為之區域範圍及時段」(1)於本市各類噪音管制區晚上10時至翌日上午8時及假日中午12時至下午2時，不得使用非屬營業用卡拉OK之行為。非屬營業用卡拉OK，指非屬「視聽歌唱業」營業場所許可登記有案之營業場所及其他非營業場所，而有提供伴唱視聽設備供人歌唱之行為。(2)於本市各類噪音管制區住宅及公寓大廈平日晚上10時至翌日上午8時，及假日中午12時至下午2時、晚上6時至翌日上午8時，不得使用動力機械從事裝修工程致妨礙安寧之行為。2.違反以上規定，在稽查管制上，經陳情通報後，環保局即到場稽查，一旦有違規事實，不需量測噪音值即可取締違規行為，並處新臺幣3,000元以上3萬元以下罰鍰同時令其立即改善；如未遵行者，按次處罰。3.如非屬上述區域範圍及時段，營業場所及裝潢施工噪音須符合噪音管制標準。  ",38357.0,112-11-16 11:06,112-11-16 11:06,臺北市政府環境保護局空污噪音防制科
