Time,Url,Question,Answer,點閱數,資料更新,資料檢視,資料維護
2023-12-17 12:51:05,https://www.dep.gov.taipei/News_Content.aspx?n=ACEFA960B5A4ACD7&sms=87415A8B9CE81B16&s=787B8C7A2F43E4F6,本府推動禁用一次性及美耐皿餐具的政策目的為何？, 為促進垃圾減量、節能減碳及維護員工師生身體健康。 ,1814.0,112-11-16 11:14,112-11-16 11:14,臺北市政府環境保護局資源循環管理科
2023-12-17 12:51:07,https://www.dep.gov.taipei/News_Content.aspx?n=ACEFA960B5A4ACD7&sms=87415A8B9CE81B16&s=884478806A5F3A17,配合禁用一次性及美耐皿餐具，機關學校應宣導同仁注意什麼？, 自備環保杯取用飲水，減少購買瓶裝水。自備環保餐具，減少使用一次性及美耐皿餐具。 ,2128.0,112-11-16 11:15,112-11-16 11:15,臺北市政府環境保護局資源循環管理科
2023-12-17 12:51:09,https://www.dep.gov.taipei/News_Content.aspx?n=ACEFA960B5A4ACD7&sms=87415A8B9CE81B16&s=0FA8B8DB132C95D8,請舉出3種一次性餐具。, 紙餐盒、塑膠餐盒、木片餐盒、紙杯、塑膠杯、紙碗、塑膠碗、塑膠湯匙、紙盤、塑膠盤、紙碟、塑膠碟、免洗筷、塑膠攪拌棒、竹製攪拌棒、塑膠湯匙、塑膠刀子、塑膠叉子、竹製叉子、或其他用完即丟之餐飲用品。 ,3059.0,112-11-16 11:15,112-11-16 11:15,臺北市政府環境保護局資源循環管理科
2023-12-17 12:51:11,https://www.dep.gov.taipei/News_Content.aspx?n=ACEFA960B5A4ACD7&sms=87415A8B9CE81B16&s=54A9727549EE5CDB,美耐皿餐具表面刮痕裂縫遇熱食容易溶出哪種化學物質？, 三聚氰胺。 ,2075.0,112-11-16 11:16,112-11-16 11:16,臺北市政府環境保護局資源循環管理科
2023-12-17 12:51:14,https://www.dep.gov.taipei/News_Content.aspx?n=ACEFA960B5A4ACD7&sms=87415A8B9CE81B16&s=CF5D32BEA23B3908,禁用一次性及美耐皿餐具後，可以哪些材質之餐具替代？, 可改以陶、瓷、玻璃及不銹鋼材質製成之環保餐具替代。 ,2603.0,112-11-16 11:16,112-11-16 11:16,臺北市政府環境保護局資源循環管理科
2023-12-17 12:51:14,https://www.dep.gov.taipei/News_Content.aspx?n=ACEFA960B5A4ACD7&sms=87415A8B9CE81B16&s=1CBF9E8559314905,何謂低頻噪音?陳情人應如何配合檢測?, 一、所謂低頻音量係指音源在20Hz至200Hz頻率範圍內之音量。二、依噪音管制標準第3條第6項規定，測量音源20Hz至200Hz頻率範圍時，應於陳情人所指定其居住生活之室內地點測量，故本局環保稽查大隊稽查人員辦理低頻噪音案件需會同陳情人方可處理。  ,15921.0,112-11-14 11:24,112-11-14 11:24,臺北市政府環境保護局環保稽查大隊
2023-12-17 12:51:16,https://www.dep.gov.taipei/News_Content.aspx?n=ACEFA960B5A4ACD7&sms=87415A8B9CE81B16&s=726A27323B59EBD8,汽機車噪音如何檢舉?, 環境部設立有噪音車檢舉網站（網址），若民眾發現噪音車輛可依「使用中機動車輛噪音妨害安寧檢舉辦法」相關規定，並利用該檢舉網站檢舉，敘明車號、車種、發現時間、地點及妨害安寧事實或違規證據(例如相片或影片等)並留下相關資訊，經查證確有妨害安寧情形者本局環保稽查大隊將通知車主前往指定地點接受檢驗。  ,15646.0,112-11-28 17:19,112-11-28 17:19,臺北市政府環境保護局環保稽查大隊
2023-12-17 12:51:16,https://www.dep.gov.taipei/News_Content.aspx?n=ACEFA960B5A4ACD7&sms=87415A8B9CE81B16&s=DF7A03FBD7312EC9,內湖復育園區的前身是什麼?怎麼復育成現在的環保綠地?," 內湖復育園區前身是內湖垃圾山清除完成，回溯到民國59年，臺北市尚無掩埋場及焚化廠可處理本市一般家戶垃圾，因此垃圾車收集後則直接堆置基隆河岸，15年間遂形成長1,060公尺、寬350公尺、高53公尺之內湖垃圾山。但是在民國74年內湖垃圾山突然起火燃燒後關閉，並緊急啟用福德坑掩埋場進行垃圾掩埋。之後由於垃圾山侵入基隆河行水區50公尺，為避免造成水災氾濫及解決內湖垃圾山垃圾滲出水持續污染基隆河水質及週邊土地，民國86年行政院要求本市規劃清除，民國94年完成清除工程規劃，並於民國95年工程發包，於民國103年竣工完成，並已於104年6月5日開放民眾使用。 ",4724.0,112-11-15 11:13,112-11-15 11:13,臺北市政府環境保護局廢棄物處理場
2023-12-17 12:51:19,https://www.dep.gov.taipei/News_Content.aspx?n=ACEFA960B5A4ACD7&sms=87415A8B9CE81B16&s=18A53D82DC9A4BDE,內湖復育園區地理環境及未來規劃願景?, 內湖復育園區，北面七星山，南臨基隆河，東起南湖大橋，西至安美街佔地10公頃，區內有森林小丘、健康步道及願景相框等，民眾可健行登高至40米高地，遠眺臺北101大樓，欣賞市區美景，一覽無遺。另外沿著基隆河岸尚有自行車車(步)道，約1.5公里，民眾可做休憩、健走及運動，是一座多元化綠地公園。園區內觀景山丘、活動草地，結合鄰近潭美街葫蘆洲運動公園之溫水游泳池、網球場等休閒設施、河濱自行車道、花海、歷史建築-葫蘆墩吊橋橋墩等，可形成一個異於其他河濱公園之完整多功能休閒園區。 ,3342.0,112-11-15 11:13,112-11-15 11:13,臺北市政府環境保護局廢棄物處理場
2023-12-17 12:51:21,https://www.dep.gov.taipei/News_Content.aspx?n=ACEFA960B5A4ACD7&sms=87415A8B9CE81B16&s=F1E382BCA693F6BB,內湖垃圾山挖出許多59年~74年庶民文物，也保存一座舊吊橋橋墩?, 本工程開挖出許多「骨董級」廢棄物是印證北市早年生活文物，經清洗整理後將完整保存，場內葫蘆墩吊橋橋墩，推測1930~1940年代興建連接內湖及南港之通道，目前僅剩北側橋墩(柱)，已經本市文化資產委員會認定有文化保存價值，列為歷史建物保留。 ,3420.0,112-11-15 11:14,112-11-15 11:14,臺北市政府環境保護局廢棄物處理場
2023-12-17 12:51:23,https://www.dep.gov.taipei/News_Content.aspx?n=ACEFA960B5A4ACD7&sms=87415A8B9CE81B16&s=59F57FD0903E095E,前往內湖復育園區交通路線?, 內湖復育園區交通路線▲公車：【247】、【247直】、【247區】、【279】、【681】公車於內湖焚化廠站【葫蘆洲運動公園】下車即可步行抵達園區入口。相關轉乘資訊，可查詢：臺北市大眾運輸轉乘▲自行前往：請參考附圖高速公路:由【東湖交流道】北下匝道下高速公路右轉後直行康寧路三段（請勿上南湖大橋），至潭美街口右轉，直行約900公尺，即可抵達園區入口。  ,5037.0,112-11-15 11:19,112-11-15 11:19,臺北市政府環境保護局廢棄物處理場
2023-12-17 12:51:25,https://www.dep.gov.taipei/News_Content.aspx?n=ACEFA960B5A4ACD7&sms=87415A8B9CE81B16&s=47C5EB49A82E02B7,〔污染防治監測及監督〕對於臺北市垃圾焚化廠排放之廢氣、廢水，相關單位應如何監督?, 環保局為能有效監督垃圾焚化廠污染排放，邀集各界專家、學者及當地里里長等十三人共同組成「臺北市垃圾焚化廠監督委員會」，目前每2個月召開會議審查焚化廠營運狀況，本廠定期彙整資料提出「營運管理及環境品質監測報告」，接受監督委員會審查與監督，本廠並將相關資料連上網路，提供民眾隨時查閱了解整體焚化廠污染排放狀況，本廠網址：連結於首頁左方選單點選「業務資訊」、「營運管理及監測報告」欄。 ,20002.0,112-11-27 09:34,112-11-27 09:34,臺北市政府環境保護局北投垃圾焚化廠
2023-12-17 12:51:28,https://www.dep.gov.taipei/News_Content.aspx?n=ACEFA960B5A4ACD7&sms=87415A8B9CE81B16&s=3EAD7DB9219A21A7,〔一般〕北投焚化廠主要工作是什麼?, 本廠主要工作是妥善處理臺北市產生之一般廢棄物及經本局同意進廠之本市產生的一般事業廢棄物，有關更多的資訊可詢問本廠分機02-28360050轉452或461。 ,19144.0,112-11-20 14:30,112-11-20 14:30,臺北市政府環境保護局北投垃圾焚化廠
2023-12-17 12:51:30,https://www.dep.gov.taipei/News_Content.aspx?n=ACEFA960B5A4ACD7&sms=87415A8B9CE81B16&s=1FFD0E14115E9465,〔一般〕北投焚化廠處理何種類型廢棄物?, 本廠處理本市一般廢棄物及一般事業廢棄物。 ,18816.0,112-11-20 14:30,112-11-20 14:30,臺北市政府環境保護局北投垃圾焚化廠
2023-12-17 12:51:32,https://www.dep.gov.taipei/News_Content.aspx?n=ACEFA960B5A4ACD7&sms=87415A8B9CE81B16&s=6C29BF84FE5112C3,〔一般〕參觀焚化廠要如何申請?, 參觀焚化廠申請（20人以上參觀團體）1.網路申請：請至臺北市政府-市民服務大平臺https://service.gov.taipei/，點選「網路申辦」。2.傳真、郵寄申請：(1)請至臺北市政府-市民服務大平臺https://service.gov.taipei/Case/ApplyWay/201910220011，檔案下載區。(2)申請表單填寫後，傳真至(02)28350651或郵寄至北投垃圾焚化廠（11277臺北市北投區洲美街271號），若欲確認傳真是否收到請撥(02)28360050轉105。3.電話申請：(1)上班時間請撥打本廠(02)28360050轉130，由承辦人直接為您服務。(2)請於參觀前兩週來電預約。4.親自申辦：上班時間，請直接至本廠第三組（公服小組）洽辦申請。 ,19927.0,112-11-20 14:31,112-11-20 14:31,臺北市政府環境保護局北投垃圾焚化廠
2023-12-17 12:51:34,https://www.dep.gov.taipei/News_Content.aspx?n=ACEFA960B5A4ACD7&sms=87415A8B9CE81B16&s=E0FD486FAD8AD81D,〔廢棄物代處理申請〕處理一般廢棄物及一般事業廢棄物的費用如何計算?," 依臺北市政府公告,本廠代處理一般事業廢棄物及一般廢棄物收費標準,自110年1月1日起每公噸新臺幣2,705元，重量不滿100公斤以100公斤計算,超過100公斤者依實際過磅重量計價。 ",46240.0,112-11-20 14:31,112-11-20 14:31,臺北市政府環境保護局北投垃圾焚化廠
2023-12-17 12:51:37,https://www.dep.gov.taipei/News_Content.aspx?n=ACEFA960B5A4ACD7&sms=87415A8B9CE81B16&s=0D938D68BD9D990C,〔污染防治監測及監督〕北投焚化廠所排放之廢氣、廢水，如何監測?, 1.廢氣排放部分： 本廠於88年6月份起，約每三個月委外檢測固定污染源之排放污染物，且設置連續監測儀器24小時連續監控，監測項目為氯化氫(HCl)、氮氧化物(NOx)、硫氧化物(SOx)、一氧化碳(CO)、氧氣（O2）、含水率（H2O）、不透光率及粒狀污染物等項。另本廠亦將其中（氯化氫、氮氧化物、硫氧化物、不透光率等）重要空氣汙染物數值傳送至本廠管理大樓大廳、出口地磅及承德路與立賢路口處顯示看板上，使民眾及管理人員能了解廢氣排放情形。2.廢水排放部分： 本廠於108年1月31日起，已完成納管工程使用，廢水經處理後回收再利用，僅少部分處理後納入臺北市污水下水道系統處理。  ,22743.0,112-11-27 09:35,112-11-27 09:35,臺北市政府環境保護局北投垃圾焚化廠
2023-12-17 12:51:39,https://www.dep.gov.taipei/News_Content.aspx?n=ACEFA960B5A4ACD7&sms=87415A8B9CE81B16&s=84BFE1D13CFD4756,〔垃圾焚化處理技術〕北投焚化廠廢氣處理設備為何?, 本廠廢氣處理設備主要由下列次系統所構成： 1.除氮氧化物系統： 採用選擇性非觸媒還原法，藉噴灑尿素溶液進入高溫的焚化爐內，去除燃燒過程產生的氮氧化物，並以煙道出口之氮氧化物濃度回授控制尿素溶液噴灑量，將氮氧化物排放濃度自動控制於100ppm以內。。2.半乾式洗煙塔： 噴灑再利用水以降低煙道廢氣體之溫度，並利用高速霧化轉輪將噴入之消石灰及活性碳乳泥霧化成細微顆粒，與煙道廢氣體充分混合，以消石灰中和燃燒過程產生之酸性氣體，並以活性碳吸附戴奧辛及重金屬等有害物質。3.袋濾式集塵器： 以每爐總數1184支濾袋過濾捕集反應灰及煙道廢氣體中之粉塵，將煙道出口之粒狀污染物控制在20mg/Nm3以下。4.廢氣再加熱系統： 可將空氣加熱至200℃後，引入煙囪與排放之廢氣混合以提昇整體廢氣溫度，避免大氣環境溫度較低時在煙囪出口處形成白煙。 ,23754.0,112-11-20 14:34,112-11-20 14:34,臺北市政府環境保護局北投垃圾焚化廠
2023-12-17 12:51:41,https://www.dep.gov.taipei/News_Content.aspx?n=ACEFA960B5A4ACD7&sms=87415A8B9CE81B16&s=7F6D91B476E7B5B9,〔垃圾焚化處理技術〕北投焚化廠如何控制戴奧辛排放?," 本廠將活性碳混入消石灰乳泥一同噴灑於煙道廢氣中，以吸附燃燒後廢氣中之戴奧辛，並依據法規「廢棄物焚化爐戴奧辛管制及排放標準」，設定操控參數，將垃圾焚化爐溫度控制於攝氏850℃至1,050℃之間、氣體滯留於焚化爐達2秒以上、煙道出口一氧化碳濃度低於31.8ppm、排氣中含氧量控制於6%至10%之間以及集塵設備入口廢氣溫度控制於攝氏150±5℃範圍內，以確保戴奧辛排放濃度符合法規標準。 ",24707.0,112-11-20 14:34,112-11-20 14:34,臺北市政府環境保護局北投垃圾焚化廠
2023-12-17 12:51:43,https://www.dep.gov.taipei/News_Content.aspx?n=ACEFA960B5A4ACD7&sms=87415A8B9CE81B16&s=DB2E6EAE48A1D894,〔垃圾焚化處理技術〕北投焚化廠之飛灰如何處理?, 垃圾焚化後，經節熱器、半乾式洗煙塔及袋濾式集塵器所收集之飛灰送至飛灰貯槽再經：1.由飛灰處理設備將飛灰摻配適當比例之水泥、重金屬螯合劑及水，經混練機均勻攪拌混練成穩定化物，並以太空包裝袋養生，經重金屬溶出試驗（TCLP）低於有害事業廢棄物認定標準後，送至臺北市政府環境保護局廢棄物處理場暫存。2.由飛灰水洗設備水洗，去除氯塩達1%以下及無害化後送至水泥廠再利用，另 外去除氯達3%以下送台灣鋼聯公司作為替代部份鹼劑使用。  ,22624.0,112-11-20 14:35,112-11-20 14:35,臺北市政府環境保護局北投垃圾焚化廠
2023-12-17 12:51:46,https://www.dep.gov.taipei/News_Content.aspx?n=ACEFA960B5A4ACD7&sms=87415A8B9CE81B16&s=AADB20EBC35BF657,〔垃圾焚化處理技術〕北投焚化廠之廢水如何處理?, 1.北投廠有二套廢水處理場，其中焚化廢水處理場係將廠區各排放洩水之無機廢水，泵送至廢水處理場，經化學混凝、沈澱、過濾、及中和處理等程序，再併入有機廢水處理程序混合處理。一般生活廢水等有機廢水，泵送至廢水處理場，經調勻、曝氣、活性污泥生物處理、二次混凝程序及過濾殺菌程序後，成為處理後之再利用水。焚化廢水場處理後之再利用水無對外排放，本廠檢驗室亦定期檢測水質以確保廢水處理之成效符合標準。2.另一套廢水處理場為飛灰水洗專用廢水處理場，飛灰水洗後所產生廢水，經化學混凝沉澱處理後，納入本市下水道系統一併處理，其沉澱所產生之污泥則委託甲級處理場處理。 ,20231.0,112-11-20 14:35,112-11-20 14:35,臺北市政府環境保護局北投垃圾焚化廠
2023-12-17 12:51:48,https://www.dep.gov.taipei/News_Content.aspx?n=ACEFA960B5A4ACD7&sms=87415A8B9CE81B16&s=6FC49D865E814231,〔垃圾焚化處理技術〕北投焚化廠如何管制空污排放?, 本廠每座焚化爐均設置除氮氧化物設備、半乾式洗煙塔及袋濾式集塵器，能有效去除燃燒廢氣中各項空氣污染物，煙道設置廢氣排放連續自動監測設施，針對各焚化爐進行二十四小時連續監控，監控數值直接傳達中央控制室進行回授控制，適時修正相關參數，以達到最佳燃燒及廢氣處理之控制，另亦將其中(氯化氫、氮氧化物、硫氧化物、不透光率等)重要空氣污染物數值傳送至本廠管理大樓大廳、出口地磅及承德路與立賢路口處顯示看板上，並連線至環保局，使民眾能隨時了解本廠廢氣排放情形。 ,21085.0,112-11-20 14:36,112-11-20 14:36,臺北市政府環境保護局北投垃圾焚化廠
2023-12-17 12:51:50,https://www.dep.gov.taipei/News_Content.aspx?n=ACEFA960B5A4ACD7&sms=87415A8B9CE81B16&s=F6954BEE090619B3,〔回饋設施〕請問游泳池各場次開放時間為何?, 1.第一場05：30～07：302.第二場08：30～11：303.第三場13：30～16：304.第四場18：00～21：00 ,31158.0,112-11-20 14:37,112-11-20 14:37,臺北市政府環境保護局北投垃圾焚化廠
2023-12-17 12:51:52,https://www.dep.gov.taipei/News_Content.aspx?n=ACEFA960B5A4ACD7&sms=87415A8B9CE81B16&s=595C88B3FA7C9F74,〔回饋設施〕可免費使用對象有哪些?, 1.設籍於本市內湖區、南港區、文山區、北投區、士林區區民憑身分證明及志工憑志願服務榮譽卡免費【身份證明文件：大人憑身分證正本或雙證件(駕照正本及戶口名簿正本)，兒童憑戶口名簿正本或三個月內有效之戶籍謄本正本】。2.身心障礙者及其監護人或必要之陪伴者一人，憑身心障礙手冊免費。 ,21755.0,112-11-20 14:37,112-11-20 14:37,臺北市政府環境保護局北投垃圾焚化廠
2023-12-17 12:51:55,https://www.dep.gov.taipei/News_Content.aspx?n=ACEFA960B5A4ACD7&sms=87415A8B9CE81B16&s=9169F130E7E233C7,〔回饋設施〕小朋友(兒童)如果沒有身分證該如何辦理入場?," 請攜帶戶口名簿正本或三個月內有效之戶籍謄本正本，即可入場;未滿14歲之學童亦可至主題館1樓服務台申辦游泳證,憑證入場。 ",19376.0,112-11-20 14:38,112-11-20 14:38,臺北市政府環境保護局北投垃圾焚化廠
2023-12-17 12:51:57,https://www.dep.gov.taipei/News_Content.aspx?n=ACEFA960B5A4ACD7&sms=87415A8B9CE81B16&s=C7DB71F7BAE3E4E7,〔回饋設施〕戶口名簿或戶籍謄本為何不能使用影本?, 為維護每位市民使用游泳池設施的公平性，據以證明當時進入泳池時之身分（兒童），造成不便之處請大家見諒。 ,18877.0,112-11-20 14:39,112-11-20 14:39,臺北市政府環境保護局北投垃圾焚化廠
2023-12-17 12:51:59,https://www.dep.gov.taipei/News_Content.aspx?n=ACEFA960B5A4ACD7&sms=87415A8B9CE81B16&s=55F58ADE248233EF,食用後或燉湯後剩下的骨頭，該怎麼分類？, 食用後剩下的骨頭不易完全破碎，豬隻無法吞嚥，請歸類為堆肥(非養豬)廚餘。 相關疑義請洽環保局廢棄物處理管理科（電話02-27208889轉7284）。 ,6198.0,111-01-18 17:57,112-11-24 18:41,臺北市政府環境保護局廢棄物處理管理科
2023-12-17 12:52:00,https://www.dep.gov.taipei/News_Content.aspx?n=ACEFA960B5A4ACD7&sms=87415A8B9CE81B16&s=4FFB6A1081448F88,家中的貓砂是木屑做的木屑砂，可以回收嗎？, 貓砂並非廚餘，且夾雜動物糞便，有衛生安全之虞，故不回收，請併入一般垃圾清理。相關疑義請洽環保局廢棄物處理管理科（電話02-27208889轉7284）。 ,9237.0,111-01-18 17:57,112-11-24 18:41,臺北市政府環境保護局廢棄物處理管理科
2023-12-17 12:52:02,https://www.dep.gov.taipei/News_Content.aspx?n=ACEFA960B5A4ACD7&sms=87415A8B9CE81B16&s=001AEB0757844CE7,環境保護局山水綠生態公園主要設施？, 主要設施包含入口意象 、山豬石雕廣場、植生綠化、沼澤區、展望台及遊客服務中心、花架工程及瞭望台、野溪復育、兒童遊具設施、太陽能花鐘、步道等。 ,2955.0,112-11-15 11:22,112-11-15 11:22,臺北市政府環境保護局廢棄物處理場
2023-12-17 12:52:04,https://www.dep.gov.taipei/News_Content.aspx?n=ACEFA960B5A4ACD7&sms=87415A8B9CE81B16&s=99B1BC5CD4A681F3,生肉、生內臟、生菜葉都是生食，為什麼屬於「養豬廚餘」？, 養豬廚餘標售給養豬場後，養豬場會經過高溫蒸煮的處理程序後再給豬隻食用，所以只要是可以食用的食物，都屬於養豬廚餘。相關疑義請洽環保局廢棄物處理管理科（電話02-27208889轉7284）。 ,6673.0,111-01-18 17:57,112-11-24 18:41,臺北市政府環境保護局廢棄物處理管理科
2023-12-17 12:52:04,https://www.dep.gov.taipei/News_Content.aspx?n=ACEFA960B5A4ACD7&sms=87415A8B9CE81B16&s=3A5256E5D010581F,過期食品、鹽、調味料或油品可以回收嗎？, 家戶中過期的調味料，因數量較少，尚不致影響作為豬食飼料之品質，可分類為養豬廚餘回收，至廢食用油屬資源回收之一般類，可用瓶子盛裝並加註食用油後交給資源回收車回收，勿置入養豬或堆肥廚餘。非家戶每日平均垃圾及廚餘排出量達30公斤者，應交由民間代清除處理業者清理，並依其清理規定辦理。相關疑義請洽環保局廢棄物處理管理科（電話02-27208889轉7284）。 ,48292.0,111-01-18 17:57,112-11-24 18:41,臺北市政府環境保護局廢棄物處理管理科
2023-12-17 12:52:06,https://www.dep.gov.taipei/News_Content.aspx?n=ACEFA960B5A4ACD7&sms=87415A8B9CE81B16&s=4B6DE75E38AA4093,低收入戶及中低收入專用垃圾袋補助金額？按戶還是按人計算？, 每年每人發放專用垃圾袋現金補助190元，以現金匯款方式匯入申請低收或中低收入戶身分時所提供予社會局的郵局或銀行帳戶。 ,5781.0,112-11-15 13:57,112-11-15 13:57,臺北市政府環境保護局資源循環管理科
2023-12-17 12:52:09,https://www.dep.gov.taipei/News_Content.aspx?n=ACEFA960B5A4ACD7&sms=87415A8B9CE81B16&s=9A62CA424467FEA4,參觀山水綠生態公園如何辦理？, 若係機關、團體需導覽簡報者，請先行電話聯絡，再來函環境保護局。廢棄物處理場地址：臺北市南港區南深路37號　電話：(02)2651-1434轉126。  ,4556.0,112-11-15 11:23,112-11-15 11:23,臺北市政府環境保護局廢棄物處理場
2023-12-17 12:52:11,https://www.dep.gov.taipei/News_Content.aspx?n=ACEFA960B5A4ACD7&sms=87415A8B9CE81B16&s=E39D494A5CAAD9A5,環境保護局山水綠生態公園交通問題？, (1)搭乘公共運輸公車：679號公車（動物園至南港）至福聖宮(山水綠生態公園)站捷運：捷運木柵站轉679號公車（動物園至南港）至福聖宮(山水綠生態公園)站南港展覽館站轉679號公車（南港至動物園）至福聖宮(山水綠生態公園)站(2)自行開車高速公路：國道3號於中央研究院（南深路）交流道下直走爬坡至山水綠生態公園一般道路：研究院路接舊莊街轉南深路至山水綠生態公園山水綠生態公園地址為臺北市南港區南深路37號。山水綠生態公園電話：(02)2651-4865 ,10862.0,112-11-15 11:24,112-11-15 11:24,臺北市政府環境保護局廢棄物處理場
2023-12-17 12:52:13,https://www.dep.gov.taipei/News_Content.aspx?n=ACEFA960B5A4ACD7&sms=87415A8B9CE81B16&s=56D62D85F0C631B2,環境保護局山水綠生態公園及福德坑環保復育園區開放時間？, 一、山水綠生態公園：　　夏季（5月至10月）上午5時至下午9時、冬季（11月至4月）上午6時至下午8時。       (自110年3月1日起每週一休園) 二、福德坑環保復育園區：　　每日上午6時至下午7時。(每週一休園)  ,4631.0,112-11-15 11:25,112-11-15 11:25,臺北市政府環境保護局廢棄物處理場
2023-12-17 12:52:16,https://www.dep.gov.taipei/News_Content.aspx?n=ACEFA960B5A4ACD7&sms=87415A8B9CE81B16&s=8411A77E9BB630B5,本地位處縣市交界，時有外縣市民眾攜帶垃圾棄置於本地，請說明外縣市民眾在本市投遞垃圾，是否亦應使用專用垃圾袋？," 是的，凡接受本市環保局垃圾清除處理服務者，排出垃圾均應購買本市專用垃圾袋，惟使用專用垃圾袋之垃圾包仍應依本市環保局規定時間、方式排出，不得任意棄置，否則，仍屬違反廢棄物清理法行為，環保局將予以告發，處新臺幣3,600元至6,000元之罰款。 ",3354.0,112-11-14 18:33,112-11-14 18:33,臺北市政府環境保護局環境清潔管理科
2023-12-17 12:52:18,https://www.dep.gov.taipei/News_Content.aspx?n=ACEFA960B5A4ACD7&sms=87415A8B9CE81B16&s=D747658391B02299,已使用專用垃圾袋盛裝之垃圾包，可否置於其他塑膠袋、紙箱或其他容器中交給環保局垃圾車清理？, 原則上，交給環保局清理的垃圾都必須裝在專用垃圾袋內，故不能再用其他塑膠袋、紙箱或其他容器盛裝垃圾。 ,3935.0,112-11-14 18:23,112-11-14 18:23,臺北市政府環境保護局環境清潔管理科
2023-12-17 12:52:20,https://www.dep.gov.taipei/News_Content.aspx?n=ACEFA960B5A4ACD7&sms=87415A8B9CE81B16&s=053FD8FF7D869D08,機關、學校內原使用垃圾子車裝置垃圾，垃圾費隨袋徵收後應如何因應？, 為促進垃圾減量、資源回收，落實污染者付費精神，垃圾費隨袋徵收後凡由環保局負責清運垃圾之機關、學校均仍必須配合使用專用垃圾袋清理垃圾，其具體作法是由機關、學校編列垃圾費預算，逕向環保局委託之行銷商採購專用垃圾袋使用，專用垃圾袋之規格可依機關、學校之需求自行選擇，例如，可選用較小型之專用垃圾袋供各班級或辦公室使用，然後收集至垃圾子車，交由環保局垃圾車清運，或選用大型之專用垃圾袋，盛裝各班級、辦公室以普通垃圾袋包裝之垃圾，再放入垃圾子車，交環保局垃圾車清運；除此，機關、學校亦可選擇公開招標委託本市合格之廢棄物清除機構清理垃圾，直接繳交垃圾處理費給焚化廠或掩埋場，不必另外購買使用專用垃圾袋。  ,5282.0,112-11-14 18:24,112-11-14 18:24,臺北市政府環境保護局環境清潔管理科
