Time,Url,Question,Answer,點閱數,資料更新,資料檢視,資料維護
2023-12-16 23:44:30,https://www.tpedoit.gov.taipei/News_Content.aspx?n=E0F9435AE8CF1C0E&sms=87415A8B9CE81B16&s=2C8F9FF3E2A26E26,請問哪裡可以索取臺北市觀光地圖摺頁？, 您可至臺北市各旅遊服務中心索取，或先電洽本局媒體出版科詢問（電話：臺北市民當家熱線1999（外縣市請撥 02-27208889）轉7564），如有庫存，可附回郵信封寄至臺北市信義區市府路1號4樓觀光傳播局媒體出版科，我們將依您所提供地址郵寄。國內郵資：1份-6元，2、3、4份-11元。信封：須比平信信封略大。 ,1378,112-11-28 12:57,112-11-28 12:57,臺北市政府觀光傳播局
2023-12-16 23:44:32,https://www.tpedoit.gov.taipei/News_Content.aspx?n=E0F9435AE8CF1C0E&sms=87415A8B9CE81B16&s=C24C8C6F49C341C1,請問《台北畫刊》及《TAIPEI》英日文季刊何時出刊？, 《台北畫刊》係每月出刊，出刊日為每月5日；《TAIPEI》每逢3、6、9、12月10日出刊。  ,4729,112-03-08 14:20,112-11-27 13:25,臺北市政府觀光傳播局
2023-12-16 23:44:34,https://www.tpedoit.gov.taipei/News_Content.aspx?n=E0F9435AE8CF1C0E&sms=87415A8B9CE81B16&s=5DA39C6A0D808E86,請問何處可得知貴單位出版訊息？, 本局新書上市訊息請鎖定「臺北市政府觀光傳播局」官網最新消息   ,3563,110-11-22 07:46,112-11-27 13:25,臺北市政府觀光傳播局
2023-12-16 23:44:37,https://www.tpedoit.gov.taipei/News_Content.aspx?n=E0F9435AE8CF1C0E&sms=87415A8B9CE81B16&s=DBC3E0B855DA8F05,請問如何索取當期的《台北畫刊》、《TAIPEI》及過期的《台北畫刊》、《TAIPEI》？, 一、當期的《台北畫刊》，您可至臺北市市府大樓1樓市民服務組、臺北捷運各站、臺北市各旅遊服務中心、臺北市各區公所、稅捐處、臺北市立圖書館總館及各分館、中正紀念堂、國父紀念館等地索取，外縣市可至交通部觀光局輔導各地旅遊服務中心及各國家風景區遊客中心索取。二、當期的《TAIPEI》英日文季刊您可至臺北市市府大樓1樓市民服務組、臺北捷運各站、臺北市各旅遊服務中心、臺北市立圖書館總館及各分館、中正紀念堂、國父紀念館等地索取。三、過期的《台北畫刊》與《TAIPEI》英日文季刊，您可先電洽本局媒體出版科，電話：臺北市民當家熱線1999（外縣市請撥 02-27208889）轉2028、7564詢問是否仍有所需期數，如有，您可採附回郵方式索取；或至《台北旅遊網》官方網站，點選影音刊物欄目進入《台北畫刊》之各期畫刊專區即可看到過往刊物。另本局於國家圖書館、立法院國會圖書館、國立臺灣圖書館、國立臺灣大學圖書館、國立公共資訊圖書館、臺南市立圖書館、高雄市立圖書館總館、屏東縣立圖書館總館、 國立東華大學圖書館、臺北市立圖書館等處均寄存有年度合訂本，您亦可至上述圖書館查閱。四、對於不方便至各放置點索閱的市民及讀者，本局亦提供郵政劃撥寄送服務。您可至郵局索取劃撥單劃撥，戶名︰臺北市政府觀光傳播局；帳號︰16630048。台北畫刊（12期）：國內（平寄）新臺幣300元，香港/澳門（航空平寄）新臺幣600元，亞洲（航空平寄）新臺幣780元，歐、美、非洲（航空平寄）新臺幣888元。《TAIPEI》英日文季刊（6期）：國內（平寄）新臺幣180元，香港/澳門（航空平寄）新臺幣540元，亞洲（航空平寄）新臺幣660元，歐、美、非洲 （航空平寄）新臺幣900元。 ,6251,112-11-28 12:58,112-11-28 12:58,臺北市政府觀光傳播局
2023-12-16 23:44:39,https://www.tpedoit.gov.taipei/News_Content.aspx?n=E0F9435AE8CF1C0E&sms=87415A8B9CE81B16&s=0BA9CA44EE278E0A,請問如何購買觀光傳播局所出版的「臺北觀光行銷叢書」？, 您可至政府出版品展售門市洽購：五南文化廣場及其網路書店、國家書店松江門市及其網路書店；另亦可至三民書局、誠品、紅螞蟻、博客來網路等書店洽詢購買。 ,4665,112-08-08 13:19,112-11-27 13:46,臺北市政府觀光傳播局
2023-12-16 23:44:41,https://www.tpedoit.gov.taipei/News_Content.aspx?n=20D462870DD3A837&sms=87415A8B9CE81B16&s=2BE95553973C450F,家中有線電視原本與業者簽訂一定期間的優惠專案，如提前解約費用如何計算？, （1）依國家通訊傳播委員會公告「有線廣播電視服務定型化契約應記載及不得記載事項」規定業者不得收取違約金。（2）惟近來有線電視業者皆推出收視優惠方案供用戶選擇，並要求用戶須收視1年(或半年)，若收視未滿1年(或半年)須依原價補繳差額，針對此一情形，國家通訊傳播委員會解釋說明，此為「附條件契約」，若民眾終止契約，則應返還當初獲得的優惠，業者並無違法。提醒民眾選擇優惠方案前應確認提前終止契約時的處理方式。 ,1331,112-10-31 07:48,112-11-27 13:25,臺北市政府觀光傳播局
2023-12-16 23:44:43,https://www.tpedoit.gov.taipei/News_Content.aspx?n=20D462870DD3A837&sms=87415A8B9CE81B16&s=C2C371591F6A00B4,有線電視收視費用有幾種繳費方式？如何辦理有線電視變更繳費方式？, （1）依國家通訊傳播委員會公告「有線廣播電視服務定型化契約應記載及不得記載事項」第3點規定，有線電視繳費期限分為現付制與預付制，現付制為當月收視後繳納；預付制為收視前預先繳納，尚分成雙月繳、季繳、半年繳與一年繳等方式，有線電視業者並對雙月繳、季繳、半年繳與一年繳等預繳用戶酌予提供優惠。（2）收視戶可選擇自行繳款、郵局劃撥、銀行郵局轉帳、信用卡、便利商店繳款等方式繳交收視費。（3）收視戶可依需求選擇上述繳納期限與方式。如未約定繳費期限、繳費方式，則視同採當月繳，繳款方式依前述方式為之。（4）如須變更繳費方式，可直接與有線電視系統業者聯繫。 ,1415,112-10-31 07:46,112-11-27 13:25,臺北市政府觀光傳播局
2023-12-16 23:44:46,https://www.tpedoit.gov.taipei/News_Content.aspx?n=20D462870DD3A837&sms=87415A8B9CE81B16&s=18858A4DC894B4E5,低收入戶及中低收入戶如何向有線電視業者申請收視費用減免？, （1）凡於臺北市政府社會局登記有案的低收入戶，可攜帶行政處分、總清查核定通知書、各區公所開立之證明文書、已完成線上福利身分開通之台北卡APP系統畫面等福利資格識別證明(正本、影本各1份)及個人國民身份證向當地1家有線電視業者申請，免收裝機費及基本頻道每月收視費。 （2）於臺北市政府社會局登記有案的中低收入戶，可攜帶行政處分、總清查核定通知書、各區公所開立之證明文書、已完成線上福利身分開通之台北卡APP系統畫面等福利資格識別證明（正本、影本各1份）及個人國民身分證正本，向所在地之有線電視業者申請，基本頻道收視費以二分之一月費計價為原則。 （3）如原未申裝有線電視，自申裝當日起即享有前述優惠；如前已申裝但以一般用戶計費，自申裝次月起優惠。 （4）因(中)低收入戶資格係每年重新認定，請於取得新的(中)低收入戶相關福利資格識別證明後儘速向業者重新申請。如未再提出申請，業者將依一般收視戶收費。 ,11418,112-01-06 17:18,112-11-27 13:25,臺北市政府觀光傳播局
2023-12-16 23:44:48,https://www.tpedoit.gov.taipei/News_Content.aspx?n=20D462870DD3A837&sms=87415A8B9CE81B16&s=41A367FEAEA966B4,有線電視如發生斷訊如何處理？有無賠償規定？, （1）國家通訊傳播委員會公告「有線廣播電視服務定型化契約應記載及不得記載事項」第9點第1項及第2項規定：「甲方發生無法收視或收視不良狀況，乙方於接獲甲方維修通知時，應於二十四小時內到府維修。但經雙方同意另行約定者，不在此限。倘因天災等不可抗力因素或不可歸責於乙方之事由所致無法於前項期限內到府維修，乙方應於前述不可抗力因素或不可歸責事由結束後，依前項規定辦理。」（2）第9點3項規定：「乙方違反第一項規定之到府維修時間時，乙方應按日減少日收視費用及機上盒租金；如逾到府維修時間十天以上始行修復時，乙方應免除當月收視費用及機上盒租金。」 ,1008,112-01-06 14:42,112-11-27 13:25,臺北市政府觀光傳播局
2023-12-16 23:44:50,https://www.tpedoit.gov.taipei/News_Content.aspx?n=20D462870DD3A837&sms=87415A8B9CE81B16&s=02728BA34E0E7E83,同一「戶」接裝有線電視於多台電視機，費用如何計算？," （1）本府公告核准112年度本市各有線廣播電視系統經營者之基本頻道收視費用上限為每月每戶200元至530元不等。裝機費為1,200元。單一分機裝機費：於主機裝機時設置：300元；於主機裝機後設置：500元（以上費用不含數位機上盒押金）。（2）數位機上盒費：每戶第1臺免收保證金，第2臺（含）以上每臺得收保證金1,000元。但107年12月31日前已裝設或申請裝設者，前2臺仍免收保證金(含定期免費更換數位機上盒)。（3）舉例如下：A.王先生1月間搬入新家，新家僅有家人居住，王先生計劃在客廳裝接1台有線電視主機，另外在主臥室裝接1台有線電視分機，此時王先生需繳客廳主機裝機費1,200元及第1個月收視費（最多）490元(如選購A組)，分機裝機費300元，及數位機上盒保證金1,000元。以後每個月王先生只需繳收視費（最多）490元。B.王先生3月間決定在1間套房及餐廳各再裝接1台有線電視分機，須另支付2台分機裝機費各500元（合計1,000元），及數位機上盒保證金2,000元（每臺1,000元）。此時王先生家中收視有線電視的電視雖共4台，但每月仍僅需繳付基本頻道收視費（最多）490元。C.如王先生5月間決定將家中套房出租，並且已經出租，因屬營業之租賃行為，王先生應另外與有線電視系統業者依民事規定議定出租套房部分的收視費用。 ",8990,112-01-06 14:38,112-11-27 13:25,臺北市政府觀光傳播局
2023-12-16 23:44:53,https://www.tpedoit.gov.taipei/News_Content.aspx?n=20D462870DD3A837&sms=87415A8B9CE81B16&s=F1B90C61ABEAA093,112年度臺北市各有線電視業者收視費用是多少？," (1) 112年度實施分組付費，每家業者都提供3種組合供收視戶選擇，各有線電視業者基本頻道A組每月每戶收視費用上限，除北都數位外，其餘9家均為490元。(2)各家業者每月每戶收視費用上限如下(惟業者得視各該經營區域特性、社區規模及議價結果等市場狀況，予以差別收費):a.陽明山、新台北、金頻道、大安文山：基本頻道A組490元，基本頻道B組 200元，基本頻道C組530元。b.麗冠、長德、萬象：基本頻道A組490元，基本頻道B組200元，基本頻道C組510元。 c.聯維、寶福：基本頻道A組490元，基本頻道B組200元，基本頻道C組510元。d.北都數位：基本頻道A組445元，基本頻道B組200元，基本頻道C組525元。 (3)各有線電視業者須提供雙月繳以上收視戶折扣：雙月繳合計至少10元、季繳合計至少15元，半年繳合計至少45元，年繳合計至少90元。(4)裝機、復機及移機裝置費用：a.裝機費：1,200元。b.單一分機裝機費：於主機裝機時設置：300元；於主機裝機後設置：500元。c.復機費：原訂戶在契約終止3個月後申請復機者，視為新裝機戶，比照一般裝機費收費。原訂戶在契約終止3個月內 (含3個月) 申請復機者，免收復機費。但停機係因原訂戶違反有線廣播電視服務定型化契約應記載及不得記載事項第12點第2項規定者，不在此限。原訂戶在契約有效期間內暫停收視申請復機者，免收復機費，暫停收視期間並不得收取基本頻道收視費用。d.移機費：室內者，每機300元；室外者，每機500元。                                                              e.數位機上盒費：每戶第1臺免收保證金，第2臺（含）以上每臺得收保證金1,000元。但107年12月31日前已裝設或申請裝設者，前2臺仍免收保證金(含定期免費更換數位機上盒)。 ",15006,112-01-06 14:21,112-11-27 13:25,臺北市政府觀光傳播局
2023-12-16 23:44:55,https://www.tpedoit.gov.taipei/News_Content.aspx?n=20D462870DD3A837&sms=87415A8B9CE81B16&s=A3D59C41911EF2E4,臺北市各有線電視業者服務範圍？服務電話？, （1）北投、士林 陽明山有線電視公司：02-6606-0058、0809-001015（2）中山、大同、松山 長德有線電視公司：02-2165-3153、0800-088909 金頻道有線電視公司：02-66066855、0809-001016（3）內湖、南港、信義 麗冠有線電視公司：02-2165-3157、0800-222868 新台北有線電視公司：02-6601-5008、0809-001017（4）大安、文山 萬象有線電視公司：02-2165-3156、0800-600608 大安文山有線電視公司：02-6602-5898、0809-001018（5）中正、萬華 聯維有線電視公司：02-2311-8899、0800-231021 寶福有線電視公司：02-2311-6378、0800-363999（6）全市(服務範圍以業者公布為準) 北都數位有線電視公司：02-7734-0088、0809-096-111 ,2294,112-10-31 07:47,112-11-27 13:25,臺北市政府觀光傳播局
2023-12-16 23:44:57,https://www.tpedoit.gov.taipei/News_Content.aspx?n=20D462870DD3A837&sms=87415A8B9CE81B16&s=B4BB75028EF2F7A4,有線電視收費標準中有關「戶」的定義？, （1）依國家通訊傳播委員會公告的有線廣播電視系統經營者收費標準，係以每戶為收視費、裝機費等費用的計算基準。（2）國家通訊傳播委員會針對「戶」於98年2月2日以通傳營字第09841004180號函釋，「頂樓加蓋 (同一門牌在其屋頂加蓋居住空間者)」、「透天別墅 (同一基地整棟屬同一門牌者)」及「雖已分立門牌，但上下、左右、前後互通之共同生活家庭」，若皆確定為非出(分)租者，原則以「同樓層同門牌之共同生活家庭」比照收費。但若屬「一般套房出租」或「學生宿舍出租」者，因營業之租賃行為，難視為同一家庭之共同生活戶，故由房東及有線電視業者雙方依民事規定議定收視費用。 ,1555,112-10-31 07:44,112-11-27 13:25,臺北市政府觀光傳播局
2023-12-16 23:44:59,https://www.tpedoit.gov.taipei/News_Content.aspx?n=20D462870DD3A837&sms=87415A8B9CE81B16&s=09AA8518E82FC064,有線電視插播式字幕(跑馬燈)有什麼規定?, 依有線廣播電視法第39條規定在下列情形可以使用插播式字幕：（1）天然災害、緊急事故訊息之播送。（2）公共服務資訊之播送。（3）頻道異動之通知。（4）依其他法令之規定。 ,1257,112-10-31 07:43,112-11-27 13:25,臺北市政府觀光傳播局
2023-12-16 23:45:02,https://www.tpedoit.gov.taipei/News_Content.aspx?n=20D462870DD3A837&sms=87415A8B9CE81B16&s=8E9936044FDF88A4,有線電視業者可否在頻道插播廣告？, （1）插播廣告(即俗稱蓋台廣告)播放規定，依據有線廣播電視法第35條規定，如有線電視業者與頻道供應者達成書面協議，且廣告內容無違反法律強制或禁止規定等情形，則可依雙方協議內容自行插播廣告。（2）同法第25條第1項也規定節目應維持完整性，並與廣告區分。因此，有線電視業者插播廣告不得覆蓋節目。（3）如業者有違反前述情形，可利用1999、市政信箱或本局聯絡電話等反映。  ,891,112-10-31 07:40,112-11-27 13:25,臺北市政府觀光傳播局
2023-12-16 23:45:04,https://www.tpedoit.gov.taipei/News_Content.aspx?n=20D462870DD3A837&sms=87415A8B9CE81B16&s=AE45D9E300C8E53F,有線電視節目一再重播應向什麼機關反映？, （1）因有線電視業者實際為播出平臺，播出的節目除公用頻道（第3頻道）及地方頻道（第4頻道）外，其他節目（如：TVBS、HBO、衛視等）均係由頻道業者利用衛星發射方式直接提供有線電視業者，再傳送予收視戶付費收視，因此，有線電視業者無法對頻道節目進行編排及製作。（2）有線電視節目重播率偏高，原因在於頻道業者，本局已多次建議國家通訊傳播委員會督促頻道業者製作或引進新片，以降低重播率，提升頻道節目品質。（3）民眾如有這方面的建議，亦可直接向國家通訊傳播委員會反映。 ,814,112-10-31 07:38,112-11-27 13:25,臺北市政府觀光傳播局
2023-12-16 23:45:06,https://www.tpedoit.gov.taipei/News_Content.aspx?n=20D462870DD3A837&sms=87415A8B9CE81B16&s=9547C0F5D9B4943B,如何申請使用在有線電視公用頻道播出自製節目？, （1）凡政府機關、學校、團體及當地民眾均可在公用頻道（第3頻道）播出公益性、藝文性、社教性等節目。（2）本市各有線電視公用頻道係採統一播出，民眾可依照「社團法人臺北市有線電視公用頻道協會」訂定的「臺北市公用頻道使用規則」申請播出自製影片。使用規則及申請書等可至www.pac.org.tw查詢，或洽詢該協會服務專線：0800-013003。 ,946,112-10-31 07:37,112-11-27 13:25,臺北市政府觀光傳播局
2023-12-16 23:45:08,https://www.tpedoit.gov.taipei/News_Content.aspx?n=20D462870DD3A837&sms=87415A8B9CE81B16&s=7D26F086161C4D34,平面媒體如刊載性剝削廣告，如何處理？, 「兒童及少年性剝削防制條例」已於107年1月3 日公布實施，第50條第1項規定，平面等媒體刊載的廣告如為他人引誘、媒介、暗示或其他使兒童或少年有遭受同條例第2第1項第1款至第3款之虞之訊息者即屬之，由各目的事業主管機關處新臺幣5萬元以上60萬元以下罰鍰，且應發布新聞並公開之。 ,682,111-12-15 15:09,112-11-27 13:25,臺北市政府觀光傳播局
2023-12-16 23:45:10,https://www.tpedoit.gov.taipei/News_Content.aspx?n=20D462870DD3A837&sms=87415A8B9CE81B16&s=2783CE4B22DB5653,刊登酒類廣告有何規定？, 「菸酒管理法」第 37 條規定酒的廣告或促銷，應明顯標示「禁止酒駕」，並應標示「飲酒過量，有害健康」或其他警語，且不得有下列情形：（1）違背公共秩序或善良風俗。（2）鼓勵或提倡飲酒。（3）以兒童、少年為對象，或妨害兒童、少年、孕婦身心健康。（4）虛偽、誇張、捏造事實或易生誤解之內容。（5）暗示或明示具醫療保健效果之標示、廣告或促銷。（6）其他經中央主管機關公告禁止之情事。 ,3543,111-12-15 15:08,112-11-27 13:25,臺北市政府觀光傳播局
2023-12-16 23:45:13,https://www.tpedoit.gov.taipei/News_Content.aspx?n=20D462870DD3A837&sms=87415A8B9CE81B16&s=862F9E6F8454F0B1,發行出版品、錄影節目帶及經營電影院是否須提出申請？, 因出版法已廢止，廣播電視法已刪除錄影節目帶相關規定，電影法也已刪除登記規定，因而，都不必事先向本局登記，只須向經濟部或本市商業處申請公司或商業相關登記即可。 ,650,111-12-15 15:08,112-11-27 13:25,臺北市政府觀光傳播局
2023-12-16 23:45:15,https://www.tpedoit.gov.taipei/News_Content.aspx?n=20D462870DD3A837&sms=87415A8B9CE81B16&s=076B66009F65B82E,如何收看無線電視？, （1）須加裝無線電視專用的數位機上盒及天線，或購買已內建數位接收器的電視及天線，即可收看無線電視。 （2）如裝設無線電視機上盒及天線後仍無法收視，可檢視是否有以下情形並進行排除： a.天線或數位機上盒接頭鬆落。 b.是否裝置切換開關於天線或數位機上盒上。 c.天線未調整至適當方向或數位機上盒是否裝置完備。 （3）如有問題可撥打國家通訊傳播委員會免付費申訴電話：0800201205(衛星頻道、有線電視申訴專線)，0800201207(電信消費申訴專線)。 ,2492,109-09-10 11:30,112-11-27 13:25,臺北市政府觀光傳播局
2023-12-16 23:45:17,https://www.tpedoit.gov.taipei/News_Content.aspx?n=20D462870DD3A837&sms=87415A8B9CE81B16&s=A599267751FF09A3,有線廣播電視法對私接戶有何規定？, 有線廣播電視法第54條規定：「未經系統經營者同意，截取或接收系統播送之內容者，應補繳基本頻道收視費用，並負民事損害賠償責任。前項收視費用，如不能證明已收視期間，以2年之基本頻道收視費用計算之。」   ,665,109-05-19 08:08,112-11-27 13:25,臺北市政府觀光傳播局
2023-12-16 23:45:20,https://www.tpedoit.gov.taipei/News_Content.aspx?n=20D462870DD3A837&sms=87415A8B9CE81B16&s=44B5BC1417A7E265,有線電視可否暫停及終止收視？如何辦理？, （1）收視戶如暫時無收視需求，可於契約有效期間內向有線電視業者申請暫停收視及復機者，免收基本頻道收視費，及復機費。如申請暫停後已超過契約有效期間，契約終止3個月內 (含3個月) 申請復機者，免收復機費；契約終止3個月後申請復機者，視為新裝機戶，比照一般裝機費收費。 （2）為保障收視戶權益，避免他人冒用身分，有線電視業者多建議收視戶備妥個人基本資料（如身分證、駕照或健保卡），逕至服務櫃台辦理，若是辦理終止收視，需繳回機上盒等相關設備。如不便親自辦理，可先洽有線電視業者是否有其他處理方式。 （3）詳細辦理流程請洽各有線電視客服或上網站查詢。 ,3525,109-05-19 07:57,112-11-27 13:25,臺北市政府觀光傳播局
2023-12-16 23:45:22,https://www.tpedoit.gov.taipei/News_Content.aspx?n=20D462870DD3A837&sms=87415A8B9CE81B16&s=BA0894F122FD25AC,為何收看有線電視數位頻道節目一定要加裝數位機上盒？, 因為有線電視數位訊號需要透過數位機上盒進行轉換，而每1台電視都有1個訊號源，因而，每1台電視機都需要裝設數位機上盒進行訊號轉換。 ,1207,109-05-19 07:56,112-11-27 13:25,臺北市政府觀光傳播局
2023-12-16 23:45:24,https://www.tpedoit.gov.taipei/News_Content.aspx?n=20D462870DD3A837&sms=87415A8B9CE81B16&s=106FEFA4AA84BFCA,營業店面可以公開播放有線電視節目嗎?, 1.如在營業店面（例如：髮廊、餐廳、診所等）提供民眾收看有線電視節目，需取得公開播放節目授權才能播放。 2.目前有線電視公開播送業務係由九太科技股份有限公司辦理，該公司地址：新北市中和區連城路268號3樓之3，電話：02-8228-0678。 ,739,109-05-19 07:40,112-11-27 13:25,臺北市政府觀光傳播局
2023-12-16 23:45:26,https://www.tpedoit.gov.taipei/News_Content.aspx?n=20D462870DD3A837&sms=87415A8B9CE81B16&s=36FA42A11D456934,出版品應如何分級？, （1）依兒童及少年福利與權益保障法第44條第1項前段:「新聞紙以外之出版品、錄影節目帶、遊戲軟體應由有分級管理義務之人予以分級。」及出版品及錄影節目帶分級管理辦法第4條：「出版品之出版、發行、供應者，應依本章規定，於出版品發行、銷售、陳列及供應前，自行分級」等規定，出版、發行、供應者應進行出版品分級。 （2）出版品及錄影節目帶分級管理辦法第5條規定：「出版品之內容有下列情形之一，有害兒童及少年身心健康者，列為限制級，未滿18歲之人不得閱聽： a.過當描述賭博、吸毒、販毒、搶劫、竊盜、綁架、殺人或其他犯罪行為者。 b.過當描述自殺過程者。 c.過當描述恐怖、血腥、殘暴、變態等情節且表現方式強烈者。 d.過當以語言、文字、對白、聲音、圖畫、攝影描繪性行為、淫穢情節或裸露人體性器官者。」 （3）出版品及錄影節目帶分級管理辦法第6、8條規定，限制級出版品應在封面明顯標示「限制級：未滿十八歲之人不得閱聽」字樣，且不得小於封面五十分之一。租售限制級出版品者，應將限制級出版品以設置專區、設置專櫃、外加封套等方式擇一陳列，設置專區、專櫃者並應明顯標示「未滿十八歲之人不得租買」字樣。 ,863,111-06-07 11:02,112-11-27 13:25,臺北市政府觀光傳播局
2023-12-16 23:45:29,https://www.tpedoit.gov.taipei/News_Content.aspx?n=20D462870DD3A837&sms=87415A8B9CE81B16&s=28F3FD6FA94F0087,本市有線電視纜線相關問題應向何單位反映？, 本市包括電力、電信、有線電視、交通、監視器等纜線相關業務已於104年7月1日起由本府工務局道路挖掘管理中心統一管理，該中心聯絡電話：02-89788900。  ,782,110-11-18 10:48,112-11-27 13:46,臺北市政府觀光傳播局
2023-12-16 23:45:31,https://www.tpedoit.gov.taipei/News_Content.aspx?n=4F905810069A3EC5&sms=87415A8B9CE81B16&s=84B41F28106A9E07,旅客及旅館業者於旅館內如發現疑似相關病媒蚊或有害昆蟲(如臭蟲)如何辨識及處理？, 如旅客或旅館發現疑似相關病媒蚊或有害昆蟲(如臭蟲)，請撥打本府市民熱線1999轉環境保護局及衛生局進行確認。另請旅館業者落實環境清潔整理、檢查旅館相關寢具、被套、床單時注意有無黑色的血液斑跡或活蟲活動，請務必定期清潔，另可參考環境部針對臭蟲防治資訊，不定期對旅館相關環境噴灑殺蟲劑，以避免蟲害孳生，來保障旅客健康安全。 ,33,112-12-04 11:33,112-12-04 11:33,臺北市政府觀光傳播局
