Time,Url,Question,Answer,點閱數,資料更新,資料檢視,資料維護
2023-12-16 23:45:58,https://www.tpedoit.gov.taipei/News_Content.aspx?n=4F905810069A3EC5&sms=87415A8B9CE81B16&s=5FBAC4D99BB609C6,「Taipei FunPASS北北基好玩卡」相關FAQ," 問題:什麼是「Taipei FunPASS北北基好玩卡」?    回應:臺北市政府為配合交通部觀光局「台灣好玩卡」計畫並推動城市觀光，整合北北基三市觀光資源，並結合電子票證及使用指南，委託悠遊卡股份有限公司發行「Taipei FunPASS北北基好玩卡」，共推出「北北基好玩卡|交通暢遊」、「北北基好玩卡|無限暢遊」、「北北基好玩卡|經典景點」、「北北基好玩卡|北北基桃景點暢遊卡」共計四系列票卡。問題:什麼是「北北基好玩卡|交通暢遊」？    回應:此票卡種類/價格、使用方式及購買地點皆與悠遊卡股份有限公司原本發行的「Taipei Pass臺北觀光護照」相同。問題:請問「北北基好玩卡|交通暢遊」的售價？    回應:票卡種類/價格：一日券180元、二日券310元、三日券440元、五日券700元及貓纜版一日票券350元(交通一日市值約620、二日市值1,160、三日市值1,700市值、五日市值2,780市值，貓纜版市值約880元。)問題:請問「北北基好玩卡|交通暢遊」的使用方式？    回應:此票卡中包含交通及景點兩種服務。可持票卡使用悠遊卡功能加值後，搭乘大眾運輸及進行小額支付；景點使用方式則採快速通關，各景點入場方式可參考官網詳細說明：https://funpass.travel.taipei/tour/listAll/?category=aBG問題:請問在哪裡可以買到「北北基好玩卡|交通暢遊」？    回應:臺北捷運各站及悠遊卡市府轉運站客服中心皆可購買。相關訊息可以電洽悠遊卡股份有限公司客服專線02-412-8880或臺北捷運公司24小時客服中心02-218-12345查詢。問題:什麼是「北北基好玩卡|無限暢遊」？    回應:此卡是針對海外來台觀光客而設計的25處景點門票再加上「北北基好玩卡|交通暢遊」的Day Pass，最高可以省下72%旅費。2023年度無限暢遊卡再度推出獨家活動！遊山茶訪珍奶手搖飲、平溪天燈體驗、貓空小封茶體驗、圓山飯店西密道體驗四選一，讓你深度體驗台灣文化，融入你的旅程回憶！活動期間至2023年12月31日。問題:請問「北北基好玩卡|無限暢遊」的售價？    回應:票卡種類/價格：一日券1,500元、二日券1,900元、三日券2,200元。問題:請問「北北基好玩卡|無限暢遊」的使用方式？    回應:此票卡中包含交通及景點兩種服務。可持票卡在期限內無限次數搭乘臺北捷運及臺北市、新北市、基隆市公車，另包括5條「台灣好行」北投竹子湖線、木柵平溪線、皇冠北海岸線、黃金福隆線及濱海奇基線皆可無限次搭乘。(不包含編碼4碼之公路客運)景點使用方式則採快速通關，各景點入場方式可參考官網詳細說明：https://funpass.travel.taipei/tour/listAll/?category=lpn問題:請問在哪裡可以買到「北北基好玩卡|無限暢遊」？    回應:【網路線上購買】可至北北基好玩卡官網進行購買後，於取卡點進行取卡。【實體通路直接購買】可至指定購卡點購買。商品取卡點與購卡點相關資訊請參考：https://funpass.travel.taipei/where-to-pickup.html問題:什麼是「北北基好玩卡|經典景點」？    回應:此卡是針對觀光客而設計，結合臺灣經典兩大必去景點門票以及悠遊卡功能（加值後可使用）。問題:請問「北北基好玩卡|經典景點」的售價？    回應:票卡價格：950元問題:請問「北北基好玩卡|經典景點」的使用方式？    回應:此票卡中包含交通及景點兩種服務。可持票卡使用悠遊卡功能加值後，搭乘大眾運輸及進行小額支付；景點使用方式則採快速通關，各景點入場方式可參考官網詳細說明：https://funpass.travel.taipei/tour/TaipeiFunPassTicketClassic問題:請問在哪裡可以買到「北北基好玩卡|經典景點」？    回應:【網路線上購買】可至北北基好玩卡官網進行購買後，於取卡點進行取卡。【實體通路直接購買】可至指定購卡點購買。商品取卡點與購卡點相關資訊請參考：https://funpass.travel.taipei/where-to-pickup.html問題:什麼是「北北基好玩卡|北北基桃景點暢遊卡」？    回應:此卡是針對國內外年輕族群或親子遊而設計，並結合北北基22處及新增桃園8處景點門票，其中2處為效期內憑卡享購票優惠景點，總計30個北北基桃熱門景點，及悠遊卡功能（加值後可使用）。問題:請問「北北基好玩卡|北北基桃景點暢遊卡」的售價？    回應:卡種類/價格：二日券650元、三日券850元、四日券1,050元。問題:請問「北北基好玩卡|北北基桃景點暢遊卡」的使用方式？    回應:此票卡中包含交通及景點兩種服務。可持票卡使用悠遊卡功能加值後，搭乘大眾運輸及進行小額支付；景點使用方式則採快速通關，各景點入場方式可參考官網詳細說明：https://funpass.travel.taipei/tour/listAll/?category=aBG問題:請問在哪裡可以買到「北北基好玩卡|北北基桃景點暢遊卡」？    回應:【網路線上購買】可至北北基好玩卡官網進行購買後，於取卡點進行取卡。【實體通路直接購買】可至指定購卡點購買。商品取卡點與購卡點相關資訊請參考：https://funpass.travel.taipei/where-to-pickup.html問題:請問使用「Taipei FunPASS北北基好玩卡」交通服務的注意事項？    回應:旅客持「北北基好玩卡|交通暢遊」、「北北基好玩卡|無限暢遊之票卡至公車驗票機或捷運閘門啟用後，可於有效使用天數內不限次數搭乘臺北捷運、臺北市、新北市與基隆聯營公車（含「台灣好行」北投竹子湖線、木柵平溪線、皇冠北海岸線、黃金福隆線及濱海奇基線）等交通公共運輸工具，在公車部分，其使用範圍不包含路線編碼4碼的公路客運，且因無法進行儲值，所以亦無法使用於YouBike及台北市藍色水路渡輪。旅客持「北北基好玩卡|經典景點」、「北北基好玩卡|北北基桃景點暢遊卡」之票卡，具有悠遊卡加值功能，加值後可使用。問題:請問「Taipei FunPASS北北基好玩卡」交通服務使用期限規定？    回應:票卡使用期限是由(交通或景點服務)第一次使用當日起算，以票卡正面標示之天數為有效天數，必須連續使用。由於臺北捷運、聯營公車營運時間非24小時全時段營運，故票卡使用期限計算時間的單位是以天數而非小時。問題:請問是否有「Taipei FunPASS北北基好玩卡」相關的使用說明？    回應:「Taipei FunPASS北北基好玩卡|無限暢遊」有隨卡附贈使用指南手冊，並且含有中、英、日、韓四個語系版本；遊客不管從任何通路購得「Taipei FunPASS北北基好玩卡|無限暢遊」，皆可以獲贈使用指南一本。「北北基好玩卡|北北基桃景點暢遊卡」、「北北基好玩卡|經典景點」、「北北基好玩卡|交通暢遊」，三種卡別隨卡附中英版本說明小卡一份。問題:請問「Taipei FunPASS北北基好玩卡」是否有合作的優惠店家？    回應:凡購買「北北基好玩卡|北北基桃景點暢遊卡」、「北北基好玩卡|無限暢遊」即可獲贈大稻埕·  永康 · 貓空 大禮包，活動期間至2024年3月31日，數量有限，送完為止。詳見活動網頁：https://event.welcometw.com/giftbag/dymdiscount/問題:怎麼去「Taipei FunPASS北北基好玩卡」官網？    回應:「Taipei FunPASS北北基好玩卡」官網網址為：https://funpass.travel.taipei/問題:請問「Taipei FunPASS北北基好玩卡」如何退卡？    回應:無論票卡種類，只要是一經使用或損毀，恕不接受退卡退費。【其他各種類票卡退卡詳細辦法請參照官網說明】「北北基好玩卡|交通暢遊」退卡方式：https://funpass.travel.taipei/banner/Transportation「北北基好玩卡|無限暢遊」退卡方式：https://funpass.travel.taipei/tour/listAll/?category=lpn「北北基好玩卡|經典景點」退卡方式：https://funpass.travel.taipei/tour/TaipeiFunPassTicketClassic「北北基好玩卡|北北基桃景點暢遊卡」退卡方式：https://funpass.travel.taipei/tour/listAll/?category=aBG問題:請問「Taipei FunPASS北北基好玩卡」的客服資訊？    回應: 「北北基好玩卡|交通暢遊」的相關問題，請洽詢悠遊卡公司客服電話412-8880(手機及金馬地區請加02)，Email：service@easycard.com.tw「北北基好玩卡|無限暢遊」、「北北基好玩卡|經典景點」、「北北基好玩卡|北北基桃景點暢遊卡」的相關問題，請洽詢客服電話03-591-0052(服務時間：週一~週六 上午9:00~12:00，下午13:00~17:00)， Email：service@fontrip.com.tw ",1073,112-11-07 15:18,112-11-27 13:25,臺北市政府觀光傳播局
2023-12-16 23:45:59,https://www.tpedoit.gov.taipei/News_Content.aspx?n=4F905810069A3EC5&sms=87415A8B9CE81B16&s=1CA3FF20B327FEDD,熊讚辦公室QA, 編號問題說明1開放時間週一至週五上午9:00至下午6：00，開放免費參觀(六、日及國定假日休)。 112年週六開放日期：1/7、2/11、3/4、4/1、5/6、6/3、7/8、8/5、9/3、10/7、11/4、12/2。2付款方式 現金、悠遊卡、悠遊付、line pay、Apple Pay、信用卡。3除了門市購買，有線上平台嗎辦公室販售商品部分可在熊讚官網買到熊讚官網:熊產品https://bravo.travel.taipei/zh-tw/product/goods?page=14哪裡可以看到熊讚完整的周邊商品熊讚官網:熊產品https://bravo.travel.taipei/zh-tw/product/goods?page=15門市購買商品有提供宅配服務嗎沒有提供。6商品瑕疵可以退換貨嗎可以，保持商品完整包裝、標籤吊牌勿剪除七天內辦理退換貨。7門市商品賣完能先預購嗎依照商品品項提供。8請問會有門市限定款嗎Fliter017聯名系列限定商品只在市府熊讚辦公室。9可以幫熊讚佈置辦公室嗎(卡片牆)不開放卡片牆，但可留言或寫信給熊讚(有熊讚信箱)。10熊讚辦公室的電話是幾號辦公室門市電話為02-27208889/1999轉339111請問熊讚本人會來辦公室嗎？不定期出現。12請問我要去哪邊才能看到熊讚？  熊讚官網:熊行程，將公布最新行程https://bravo.travel.taipei/zh-tw/calendar/list或也可加入熊讚fb關注熊讚最新動態13請問熊讚辦公桌上還有抽屜的東西可以拿嗎不行，只有辦公桌上熊讚名片，以及熊讚地圖下方的明信片和文宣品可以自由索取。14我要送東西給熊讚，要交給誰？請交門市人員轉交給熊讚。15我可以寫信給熊讚嗎？可以，門口的信箱可以投入信件或參觀的訪客證卡片背面也可以留言給熊讚。16如果要跟熊讚合作或洽談授權可以找誰熊讚官網:熊授權https://bravo.travel.taipei/zh-tw/authorize/index商業合作:請遞名片至辦公室後方授權合作廠商信箱或洽洽授權代理廠商：京駿有限公司，徐先生，02-8626-8931，0926-127368，EMAIL： bravo@gov.taipei非商業合作:請洽觀光傳播局綜合行銷科，電話(02)2720-8889轉156317為何打造熊讚辦公室辦公室新景點熊讚從偶的角色轉為代表城市品牌精神，進而帶出BRAVO分別代表的意義。熊讚圖素加入流行元素，因而辦公室獨家有新的設計以及跟流行品牌聯名(如和戶外旅遊品牌Filter017合作推出限量聯名商品)。18門市商品有優惠嗎市府員工憑證享9折，20件以上85折(特定商品除外)另不定期推出消費優惠活動。   ,586,112-10-16 15:23,112-11-27 13:25,臺北市政府觀光傳播局
2023-12-16 23:46:01,https://www.tpedoit.gov.taipei/News_Content.aspx?n=4F905810069A3EC5&sms=87415A8B9CE81B16&s=70F46BEBE0957CED,刊登日租套房廣告有罰則嗎?, 發展觀光條例第55-1條規定，未依本條例規定領取營業執照或登記證而經營觀光旅館業務、旅行業務、觀光遊樂業務、旅館業務或民宿者，以廣告物、出版品、廣播、電視、電子訊號、電腦網路或其他媒體等，散布、播送或刊登營業之訊息者，處新臺幣三萬元以上三十萬元以下罰鍰。 ,977,111-04-07 14:23,112-11-27 13:25,臺北市政府觀光傳播局
2023-12-16 23:46:03,https://www.tpedoit.gov.taipei/News_Content.aspx?n=4F905810069A3EC5&sms=87415A8B9CE81B16&s=36739B925B22D227,臺北市旅遊服務中心及借問站資訊, 臺北市旅遊服務中心及借問站資訊站別服務時間地 址旅遊服務中心/遊客中心臺北車站每日 09：00-19：00臺北市中正區北平西路3號（臺北車站1F大廳西南側）松山機場每日 08：00-17：00臺北市松山區敦化北路340之 10號（松山機場第二航廈到站大廳）機場捷運A1台北車站每日10：00-19：00臺北市中正區鄭州路8號B1層（走道區）捷運劍潭站每日 10：00-19：00臺北市士林區中山北路5段65號（捷運站1號出口）捷運西門站每日10：00-19：00臺北市中正區寶慶路32-1號B1（近捷運站5號出口）捷運台北101/世貿站每日10：00-19：00臺北市信義區信義路5段20號B1(近捷運站5號出口)捷運龍山寺站每日10：00-19：00臺北市萬華區西園路1段153號B1（捷運站1號出口）捷運新北投站每日10：00-19：00臺北市北投區大業路700號（捷運站1號出口）纜車貓空站每月第一個週一、每週二至週日09:00-18:00臺北文山區指南路三段38巷35號（纜車出口處）大稻埕每日09：00-18：00臺北市大同區迪化街一段44號西門町每日13：00-22：00臺北市萬華區漢中街45號借問站有記名茶週一至週六09：00-18：00（週日公休）臺北市大同區重慶北路二段64巷26號台北地下街週一至週五11:00-21:30週六至週日11:00-22:00臺北市中正區市民大道一段100號B1（地點：行政中心）華山1914文化創意產業園區每日09：30-21：00臺北市中正區八德路一段1號（地點：園區服務中心）東東玩具城每日10：00-20：30臺北市大同區太原路54號財團法人台北市關渡宮每日07：00-21：00臺北市北投區知行路360號穠舍田園咖啡義大利菜每⽇ 11：00-18：30臺北市內湖區碧山路38號亞尼克陽明山店每日10：30-19：00臺北市士林區長春街6巷5號雅博客二手書店每日12：00-22：00臺北市大安區新生南路3段76巷9號1樓長榮海事博物館週二至週日09：00-17：00（週一公休）臺北市中正區中山南路11號町記憶旅店每日00：00-24：00臺北市萬華區昆明街119號途中台北青年旅舍每日09：00-22：00臺北市北投區光明路82號禮客outlet公館店週一至週四11：00-21：30週五至週日11：00-22：00臺北市中正區思源街16號1樓門片咖啡週一、週二、週四至週日09：30-20：30（週三公休）臺北市士林區天玉街38巷7號遊藝思文創空間週二至週日11：00-22：00臺北市大安區辛亥路二段171巷15號大華行－竹木造咖每日10：30-19：00臺北市大同區迪化街1段161號大稻埕花園旅店每日10：00-20：00臺北市大同區迪化街1段334號丹迪旅店大安森林公園店每日00：00-24：00臺北市大安區信義路三段33號台北馥華商旅南港館每日00：00-24：00臺北市南港區三重路23號郭元益糕餅博物館每日09:00-17:00臺北市士林區文林路546號4樓 ,2765,112-11-08 16:47,112-11-27 13:25,臺北市政府觀光傳播局
2023-12-16 23:46:05,https://www.tpedoit.gov.taipei/News_Content.aspx?n=4F905810069A3EC5&sms=87415A8B9CE81B16&s=65621CD10696E444,台北探索館遇颱風來襲是否開放？, 遇颱風來襲，臺北市政府如果宣布停止上班，台北探索館將配合休館。 ,729,112-11-02 14:27,112-11-27 13:25,臺北市政府觀光傳播局
2023-12-16 23:46:08,https://www.tpedoit.gov.taipei/News_Content.aspx?n=4F905810069A3EC5&sms=87415A8B9CE81B16&s=172B96302BB96065,如遇旅遊消費爭議如何申訴?, 請上行政院消費者保護會申訴(https://appeal.cpc.ey.gov.tw/WWW/Default.aspx)、或撥打1950，或直接到市政大樓1樓消費者服務中心申訴。 ,5178,112-10-31 07:36,112-11-27 13:25,臺北市政府觀光傳播局
2023-12-16 23:46:10,https://www.tpedoit.gov.taipei/News_Content.aspx?n=4F905810069A3EC5&sms=87415A8B9CE81B16&s=39F1C01B26D8795F,請問觀光傳播局目前提供旅客索取觀光文宣品種類及索取地點？, 臺北市政府觀光傳播局目前出版臺北市觀光文宣有臺北市觀光地圖摺頁等 ，上列文宣均置放於臺北市各旅遊服務中心，及不定期提供各縣市旅服中心、機場，提供旅客免費索取。此外，相關文宣品亦可至「台北旅遊網」(https://www.travel.taipei/zh-tw)線上瀏覽（影音刊物→出版品）。此外，新浪微博上建立之「趣台北」微博(http://weibo.com/taipeitravelnet)，也隨時分享臺北市好吃、好玩、好看、圖文並茂的訊息內容。  ,9192,112-08-08 13:22,112-11-27 13:25,臺北市政府觀光傳播局
2023-12-16 23:46:12,https://www.tpedoit.gov.taipei/News_Content.aspx?n=4F905810069A3EC5&sms=87415A8B9CE81B16&s=181EAF13D2C9DE1E,臺北市的旅遊服務中心設置在哪裡？提供什麼服務？, 本市於機場捷運A1台北車站、臺北車站、松山機場、捷運新北投站、捷運西門站、捷運劍潭站、捷運台北101/世貿站、捷運龍山寺站、西門町、纜車貓空站及大稻埕共設立了11座旅遊服務中心，提供「旅遊景點資訊」、「交通食宿資訊」、「遊程諮詢」、「文宣、地圖索取」、「旅遊圖書查閱」、「放大鏡、老花眼鏡出借」、「行動電話緊急充電」等服務。各旅遊服務中心聯絡資訊及開放時間，請見「臺北旅遊網」(https://www.travel.taipei/)旅客諮詢臺北旅遊服務中心。  ,837,112-06-02 07:48,112-11-27 13:25,臺北市政府觀光傳播局
2023-12-16 23:46:15,https://www.tpedoit.gov.taipei/News_Content.aspx?n=4F905810069A3EC5&sms=87415A8B9CE81B16&s=8234A9B0C3340AE3,如何線上瀏覽臺北觀光資訊，包括臺北旅遊網及「趣台北」微博？, 您可連線至臺北旅遊網(https://www.travel.taipei/)，線上瀏覽臺北觀光資訊，網站內提供最新的臺北旅遊資訊及最豐富的景點介紹。另本市亦於新浪微博上建立「趣台北」微博(http://weibo.com/taipeitravelnet)，隨時分享臺北市好吃、好玩、好看、圖文並茂的訊息內容。 ,2165,111-09-05 15:29,112-11-27 13:25,臺北市政府觀光傳播局
2023-12-16 23:46:17,https://www.tpedoit.gov.taipei/News_Content.aspx?n=4F905810069A3EC5&sms=87415A8B9CE81B16&s=76A025CB82E0C679,臺北旅遊網的網址及內容為何?, 臺北旅遊網網址:https://www.travel.taipei/。提供臺北市旅遊景點簡介、交通及住宿資訊、最新旅遊活動、建議行程等。 ,4274,111-09-01 15:16,112-11-27 13:25,臺北市政府觀光傳播局
2023-12-16 23:46:19,https://www.tpedoit.gov.taipei/News_Content.aspx?n=4F905810069A3EC5&sms=87415A8B9CE81B16&s=49357405F3BA76E9,本市可從事的水域遊憩活動種類為何？, 依「水域遊憩活動管理辦法」第3條規定及本府公告，本市可從事的水域遊憩活動種類如下： （1）游泳、衝浪、潛水。 （2）操作乘騎風浪板、滑水板、拖曳傘、水上摩托車、獨木舟、泛舟艇、香蕉船、橡皮艇、拖曳浮胎、水上腳踏車、手划船、風箏衝浪、立式划槳等各類器具之活動。   ,1945,111-06-07 11:01,112-11-27 13:25,臺北市政府觀光傳播局
2023-12-16 23:46:22,https://www.tpedoit.gov.taipei/News_Content.aspx?n=4F905810069A3EC5&sms=87415A8B9CE81B16&s=DDBC8DA64F26F5F1,本市禁止水域遊憩活動的範圍、時間？, 一、本市天然公有水域（不包含國家公園、公園湖泊及本市野雁保護區範圍內）禁止水域遊憩活動範圍如下： (一)藍色公路航道內（因潮汐及天候、水流或漂流物等關係，船舶有可能行駛偏離航道，亦請從事相關活動者注意）。 (二)中港河。 二、本市天然公有水域（不包含國家公園、公園湖泊及本市野雁保護區範圍內）禁止水域遊憩活動時間： (一)每年5月至9月當日下午6時30分至次日上午6時、每年10月至次年4月當日下午5時30分至次日上午6時禁止從事水域遊憩活動。 (二)中央氣象局發布海上或陸上颱風警報，且警戒區域包含本市時，全日禁止從事水域遊憩活動。 (三)中央氣象局發布本市為豪雨以上警戒區，或發布新北市、基隆市、桃園市為大豪雨以上警戒區時，禁止從事水域遊憩活動。 ,2790,111-06-07 11:00,112-11-27 13:25,臺北市政府觀光傳播局
2023-12-16 23:46:24,https://www.tpedoit.gov.taipei/News_Content.aspx?n=4F905810069A3EC5&sms=87415A8B9CE81B16&s=DA681590C251C406,行政執行作業流程(斷水斷電)?, 本市非法旅宿經裁處仍持續經營者，將連續處20萬、30萬元怠金，經處2次怠金仍持續經營且未變更使用執照為旅館業者，觀光傳播局得依規定執行停止供水供電。 ,618,111-04-07 14:24,112-11-27 13:25,臺北市政府觀光傳播局
2023-12-16 23:46:26,https://www.tpedoit.gov.taipei/News_Content.aspx?n=4F905810069A3EC5&sms=87415A8B9CE81B16&s=FD3C23017AECF14F,日租套房裁處金額?, 發展觀光條例第55條第5項規定，未依本條例領取登記證而經營旅館業務者，處新臺幣十萬元以上五十萬元以下罰鍰，並勒令歇業。 ,687,111-04-07 14:22,112-11-27 13:25,臺北市政府觀光傳播局
2023-12-16 23:46:28,https://www.tpedoit.gov.taipei/News_Content.aspx?n=4F905810069A3EC5&sms=87415A8B9CE81B16&s=71188A9D896C8A42,日租套房需取得合格執照才能經營嗎?, 發展觀光條例第24條第1項規定，經營旅館業者，除依法辦妥公司或商業登記外，並應向地方主管機關申請登記，領取登記證及專用標識後，始得營業。 ,930,111-04-07 14:22,112-11-27 13:25,臺北市政府觀光傳播局
2023-12-16 23:46:31,https://www.tpedoit.gov.taipei/News_Content.aspx?n=4F905810069A3EC5&sms=87415A8B9CE81B16&s=43526541E8DAF1FD,只要是出租套房都可以檢舉嗎？, 民眾若發現業者以日或周之方式提供住宿服務，疑似經營非法旅宿，可檢附明確樓層門牌地址、聯絡電話、訂房往來或匯款紀錄、經營業者姓名，現場照片與網站等資料提供觀光傳播局；若為「月租租賃套房」，即非屬旅館業管理範疇，非屬觀光傳播局權管。 ,1008,111-04-07 14:20,112-11-27 13:25,臺北市政府觀光傳播局
2023-12-16 23:46:33,https://www.tpedoit.gov.taipei/News_Content.aspx?n=4F905810069A3EC5&sms=87415A8B9CE81B16&s=345A958F531EEE31,檢舉日租套房是否只要提供網址就可以了?, 倘民眾只提供網址，而無提供地址，觀光傳播局無法至現場確認是否違規經營旅宿業，仍建議民眾若發現業者疑似經營非法旅宿，可檢附明確樓層門牌地址、聯絡電話、訂房往來或匯款紀錄、經營業者姓名，現場照片與網站等資料提供觀光傳播局，以利進行後續查處。 ,2920,111-04-07 14:19,112-11-27 13:25,臺北市政府觀光傳播局
2023-12-16 23:46:35,https://www.tpedoit.gov.taipei/News_Content.aspx?n=4F905810069A3EC5&sms=87415A8B9CE81B16&s=3A6EE4D94CB194A1,檢舉日租套房是否只要提供地址就可以了?, 民眾若發現業者疑似經營非法旅宿，可檢附明確樓層門牌地址、聯絡電話、訂房往來或匯款紀錄、經營業者姓名，現場照片與網站等資料提供本局，如觀光傳播局查獲具體違規事證，將依法核處；若只提供地址，觀光傳播局將於查明違規情事屬實，並取得具體違規交易事證後，始得依法處分違法業者。 ,3102,111-04-07 14:19,112-11-27 13:25,臺北市政府觀光傳播局
2023-12-16 23:46:37,https://www.tpedoit.gov.taipei/News_Content.aspx?n=4F905810069A3EC5&sms=87415A8B9CE81B16&s=FEED9C6EA0E92A98,如何檢舉日租套房?, 民眾若發現業者疑似經營日租套房，可檢附明確樓層門牌地址、聯絡電話、訂房往來或匯款紀錄、經營業者姓名，現場照片與網站等資料提供觀光傳播局，如觀光傳播局查獲具體違規事證，將依法核處。 ,1741,111-04-07 14:18,112-11-27 13:25,臺北市政府觀光傳播局
2023-12-16 23:46:40,https://www.tpedoit.gov.taipei/News_Content.aspx?n=4F905810069A3EC5&sms=87415A8B9CE81B16&s=BECF3EB4C5A05EEA,什麼是日租套房?, 未領取觀光旅館營業執照、旅館業登記證或民宿登記證，以各種方式名義提供不特定人以日或週之住宿、休息並收取費用及其他相關服務之營利事業。 ,842,111-04-07 14:14,112-11-27 13:25,臺北市政府觀光傳播局
2023-12-16 23:46:42,https://www.tpedoit.gov.taipei/News_Content.aspx?n=4F905810069A3EC5&sms=87415A8B9CE81B16&s=03E3ED360279384C,個別旅客訂房定型化契約範本為何?, 交通部觀光局已於106年7月21日以觀宿字第1060600630號函頒修觀光旅館業、旅館業或民宿「個別旅客訂房定型化契約」範本，民眾可至交通部觀光局行政資訊網(https://admin.taiwan.net.tw)/業務資訊/觀光法規/個別旅客訂房定型化契約範本（原名稱：觀光旅館業與旅館業及民宿個別旅客直接訂房定型化契約範本）查詢及下載。 ,4368,110-05-03 09:18,112-11-27 13:25,臺北市政府觀光傳播局
