Time,Url,Question,Answer,點閱數,資料更新,資料檢視,資料維護
2024-01-11 14:49:21,https://police.gov.taipei/News_Content.aspx?n=8D43510FCC9EE11C&sms=87415A8B9CE81B16&s=1AD58D8253237FC0,員警取締酒後駕車，經移置之汽車當事人如何辦理領回?, (一)領車時需有1人領有適當駕照者前來，駕駛領回之汽車離開保管場。(因當事人違反道路交通處罰條例規定遭吊扣駕照，不得駕駛任何車輛)。 (二)車主領車時應攜帶下列證(文)件之正本： 1、身分證(需出示正本)。 2、車輛行照。 3、繳納罰款收據(依公共危險罪移送法院者-免付):其分期繳納案件，應全部繳完始可領車，惟初犯者於繳納第一期款項後即可領回。 4、應繳納之移置費及保管費。 5、繳回「移置保管車輛通知單」第一聯(收執聯)。 (三)車主若委託他人代領時，代理人除應攜帶上列證(文)件外，應並附下列證(文)件： 1、酒後駕車代保管車輛領回授權委託書1份(車主應親自簽名及蓋指印、私章)。 2、車主身分證(需出示正本)。 3、受委託人(即領車人)之身分證明文件正本。 4、車主如為公司、行、商號，應附該行商號之營利事業登記證正本，委託書應加蓋公司大、小章。 (四)如因酒駕被逕行移置保管之車輛為租賃業者之車輛，則依108年7月1日施行新修正道路交通管理處罰條例85條之2第3項規定：「依第三十五條規定被逕行移置保管之車輛屬租賃車業者之車輛，得由車輛所有人檢具租賃契約書、違規駕駛人姓名、住址並具結後，據以取回被移置保管車輛。」辦理。 ,21759,110-11-24 17:31,112-12-27 13:56,臺北市政府警察局交通警察大隊
2024-01-11 14:49:23,https://police.gov.taipei/News_Content.aspx?n=8D43510FCC9EE11C&sms=87415A8B9CE81B16&s=1AC41E8B2F7E2668,酒駕拒測移送法辦疑義?, (一)拒絕酒測得否作為逮捕依據？ 拒絕酒測，應依道路交通管理處罰條例第35條第4項及第5項規定舉發，惟是否得逮捕該駕駛人，除通緝犯、現行犯外，須顯有刑法第185條之3第1項第2款不能安全駕駛之客觀事實，依駕駛人有車行不穩、蛇行、語無倫次、口齒不清或有其他異常行為、狀況等客觀情事，判斷足認有不能安全駕駛（駕駛人酒精濃度有達每公升0.25毫克以上之可能）之情形後，即依刑事訴訟法第88條規定予以逮捕。 (二)若事後證明，駕駛人酒精濃度並未達0.25mg/l以上時，執行逮捕之員警是否會涉犯妨害自由、強制罪、濫用職權逮捕罪？ 法律不會以事後能否確認駕駛人涉犯刑法第185條之3第1項罪責，作為判斷員警逮捕當時適法性之認定。只要員警逮捕當時有所依據，依法令而為之行為並不會構成刑責。 ,11577,110-11-24 17:28,112-12-27 13:56,臺北市政府警察局交通警察大隊
2024-01-11 14:49:24,https://police.gov.taipei/News_Content.aspx?n=8D43510FCC9EE11C&sms=87415A8B9CE81B16&s=A3966831D41EA403,機車停放於防火巷能不能取締?, 有關本市防火巷之違規取締業務係建管處權管，自107年5月11日起，防火巷如有違停車輛須移置，本局即配合支援提供拖吊車及從業人員到場，並由該處人員指揮執行(因非屬道路範圍，不適用道路管理處罰條例，不另派遣員警到場)，後續之申訴或其他相關事宜由該處人員依權責處理，可逕洽1999轉2711本市建築管理工程處辦理。   ,29791,110-11-24 17:25,112-12-27 13:56,臺北市政府警察局交通警察大隊
2024-01-11 14:49:26,https://police.gov.taipei/News_Content.aspx?n=8D43510FCC9EE11C&sms=87415A8B9CE81B16&s=DADBAE5AC4ADEBFA,交通違規案件經陳述(申訴)後，如仍不服處罰機關回復之裁決結果，後續如何處理？, 當事人如不服回復之裁決結果時，當得提起行政訴訟，惟先洽處罰機關開立裁決書，並以司法狀紙敘明理由連同裁決書及其他足資佐證資料等，依道路交通管理處罰條例第87條規定，應以原處分機關為被告，逕向管轄之地方法院行政訴訟庭提起訴訟，可資救濟。(其中撤銷訴訟之提起，應於裁決書送達後30日之不變期間內為之。) ,1926,110-11-24 17:21,112-12-27 13:56,臺北市政府警察局交通警察大隊
2024-01-11 14:49:28,https://police.gov.taipei/News_Content.aspx?n=8D43510FCC9EE11C&sms=87415A8B9CE81B16&s=4EE2C9774CFB4856,兒童安全座椅使用規定為何？," 一、小型車附載4歲以下的幼童行駛於道路時，應依下列規定方式安置於安全椅： (一)年齡在二歲以下者，應安置於車輛後座之攜帶式嬰兒床或後向幼童用座椅，予以束縛或定位。 (二)年齡逾二歲至四歲以下且體重在十八公斤以下者，應坐於車輛後座之幼童用座椅，予以束縛或定位，並優先選用後向幼童用座椅為宜。 二、違反前述規定者，可依道路交通管理處罰條例第31條第3項規定，處駕駛人新臺幣1,500元以上3,000元以下罰鍰。 ",3292,110-11-24 17:19,112-12-27 13:56,臺北市政府警察局交通警察大隊
2024-01-11 14:49:30,https://police.gov.taipei/News_Content.aspx?n=8D43510FCC9EE11C&sms=87415A8B9CE81B16&s=1E74AD4B3DBDFF9A,白牌車違規經營貨運業相關規定及如何檢舉?, 一、車輛可依其使用目的分為「自用」和「營業」兩類，如係以經營客貨運為目的之車輛，依「汽車運輸業管理規則」第4條規定，應向中央主管機關申請核准，違反者得依「公路法」第77條第2項規定舉發處罰之。 二、自用車輛如私自違規載客、載貨經營者(俗稱白牌車)，依「公路法」第78-1條規定，民眾得敘明事實檢具證據資料，向公路主管機關(交通部公路總局轄管監理所(站))檢舉(相關網址:https://www.thb.gov.tw/sites/ch/modules/feedback/feedback_statement?node=659093e0-c639-45ff-b5e6-13ac593e50a2)。 ,2292,110-11-24 17:19,112-12-27 13:56,臺北市政府警察局交通警察大隊
2024-01-11 14:49:32,https://police.gov.taipei/News_Content.aspx?n=8D43510FCC9EE11C&sms=87415A8B9CE81B16&s=517096682AF79AD4,若車輛停放路邊，車身有三分之一壓到紅線，是否會被拖吊開單？, 依內政部警政署函示，「道路交通管理處罰條例」第56條第1項第4款規定：「在設有禁止停車標誌、標線之處所停車者。」按其意旨車輛停放在劃設有禁止停車線之路段時，其違規事實即已存在，其車身占用禁止停車標線多少長度，應無執法爭議，員警仍將依法開單拖吊移置保管。 ,30602,110-11-24 17:22,112-12-27 13:56,臺北市政府警察局交通警察大隊
2024-01-11 14:49:35,https://police.gov.taipei/News_Content.aspx?n=8D43510FCC9EE11C&sms=87415A8B9CE81B16&s=51F41FE992786C3E,網路如何查詢平日北市某某路段拖吊時間為何？或可詢問哪些單位？, （一）本局交通警察大隊針對本市道路違規停車，係依據道路交通管理處罰條例及道路主管機關合法設置之標誌標線執行取締拖吊工作，其拖吊時間依下列規定辦理，但經專案公告者，不在此限。說明如下： 1、禁止臨時停車（紅線）及其他法定禁止臨時停車處所為7時至21時，必要時，得延長之。 2、禁止停車處所（黃線）為7時至20時，有附牌依附牌標示。 3、夜市周邊及經常有代客違規停車之處所，必要時得延長至23時。 4、巷、弄內違規停放車輛，除併排、民眾檢舉擋道或其他急迫影響公共安全者應優先執行拖吊外，其餘以告發為主。 5、影響消防救災者24小時執行取締告發拖吊。 6、停放於本市所有道路（含公有及公有委外之路外停車場）之遊動廣告車輛，執行拖吊時間上午為每日上午7時至下午9時，地點不受限制。 （二）前述拖吊路段、時間等相關訊息，可查詢「臺北市政府警察局管理違規停放車輛拖吊及保管作業規定 」中即有詳細說明。 ,14469,110-11-24 17:22,112-12-27 13:56,臺北市政府警察局交通警察大隊
2024-01-11 14:49:37,https://police.gov.taipei/News_Content.aspx?n=8D43510FCC9EE11C&sms=87415A8B9CE81B16&s=FEC3DD5A1E431A9B,巷弄內為何不能拖吊？, 依據臺北市政府警察局管理違規停放車輛拖吊及保管作業規定第2點第7款規定：「巷、弄內違規停放車輛，除併排停放、民眾檢舉妨礙道路通行、停放於臺北市交通管制工程處公告之家長接送區或其他急迫影響公共安全者應優先執行拖吊外，其餘以告發為主。」故巷內違停將轉請轄區分局派員認定舉發。 ,18561,110-11-24 17:23,112-12-27 13:56,臺北市政府警察局交通警察大隊
2024-01-11 14:49:37,https://police.gov.taipei/News_Content.aspx?n=8D43510FCC9EE11C&sms=87415A8B9CE81B16&s=81EA07107695508F,家裡出入口或車庫前方有車輛擋道妨礙出入時，如何排除？, 一、經查「車庫」設置，均應先向主管機關(臺北市建築管理工程處)辦理建築物變更使用事宜，俟取得建築物車庫使用證明後，檢附相關資料影本，逕送本市交通管制工程處協請繪設禁止(臨時)停車標線；如有擋道情事，當可依「道路交通管理處罰條例」第56條第1項第1款規定予以舉發拖吊。 二、惟家中出入口或已按前列規定合法設置之「車庫」前，並未繪設禁止(臨時)停車標線而遭擋道者，可先請轄區派出所員警協助查詢該車籍，通知車主駛離，如無法通知時，得視有無構成妨礙其他人、車通行處所停車之具體違規事證，依「道路交通管理處罰條例」第56條第1項第5款規定予以舉發拖吊。 ,43378,110-11-24 17:23,112-12-27 13:56,臺北市政府警察局交通警察大隊
2024-01-11 14:49:37,https://police.gov.taipei/News_Content.aspx?n=8D43510FCC9EE11C&sms=87415A8B9CE81B16&s=E8D8997FF18B7413,假日停在黃線為何被拖吊？, 一、依據「道路交通標誌標線號誌設置規則」第168條第3項規定：「本標線（黃線）禁止時間為每日上午7時至晚間8時，如有延長或縮短之必要時，應以標誌及附牌標示之。」      二、目前臺北市假日黃線開放停車路段已於交通管制工程處網站上公告（網址為：https://www.bote.gov.taipei/），網站上亦清楚標示（本表僅供參考，實際仍以現場標誌牌所示範圍為準），故除了現場有設置「假日除外」標誌牌面之路段外，其它路段均屬一般黃線，均依「道路交通標誌標線號誌設置規則」第168條規定處理。  ,260894,110-11-24 17:23,112-12-27 13:56,臺北市政府警察局交通警察大隊
2024-01-11 14:49:37,https://police.gov.taipei/News_Content.aspx?n=8D43510FCC9EE11C&sms=87415A8B9CE81B16&s=81B2D4F835250672,紅線違規停車罰鍰費用為多少？," 依「道路交通管理處罰條例」第56條規定，違規停車處汽車駕駛人新臺幣600元以上1,200元以下罰鍰。 ",656544,110-11-24 17:37,112-12-27 13:56,臺北市政府警察局交通警察大隊
2024-01-11 14:49:38,https://police.gov.taipei/News_Content.aspx?n=8D43510FCC9EE11C&sms=87415A8B9CE81B16&s=7423D6D1D93625A9,為什麼舉發單（罰單）收不到？, 一、大部份原因是居住戶籍地址異動了而車籍地址（行車執照地址）並未隨戶籍地址辦理異動，而違規通知單仍依監理機關車籍登記之地址郵寄。 二、基於社會現況及便民原則，並因應車主及駕駛人需要及行政程序法第72條合法送達處所規定，交通部公路監理機關自九十九年三月一日起實施於「公路監理電腦系統車籍及駕籍檔」中增列住居所或就業處所地址，以利公路監理機關及相關機關各項便民服務通知事項、公路法、道路交通管理處罰條例及強制汽車責任保險法等法令規定之行政文書之寄達，業增設「公路監理業務住居所、就業處所地址」，如為監理服務網會員者直接至監理服務網網站(https://www.mvdis.gov.tw/)線上申辦。非為監理服務網會員者請下載「公路監理業務住居所、就業處所地址」申請書(https://www.mvdis.gov.tw/m3-emv-cht/public/downloadInstruction)，填妥申請書後郵寄或傳真監理單位辦理。 三、為維護個人權益，請儘速向監理機關辦理車籍地址變更。 ,13164,110-11-24 17:38,112-12-27 13:56,臺北市政府警察局交通警察大隊
2024-01-11 14:49:38,https://police.gov.taipei/News_Content.aspx?n=8D43510FCC9EE11C&sms=87415A8B9CE81B16&s=C2BAFCDE7A59F40C,寄存通知單（罰單）到案日已過期怎麼辦呢？, 您收到到寄存通知單（罰單）到案日已過期不用緊張，依110年3月1日施行「違反道路交通管理事件統一裁罰基準及理細則」第15條第2項規定，前項通知單應載明受通知人收受通知單時應到案日期不足三十日或已逾應到案日期者，得於送達生效日後三十日內到案。即在您收受舉發單後30日內繳款，您可以採用下列方式繳款： （1）親自至到案處所或各地監理機關繳款結案。 （2）到郵局買匯票(罰單所列金額)，連同罰單掛號郵寄至應到案處所。 （3）可以到萊爾富、7-11、全家超商列印違規資料，櫃檯繳費結案。 （4）上監理服務網站www.mvdis.gov.tw，利用網路繳費。 （5）利用中華電信語音查詢412-1111轉168 使用信用卡或金融卡繳款。 （6）車籍是臺北者，可以到台北富邦銀行，櫃檯繳費結案 。  ,111234,111-04-01 18:26,112-12-27 13:56,臺北市政府警察局交通警察大隊
2024-01-11 14:49:40,https://police.gov.taipei/News_Content.aspx?n=8D43510FCC9EE11C&sms=87415A8B9CE81B16&s=6F1D8590BB31F37D,如喪家想在自家門口搭棚設置靈堂該如何申請？, 查市民未經申請於道路治喪，除有妨礙交通之虞外，亦影響鄰近市民生活環境安寧，有鑑於此，特明文於殯葬管理條例62條規定；「辦理殯葬事宜如因殯造設施不足需使用道路搭棚者，應擬具使用計畫報經當地警察機關核准，並以二日為限。」，非經道路主管機關許可，不得占用道路妨礙交通，並不得製造噪音影響安寧，違反規定者由警察機關或環境保護機關依道路交通管理處罰條例、殯葬管理條例、噪音管制法等相關法令處理。「如喪家想在自家門口搭棚設置靈堂」應依道路交通安全規則第142條規定至「臺北市申請使用道路網」申請，因行政作業所需，請提前7天申請。 ,12642,110-11-24 17:39,112-12-27 13:56,臺北市政府警察局交通警察大隊
2024-01-11 14:49:42,https://police.gov.taipei/News_Content.aspx?n=8D43510FCC9EE11C&sms=87415A8B9CE81B16&s=0A514EDE79432172,機車停放私有產權之防火巷能不能取締?, 有關本市防火巷之違規取締業務係建管處權管，自107年5月11日起，防火巷如有違停車輛須移置，本局即配合支援提供拖吊車及從業人員到場，並由該處人員指揮執行(因非屬道路範圍，不適用道路管理處罰條例，不另派遣員警到場)，後續之申訴或其他相關事宜由該處人員依權責處理，可逕洽1999轉2711本市建築管理工程處辦理。 ,24643,110-11-24 17:39,112-12-27 13:56,臺北市政府警察局交通警察大隊
2024-01-11 14:49:45,https://police.gov.taipei/News_Content.aspx?n=8D43510FCC9EE11C&sms=87415A8B9CE81B16&s=3FEE7A7CA405A858,請問機車停放在人行道上阻擋無障礙斜坡道有無任何罰則？," 一、本市為保障身心障礙者「行」的權益，大力推動無障礙設施，惟因部分駕駛人不遵守交通法規，任意行駛或停放車輛於人行道，造成人行鋪磚嚴重受損，亦使無障礙斜坡道遭阻擋，而影響身心障礙者在人行道行走安全。二、然而，目前交通法令並未單獨對「斜坡道」遭占用時，有處罰之特別規定或釋示，惟無障礙斜坡道設置位置仍屬於人行道之一部分；依據「道路交通安全規則」第111條第1項第1款規定：「汽車(含機車)在橋樑、隧道、圓環、障礙物對面、鐵路平交道、人行道、行人穿越道、快車道等處，不得臨時停車」，同規則第112條第1項第1項規定：「汽車(含機車)在禁止臨時停車處所不得停車」。因此若車輛停放於人行道(含無障礙斜坡道)上，係屬違反交通法規之行為，可依「道路交通管理處罰條例」第56條第1項第1款規定：「在禁止臨時停車處所停車者」，或按違規行為得依同條例第56條第1項第5款規定：「在顯有妨礙其他人、車通行處所停車者」據予舉發並處新臺幣600元以上1,200元以下罰鍰外；必要時，得使用民間拖吊車拖離之，並收取移置及保管費。三、綜上，本局業督飭所屬分局針對本市道路上(含街道、巷弄、人行道)違規停車情形，賡續加強執法取締，以維護本市道路交通安全順暢及市容觀瞻。 ",32802,112-04-13 17:52,112-12-27 13:56,臺北市政府警察局交通警察大隊
2024-01-11 14:49:47,https://police.gov.taipei/News_Content.aspx?n=8D43510FCC9EE11C&sms=87415A8B9CE81B16&s=EEC9470118FAE217,如要檢舉交通違規，該如何進行？, (一)依據111年4月30日施行新修正「道路交通管理處罰條例」第7條之1規定：「民眾對於下列違反本條例之行為者，得敘明違規事實並檢具違規證據資料，向公路主管或警察機關檢舉。詳盡資訊請逕向主管機關法務部「全國法規資料庫」網站(https://law.moj.gov.tw/LawClass/LawAll.aspx?pcode=K0040012)查詢」任何人如發現違反道路交通管理事件之行為，均得依前開相關規定檢舉交通違規，經查證屬實者，應即舉發。囿於警力有限，惟民力無窮，有您熱心參與交通違規檢舉工作，本市將能營造更安全、順暢的優質交通環境，併致謝忱。 (二)民眾發現有違反道路交通管理事件者，得依據「違反道路交通管理事件統一裁罰基準及處理細則」第20條規定，向公路主管機關或警察機關檢舉。您必須提供的資料如下： 一、檢舉人真實姓名、國民身分證統一編號、住址及電話號碼或其他連絡方法。(交通違規檢舉實名制自108年1月1日起實施，檢舉交通違規須提供檢舉人之「正確姓名」及「身分證字號」) 二、違規行為發生地點、日期、時間及違規事實內容。 三、違規車輛牌照號碼、車型或足以辨識車輛之特徵等具體相關資料。但檢舉對象如係未懸掛號牌之車輛、行人或道路障礙者，得提供違規人姓名或商號名稱、住址。 前項檢舉，如有違規證據（如照片或錄影等）資料，並請檢具。 (三)為提供民眾較便利檢舉交通違規之管道，臺北市政府警察局交通警察大隊網站業已設置「交通違規檢舉專區」，囿於交通違規檢舉案件需填具資料較多，為避免檢舉案件資料不全，致延宕案件處理時效，如您欲檢舉交通違規，得逕至該網站(https://prsweb.tcpd.gov.tw/index.php?catid=10；臺北市政府警察局/為民服務/交通違規檢舉專區)，參考檢舉應注意事項後提出檢舉，另亦可利用北市警政APP或將檢舉資料親送至警察機關提出檢舉。 ,16585,111-05-10 14:14,112-12-27 13:56,臺北市政府警察局交通警察大隊
2024-01-11 14:49:49,https://police.gov.taipei/News_Content.aspx?n=8D43510FCC9EE11C&sms=87415A8B9CE81B16&s=AA838AF077D5CAAD,紅線禁止停車有無時間規定？暨車輛停放在紅線外側，是否屬違規行為？, 依據「道路交通標誌標線號誌設置規則」第169條規定：「禁止臨時停車線，用以指示禁止臨時停車路段，以劃設於道路緣石正面或頂面為原則，無緣石之道路得標繪於路面上，距路面邊緣以30公分為度。……本標線禁止時間為全日24小時，如有縮短之必要時， 應以標誌及附牌標示之。」暨「道路交通安全規則」第112條第1項第1款規定：「汽車在禁止臨時停車處所不得停車。」另內政部警政署92年10月21日警署交字第0920149705號函釋示說明，依「道路交通管理處罰條例」第56條第1項第4項規定：「在設有禁止停車標誌、標線之處所停車者。」按其意旨車輛停放在劃有禁止停車線之路段時，其違規事實即已存在；是以，無論車輛停放位置係道路範圍內側或外側，或其車體之前(後)懸部分，占用禁停標線長度多少，與違規行為之成立無關；倘車輛停於道路範圍內，遵守前列相關規定辦理，則無違反道路交通管理事件之虞。 ,78562,110-11-24 17:34,112-12-27 13:56,臺北市政府警察局交通警察大隊
2024-01-11 14:49:49,https://police.gov.taipei/News_Content.aspx?n=8D43510FCC9EE11C&sms=87415A8B9CE81B16&s=087FDAFC7D1D47C7,若停車格上有寫警用兩字，請問一般市民停放屬於違停嗎？, 依「道路交通標誌標線號誌設置規則」第190條規定，專用性停車位，其專用車種及適用時機由主管機關視實際需要設置，其地面應加繪白色專用車輛標字，並得配合設置標誌告示。警用停車位，依上開規定屬於專用性車位，當限制一般車種停放，違規停放者，應依「道路交通管理處罰條例」第56條第1項第9款，以停車車種不依規定製單處罰。 ,22167,110-11-24 17:11,112-12-27 13:56,臺北市政府警察局交通警察大隊
2024-01-11 14:49:51,https://police.gov.taipei/News_Content.aspx?n=8D43510FCC9EE11C&sms=87415A8B9CE81B16&s=33A0F6B0CCE6303C,非執勤時，警車是否可停一般停車格?, 查本市停車格，依道路交通標誌標線號誌設置規則規定，並無禁止警車、偵防車等公務車輛停放，於非執勤時亦同，惟停放於道路收費停車處所時，仍應依規定繳費，違者由停車主管機關依道路交通管理處罰條例第56條第3項處置。 ,13959,110-11-24 17:13,112-12-27 13:56,臺北市政府警察局交通警察大隊
2024-01-11 14:49:54,https://police.gov.taipei/News_Content.aspx?n=8D43510FCC9EE11C&sms=87415A8B9CE81B16&s=6D2A56D9CBDB4065,車輛遭違規拖吊如何查詢？如何領車？, 一、民眾違規停車遭取締拖吊移置，除可透過違規停車現場地面書寫之保管場電話、名稱、車號，查詢車輛移置保管地點外，亦可透過「臺北市交通大隊車輛拖吊查詢系統」輸入車號查詢，將回復告知車輛保管場名稱、地址、聯絡電話等資訊。二、領車領車時應請民眾辦妥下列事項：（一）出示行車執照、駕駛執照或其他證明文件。（二）若無行車執照時，須提示車輛原始證明（出廠及檢驗證明）或足以證明該車輛來源之具體可信資料，並填寫切結書。（三）繳納移置費及保管費。繳納移置費及保管費。小型汽車需繳交移置費900元/次，保管費100元/半日、機車需繳交移置費200元/次，保管費25元/半日；車輛經移置至保管場未逾1小時者，免收保管費（以車輛進場時間起算），1小時以上12小時以下者，以半日計費，每半日（12小時）計費壹次。（四）保管場人員於收取移置費及保管費後，應開立經核章之「臺北市政府交通局妨礙道路交通車輛移置及保管費違規罰鍰收據」交付領車人。 ,17118,112-06-02 08:08,112-12-27 13:56,臺北市政府警察局交通警察大隊
2024-01-11 14:49:56,https://police.gov.taipei/News_Content.aspx?n=8D43510FCC9EE11C&sms=87415A8B9CE81B16&s=BF29726D7838DBEB,大型重型機車可以行駛慢車道嗎？," 一、依「道路交通標誌標線號誌設置規則」第183條之1規定，快慢車道分隔線，係用以指示快車道外側邊緣之位置，劃分快車道與慢車道之界線。其線型為白實線，線寬為10公分。 二、依據「道路交通安全規則」第95條第2項規定「四輪以上汽車及大型重型機車在劃有快慢車道分隔線之道路行駛，除起駛、準備轉彎、準備停車或臨時停車，不得行駛慢車道。但設有快慢車道分隔島之道路不在此限。」爰此，大型重型機車除起駛、準備轉彎、準備停車或臨時停車，不得行駛慢車道，違者，可依「道路交通管理處罰條例」第45條第1項第4款舉發，處駕駛人新臺幣600元以上1,800元以下罰鍰。 ",18397,110-11-24 17:36,112-12-27 13:56,臺北市政府警察局交通警察大隊
