Time,Url,Question,Answer,點閱數,資料更新,資料檢視,資料維護
2024-01-11 14:49:58,https://police.gov.taipei/News_Content.aspx?n=8D43510FCC9EE11C&sms=87415A8B9CE81B16&s=57419C472E94BCE6,有關民眾行駛道路遇見警備車、消防車、救護車及工程救險車執行緊急任務而未禮讓行駛，有何罰則？, （一）有關禮讓特種車輛之規定 1、道路交通安全規則第93條第2項規定：消防車、救護車、警備車、工程救險車及毒性化學物質災害事故應變車執行任務時，得不受前項行車速度之限制，且於開啟警示燈及警鳴器執行緊急任務時，得不受標誌、標線及號誌指示之限制。 2、道路交通安全規則第101條第3項規定：汽車聞有消防車、救護車、警備車、工程救險車、毒性化學物質災害事故應變車等執行緊急任務車輛之警號時，應依下列規定避讓行駛： （1）聞有執行緊急任務車輛之警號時，不論來自何方，均應立即避讓，並不得在後跟隨急駛、併駛或超越，亦不得駛過在救火時放置於路上之消防水帶。 （2）在同向或雙向僅有一車道之路段，應即減速慢行向右緊靠道路右側避讓，並暫時停車於適當地點，供執行緊急任務車輛超越。 （3）在同向二車道以上路段，與執行緊急任務車輛同車道之前車，應即向相鄰車道或路側避讓，相鄰車道之車輛應減速配合避讓，並作隨時停車之準備。 （4）執行緊急任務車輛得利用相鄰二車道間之車道線行駛，而在車道線左右兩側車道之車輛，應即減速慢行分向左右兩側車道避讓，並作隨時停車之準備。 （5）執行緊急任務車輛行經交岔路口時，已進入路口之車輛應駛離至不妨害執行緊急任務車輛行進動線之地點；同向以外未進入路口車輛應減速暫停，不得搶快進入路口，以避讓執行緊急任務車輛先行。 4、道路交通安全規則第129條規定：慢車行駛或停止時，聞消防車、警備車、救護車、工程救險車、毒性化學物質災害事故應變車警號，應立即靠道路右側避讓；於單行道應靠道路兩側避讓。 （二）相關罰則規定如下 1、道路交通管理處罰條例第7之2條第1項第4款規定：「聞消防車、救護車、警備車、工程救險車、毒性化學物質災害事故應變車之警號不立即避讓」，得對汽車所有人逕行舉發。 2、道路交通管理處罰條例第45條第2項規定：「聞消防車、救護車、警備車、工程救險車、毒性化學物質災害事故應變車之警號，不立即避讓者，處汽車駕駛人新臺幣三千六百元罰鍰，並吊銷駕駛執照。」，第3項規定「前項情形致人死傷者，處汽車駕駛人新臺幣六千元以上九萬元以下罰鍰，並吊銷駕駛執照。」。 3、道路交通管理處罰條例第74條第1項第6款規定：「聞消防車、警備車、救護車或工程救險車、毒性化學物質災害事故應變車之警號不立即避讓」，處慢車駕駛人新臺幣300元以上600元以下罰鍰。  ,19210,111-04-01 18:29,112-12-27 13:56,臺北市政府警察局交通警察大隊
2024-01-11 14:50:00,https://police.gov.taipei/News_Content.aspx?n=8D43510FCC9EE11C&sms=87415A8B9CE81B16&s=A67AF6C7917E0BF5,配戴安全帽相關法律規定為何？," 一、依「道路交通安全規則」第88條第2項規定：「機車駕駛人及附載座人應依下列規定配戴安全帽： (一)安全帽應為乘坐機車用之安全帽，經經濟部標準檢驗局檢驗合格，並於帽體貼有商品檢驗標識。 (二)帽體及相關配件必須齊全，並無毀損、鬆脫或變更之情事。 (三)配帶時安全帽應正面朝前及位置正確，於顎下繫緊扣環，安全帽並應適合頭形，穩固戴在頭上，不致上下左右晃動，且不可遮蔽視線。 二、按「道路交通管理處罰條例」第31條第6項規定：「機車駕駛人或附載座人未依規定戴安全帽者，處駕駛人新臺幣500元罰鍰。」 三、「高速公路及快速公路交通管制規則」第20條規定，大型重型機車行駛於快速公路，除該規則另有規定外，應比照小型車行駛規定。駕駛人及附載座人均應依「道路交通安全規則」第88條第2項規定配戴安全帽，且其安全帽應為全面式或露臉式，違者依「道路交通管理處罰條例」第33條第3項規定，處駕駛人新臺幣600以上1,200元以下罰鍰。 ",53608,111-04-01 18:32,112-12-27 13:56,臺北市政府警察局交通警察大隊
2024-01-11 14:50:03,https://police.gov.taipei/News_Content.aspx?n=8D43510FCC9EE11C&sms=87415A8B9CE81B16&s=F718C388EA969AB8,酒測值多少會被取締？罰鍰多少？, (一)依照「道路交通安全規則」第114條規定：飲用酒類或其他類似物後其吐氣所含酒精濃度達每公升0.15毫克或血液中酒精濃度達0.03%者，即違反111年3月31日施行新修正「道路交通管理處罰條例」第35條規定，機車駕駛人處新臺幣1.5萬元以上9萬元以下罰鍰，汽車駕駛人處新臺幣3萬元以上12萬元以下罰鍰，並均當場移置保管該汽機車、吊扣其駕駛執照1年至2年及吊扣該汽機車牌照二年。 (二)吐氣所含酒精濃度達每公升0.25毫克或血液中酒精濃度達0.05%以上者，即違反「刑法」第185條之3不能安全駕駛罪，處三年以下有期徒刑，得併科30萬元以下罰金。 ,466126,111-03-31 09:10,112-12-27 13:56,臺北市政府警察局交通警察大隊
2024-01-11 14:50:05,https://police.gov.taipei/News_Content.aspx?n=8D43510FCC9EE11C&sms=87415A8B9CE81B16&s=D839121732F27815,何謂標線型人行道？," 一、依據「道路交通管理處罰條例」(下稱處罰條例)第3條第3款規定，人行道指為專供行人通行之騎樓、走廊，及劃設供行人行走之地面道路…。」暨「道路交通標誌標線號誌設置規則」第174條之3規定「人行道標線，用以指示路面上僅限於行人行走之專用道，車輛不得進入。」標線型人行道與一般實體人行道無異。 二、另駕車違規行駛人行道者，違反處罰條例第45條第1項第6款規定，處駕駛人新臺幣（以下同）600元以上1,800元以下罰鍰；違規臨時停車者，違反同條例第55條第1項第1款規定，處駕駛人300元以上600元以下罰鍰；違規停車者，違反同條例第56條第1項第1款規定，處駕駛人600元以上1,200元以下罰鍰。 ",15685,110-11-24 17:28,112-12-27 13:56,臺北市政府警察局交通警察大隊
2024-01-11 14:50:07,https://police.gov.taipei/News_Content.aspx?n=8D43510FCC9EE11C&sms=87415A8B9CE81B16&s=EC1490BE0390125A,有關機車駕駛人為躲避烈日直射而將車輛停置於違規（臨時）停車處所停等紅燈。, 一、 依「道路交通安全規則」第111條規定，機車臨時停車，應依車輛順行方向緊靠道路邊緣。倘機車駕駛人為躲避烈日直射而將車輛停置於陰涼處停等紅燈，仍應依車輛順行方向緊靠道路右側，且不妨礙其他人、車通行為宜。 二、 如機車駕駛人為躲避烈日直射而將車輛停置於違規（臨時）停車處所停等紅燈，依「違反道路交通管理事件統一裁罰基準及處理細則」第12條第1項第5款「駕駛汽車因上、下客、貨，致有本條例第55條之情形，惟尚無妨礙其他人、車通行」及第15款規定「因客觀具體事實，致違反本條例規定係出於不得已之行為」，依個案具體情形判斷，除該違規（臨時）停車行為嚴重危害交通安全、秩序外，對情節輕微者，得施以勸導，免予舉發。 ,19430,111-04-01 18:35,112-12-27 13:56,臺北市政府警察局交通警察大隊
2024-01-11 14:50:07,https://police.gov.taipei/News_Content.aspx?n=8D43510FCC9EE11C&sms=87415A8B9CE81B16&s=1570B271F29CB092,自行車可否酒駕?有無處罰規定?," (一)依「道路交通管理處罰條例」第73條第2項規定，慢車駕駛人酒精濃度超過規定標準，處新臺幣1,200元以上2,400元罰鍰。如慢車駕駛人拒絕接受酒精濃度測試之檢定者，處新臺幣4,800元罰鍰。(二)另依「道路交通安全規則」第120條規定，酒精濃度超過規定標準係指吐氣所含酒精濃度達每公升0.15毫克或血液中酒精濃度達百分之0.03以上。(三)為維護您自身安全於其他用路人之安全，建請您酒後切勿騎乘交通工具。  ",17295,112-01-10 10:24,112-12-27 13:56,臺北市政府警察局交通警察大隊
2024-01-11 14:50:09,https://police.gov.taipei/News_Content.aspx?n=8D43510FCC9EE11C&sms=87415A8B9CE81B16&s=B3F0E2F32BD19CDF,民眾抱怨發生交通事故時，因現場無監視器，無法釐清肇事責任, (一)目前警察機關建置監視錄影系統，係依據其轄區狀況、建置目的、攝影機數量及其攝向之專業評估，惟因預算及設備上限制（如解析度、光線及鏡頭等），現有監視錄影系統之監視範圍仍無法涵蓋所有視角，說明如下： 1、轄區狀況部分，係以治安與交通要點、治安顧慮場所、聯外道路、交界處所警力不及之處，規劃建置監視錄影系統處所，無法每一路口均建置。 2、建置目的部分，係為維護治安及監控交通流量，而建置不同監控範圍及解析度之監視器，並依其需求評估設置數量及攝向，故無法涵蓋所有視角。 (二)為鼓勵民眾提供臺北市轄內道路交通事故錄影資料，以確保民眾生命、身體安全及釐清肇事原因，民眾如於本市拍到致人受傷或死亡之交通事故，提供交通事故動態錄影檔案予警察機關，該影像與警方既有蒐集之證據無重複性，且有助釐清肇事原因，依下列標準(事故嚴重程度)核發獎勵金： 1.致人受傷案件：每件新臺幣一千元整。  2.致人重傷案件：每件新臺幣三千元整。  3.致人死亡案件：每件新臺幣五千元整。 另民眾如提供肇事致人死傷逃逸案件之車號或影像線索，幫助警方偵破肇事逃逸案件，則依下列標準(事故嚴重程度)核發獎勵金： 1.致人受傷案件：每件新臺幣三千元整。  2.致人重傷案件：每件新臺幣六千元整。  3.致人死亡案件：每件新臺幣一萬元整。 (三)調閱監視錄影畫面固為輔助警察機關處理交通事故之工具，但並非唯一方法，目前處理員警於處理交通事故時，仍會訪查現場目擊者及當事人等證詞、紀錄現場環境照明、標線、號誌狀況、遺留於路面上跡證（如刮地痕、落土）、進行現場丈量測繪、鑑定肇事車輛（如血跡、油漆、纖維），並配合當事人傷勢情形及酒測結果等資料，製作道路交通事故調查表，以綜合研判肇事責任。 ,9638,111-04-01 15:28,112-12-27 13:56,臺北市政府警察局交通警察大隊
2024-01-11 14:50:10,https://police.gov.taipei/News_Content.aspx?n=8D43510FCC9EE11C&sms=87415A8B9CE81B16&s=2D81B0B815EA417F,自行車可否騎乘於騎樓、人行道？," 一、依「道路交通管理處罰條例」（下稱處罰條例）等相關法規，人行道係專供行人通行之用，除非在不妨礙行人通行及行車安全無虞之情況下，主管機關得於人行道設有標誌及標線之路段(行人與自行車共道)，例外開放自行車行駛外，其餘人行道禁止騎乘自行車，且在人車共道之路段自行車亦須禮讓行人優先通行；且依同條例第3條第3款規定，「騎樓」係屬人行道，除有例外開放外，自不得於騎樓騎乘自行車。二、另於未開放自行車行駛人行道的路段，自行車依規定應在劃設之自行車專用道或慢車道上靠右順序行駛，在未劃設慢車道之道路，應靠右側路邊行駛，且不得侵入快車道或人行道行駛，並不得在禁止穿越地段穿越道路，如有違規騎乘自行車於未開放之騎樓、人行道路段，依處罰條例第74條第1項第5款規定，處新臺幣300元以上1,200元以下之罰鍰。 ",19504,112-01-10 10:25,112-12-27 13:56,臺北市政府警察局交通警察大隊
2024-01-11 14:50:10,https://police.gov.taipei/News_Content.aspx?n=8D43510FCC9EE11C&sms=87415A8B9CE81B16&s=F89054BE89C07DB4,交通違規簡訊服務常見問答, 交通違規簡訊服務常見問題集 ,8823,110-11-24 17:30,112-12-27 13:56,臺北市政府警察局交通警察大隊
2024-01-11 14:50:12,https://police.gov.taipei/News_Content.aspx?n=8D43510FCC9EE11C&sms=87415A8B9CE81B16&s=9EC0F9329AF67B57,慢車是否得牽引其他車輛併行？慢車裝載有無相關規定？, 一、依據「道路交通安全規則」127條：「慢車不得牽引其他車輛或攀附汽車隨行。」，爰前揭規定慢車不得牽引於其他車輛上併行。二、另依同規則第122條第1項：「慢車之裝載，應依下列規定：１、自行車不得附載坐人。但腳踏自行車或電動輔助自行車依規定附載一名幼童者，不在此限。２、自行車載物高度不得超過駕駛人肩部，重量不得超過二十公斤，長度不得伸出前輪，並不得伸出車後一公尺，寬度不得超過車把手。３、其他慢車載客不得超過二人。４、其他慢車載重不得超過五百公斤，高度不得超過駕駛人肩部，寬度不得伸出車身兩側，長度不得伸出車後二公尺。並不得附載乘客。５、手拉（推）貨車載重不得超過一千公斤，高度自地面起不得超過二．五公尺，寬度不得伸出車身兩側，連同載物全長不得超過四公尺。６、獸力行駛車輛載重不得超過二千公斤，高度自地面起不得超過二．五公尺，寬度不得伸出車身兩側，載物全長不得超過四公尺。７、裝載容易滲漏、飛散、有惡臭氣味及危險性之貨物，應予嚴密封固或適當裝置。８、裝載禽獸不得重疊或倒置。９、裝載貨物應捆紮結實。」 ,5828,112-01-10 10:29,112-12-27 13:56,臺北市政府警察局交通警察大隊
2024-01-11 14:50:12,https://police.gov.taipei/News_Content.aspx?n=8D43510FCC9EE11C&sms=87415A8B9CE81B16&s=54389E3332C47277,交通事故後可申請到那些資料？可以在臺北市申請到其他縣市的交通事故資料嗎？, （一）依「道路交通事故處理辦法」第13條規定，道路交通事故案件當事人或利害關係人，得於下列期間向警察機關申請閱覽或提供相關資料： 1、於事故現場得申請提供道路交通事故當事人登記聯單。 2、於事故七日後得申請閱覽或提供現場圖、現場照片。 3、於事故三十日後得申請提供道路交通事故初步分析研判表。 （二）為便利民眾申請其他縣市交通事故資料，目前內政部警政署已推動單一窗口線上申辦機制（僅限申辦A1及A2類交通事故案件，單純財損之A3類交通事故尚未納入單一窗口申辦項目），您僅需至內政部警政署網頁（https://tm2.npa.gov.tw/NM105-505ClientRWD2/TM02A01Q_01.jsp）-線上申辦-交通事故資料申請系統-交通事故案件申請，輸入當事人姓名、身分證號等資訊後，並點選領件單位，就能由處理單位將申請資料寄送至指定之領件單位，待您接獲通知後，即可持證件就近取件，減少舟車往返之不便。   ,33628,111-04-01 15:31,112-12-27 13:56,臺北市政府警察局交通警察大隊
2024-01-11 14:50:14,https://police.gov.taipei/News_Content.aspx?n=8D43510FCC9EE11C&sms=87415A8B9CE81B16&s=E93F77D7F9CB194A,深夜0-6時可否於紅線路段停車，警方執法標準為何？," 一、依據「道路交通管理處罰條例」第56條第1項規定：「汽車駕駛人停車時，有下列情形之一者，處新臺幣600以上1,200元以下罰鍰：一、在禁止臨時停車處所停車。」。 二、惟依據「違反道路交通管理事件統一裁罰基準及處理細則」第12條第1項規定「行為人有下列情形之一，而未嚴重危害交通安全、秩序，且情節輕微，以不舉發為適當者，交通勤務警察或依法令執行交通稽查任務人員得對其施以勸導，免予舉發……六、深夜時段（零至六時）停車，有本條例第56條第1項之情形。但於身心障礙專用停車位違規停車或停車顯有妨礙消防安全之虞，或妨礙其他人車通行經人檢舉者，不在此限。」 三、深夜時段(0-6時)違規停車，除有本條例第56條第1項於身心障礙專用停車位違規停車、停車顯有妨礙消防安全之虞，或妨礙其他人車通行經人檢舉者及違反本條例第56條第2項併排停車等4種情形，員警依法應予製單舉發外，其餘因未嚴重危害交通安全、秩序或發生交通事故，以不舉發為適當者，得施予勸導。 四、員警執行勸導勤務時，應先斟酌個案事實、違反情節及行為人之陳述，對得施以勸導之對象，應當場告知其違規事實，指導其法令規定與正確之駕駛或通行方法，並勸告其避免再次違反。施以勸導時，應選擇於無礙交通之處實施，並作成書面紀錄，請其簽名。 ",35712,110-11-24 17:32,112-12-27 13:56,臺北市政府警察局交通警察大隊
2024-01-11 14:50:15,https://police.gov.taipei/News_Content.aspx?n=8D43510FCC9EE11C&sms=87415A8B9CE81B16&s=CC8AFCE61BE1FEDF,那些交通違規行為可以勸導？, 依據違反道路交通管理事件統一裁罰基準及處理細則第十二條規定：行為人有下列情形之一，而未嚴重危害交通安全、秩序，且情節輕微，以不舉發為適當者，交通勤務警察或依法令執行交通稽查任務人員得對其施以勸導，免予舉發： 一、有本條例第14條第2項第2款、第25條第2項、第31條第5項、第31條之1第3項、第41條、第44條第1項第1款、第3款至第7款、第52條、第69條第2項、第71條、第72條第1項、第73條第1項第1款至第3款、第5款、第74條第1項、第76條第1項、第2項、第81條、第82條第1項第1款或第84條之情形。 二、駕駛四輪以上汽車於號誌燈號變換之際，因未能依號誌指示及時停止，致前懸部分伸越在機車停等區內，惟前輪尚未進入該停等區內。 三、駕駛汽車於號誌燈號變換之際，因未能依號誌指示及時停止，致前懸部分伸越停止線，惟前輪尚未超越該停止線。 四、駕駛大型車輛在多車道右轉彎，因車輛本身、道路或交通狀況等限制，如於外側車道顯無法安全完成，致未能先駛入外側車道。 五、駕駛汽車因上、下客、貨，致有本條例第五十五條之情形，惟尚無妨礙其他人、車通行。 六、深夜時段（零至六時）停車，有本條例第五十六條第一項之情形。但於身心障礙專用停車位違規停車或停車顯有妨礙消防安全之虞，或妨礙其他人車通行經人檢舉者，不在此限。 七、駕駛汽車因交通管制設施設置不明確或受他物遮蔽，致違反該設施之指示。 八、駕駛汽車在交通管制設施變換之處所，致無法即時依變換後之設施指示行駛。 九、駕駛汽車隨行於大型車輛後方，因視線受阻，致無法即時依標誌、標線、號誌之指示行駛。 十、駕駛汽車因緊急救護傷患或接送身心障礙者上、下車，致違反本條例規定。 十一、駕駛汽車行車速度超過規定之最高時速未逾十公里。 十二、駕駛汽車或慢車經測試檢定，其吐氣所含酒精濃度超過規定之標準值未逾每公升0.02毫克。 十三、駕駛汽車裝載貨物超過核定之總重量或總聯結重量，未逾百分之十。 十四、駕駛汽車因閃避突發之意外狀況，致違反本條例規定。 十五、因客觀具體事實，致違反本條例規定係出於不得已之行為。 十六、其他經交通部及內政部會商核定之情形。 行為人發生交通事故有前項規定行為，除本條例第14條第2項第2款、第25條第2項、第69條第2項或第71條之情形外，仍得舉發。 ,25383,111-04-01 18:36,112-12-27 13:56,臺北市政府警察局交通警察大隊
2024-01-11 14:50:17,https://police.gov.taipei/News_Content.aspx?n=8D43510FCC9EE11C&sms=87415A8B9CE81B16&s=5A60A8DC3F5FC508,車輛於高架橋上故障拖吊相關事宜, 民眾所駕駛之車輛，若於本市各高架道路發生故障，需由6.5噸以上大型拖吊車進行拖吊移置時，得撥打110，由員警聯繫本大隊勤務指揮中心，將立即派遣大型拖吊車至故障地點協助移置。 ,3014,110-11-24 17:34,112-12-27 13:56,臺北市政府警察局交通警察大隊
2024-01-11 14:50:17,https://police.gov.taipei/News_Content.aspx?n=8D43510FCC9EE11C&sms=87415A8B9CE81B16&s=0EA07ACC54CEC2B7,有關民眾因不知道駕駛行為有違規情事，於事後密集收到多張罰單造成民怨，警察局有無因應作為?, 為避免民眾有多次違規遭舉發情形，臺北市政府警察局訂有2項措施，提前通知違規民眾，分別為「遭多次檢舉違規停車案件於7日內以電話、書面或到址通知」及「登錄遭逕行舉發交通違規簡訊系統通知」： (一) 針對遭民眾檢舉違規停車案件，自105年11月1日對於同一車輛於同一地點被多次檢舉違規停車（7日內被檢舉4次以上）者，將由轄區分局於7日內以電話、書面或到址(擇一方式)通知車主有連續違規情形。惟同一車輛經通知後，如再接獲同一地點相同之違規案件，不再予重複通知。 (二) 針對遭逕行舉發交通違規案件，臺北市政府警察局訂有「交通違規簡訊通知服務措施」，舉凡員警經由科學儀器採證逕行舉發交通違規之案件(含民眾檢舉)，只要經過申請，均會以簡訊通知車主，俾利車主提前知道自己交通違規外，亦可避免在同一危險路段多次重複違規，以有效降低行車危害，您得自臺北市政府警察局交通警察大隊首頁申辦服務或熱門服務項下點選交通違規便民服務網之交通違規簡訊服務https://smsweb.tcpd.gov.tw/NEWSmsWeb/#/sms，進行申辦程序。 ,15296,110-11-24 17:17,112-12-27 13:56,臺北市政府警察局交通警察大隊
2024-01-11 14:50:17,https://police.gov.taipei/News_Content.aspx?n=8D43510FCC9EE11C&sms=87415A8B9CE81B16&s=FECB21683500B453,民眾在計程車(含多元化計程車)上遺失物品該如何協尋？, 一、臺北市政府警察局交通警察大隊服務內容及流程： 1.申請方式：電話申請或親自到場(可委託他人辦理)。 2.承辦單位：交通警察大隊綜合組。 3.連絡電話：02-23116409(24小時)，該專線下班時間亦可撥打，並會自動轉接勤務指揮中心協助。 4.辦理流程： (1)受理乘客乘坐計程車遺失財物之電話或親自報案。 (2)填寫受理報案紀錄表。 (3)以乘客提供之線索查詢駕駛人姓名、車號或車行名稱。 (4)連絡駕駛人或車行協尋失物。 (5)如有尋獲則代連絡歸還手續並具領結案，未尋獲將查處情形回復當事人。　　 如仍有疑問，上班時間請撥電話 (02)23116409，由專人為您服務。 二、警政署警廣交通網廣播協尋： 1.上網登錄協尋，網址：https://www.pbs.gov.tw/cht/index.php?code=list&ids=64(路徑為『中華民國內政部警政署警察廣播電臺』→便民服務→協尋招領服務→協尋遺失物) 2.廣播協尋： 答：北部地區民眾可撥打02-23880066失物協尋專線，向電臺服務中心查尋及登錄遺失物品，經電臺查核登錄系統後於節目中廣播協尋。 ,46671,111-04-27 10:35,112-12-27 13:56,臺北市政府警察局交通警察大隊
2024-01-11 14:50:19,https://police.gov.taipei/News_Content.aspx?n=8D43510FCC9EE11C&sms=87415A8B9CE81B16&s=9A5D91C08842530F,自行車遭違規拖吊如何查詢？如何領車？, 一、民眾所有之自行車違規停車遭取締拖吊移置，可透過違規停車現場地面書寫之保管場電話、名稱，查詢車輛移置保管地點；亦可進入停管處網站「自行車拖吊專區查詢系統」點選拖吊日期及違規地點或自行車出廠車身編號即可查到自行車照片和被移置到哪個保管場。 二、領車時應請民眾辦妥下列事項： （一）提供領車人身分證或其他足以證明身分的證件（須具備相片、身分證號碼、出生日期、居住地址等資料），並出示自行車鑰匙或相關足資證明文件（如學校識別碼或出廠識別碼）。 （二）填寫領車單並登錄身分資料，由保管場人員將所領回車輛拍照留存。 （三）自107年度起，保管場人員於收取移置費及保管費後，應開立經核章之「臺北市政府交通局妨礙道路交通車輛移置及保管費違規罰鍰收據」交付領車人。 ,2239,111-04-01 18:39,112-12-27 13:56,臺北市政府警察局交通警察大隊
